********************************************************************************
MEME - Motif discovery tool
********************************************************************************
MEME version 4.11.2 (Release date: Thu May 05 14:58:55 2016 -0700)

For further information on how to interpret these results or to get
a copy of the MEME software please access http://meme-suite.org .

This file may be used as input to the MAST algorithm for searching
sequence databases for matches to groups of motifs.  MAST is available
for interactive use and downloading at http://meme-suite.org .
********************************************************************************


********************************************************************************
REFERENCE
********************************************************************************
If you use this program in your research, please cite:

Timothy L. Bailey and Charles Elkan,
"Fitting a mixture model by expectation maximization to discover
motifs in biopolymers", Proceedings of the Second International
Conference on Intelligent Systems for Molecular Biology, pp. 28-36,
AAAI Press, Menlo Park, California, 1994.
********************************************************************************


********************************************************************************
TRAINING SET
********************************************************************************
DATAFILE= BirA_Chlorobiales.fasta
ALPHABET= ACGT
Sequence name            Weight Length  Sequence name            Weight Length  
-------------            ------ ------  -------------            ------ ------  
Cpar_2017(birA)Score=9.4 1.0000     32  Cag_0077(birA)Score=7.8, 1.0000     32  
CferDRAFT_1619(birA)Scor 1.0000     32  Clim_2431(birA)Score=8.9 1.0000     32  
Cphamn1_2459(birA)Score= 1.0000     32  Cpha266_0111(birA)Score= 1.0000     32  
Plut_2071(birA)Score=9.4 1.0000     32  Ppha_2840(birA)Score=8,P 1.0000     32  
Paes_2191(birA)Score=8.2 1.0000     32  Cvib_1712(birA)Score=9.4 1.0000     32  
********************************************************************************

********************************************************************************
COMMAND LINE SUMMARY
********************************************************************************
This information can also be useful in the event you wish to report a
problem with the MEME software.

command: meme -dna BirA_Chlorobiales.fasta -oc BirA_Chlorobiales 

model:  mod=         zoops    nmotifs=         1    evt=           inf
object function=  E-value of product of p-values
width:  minw=            8    maxw=           32
width:  wg=             11    ws=              1    endgaps=       yes
nsites: minsites=        2    maxsites=       10    wnsites=       0.8
theta:  spmap=         uni    spfuzz=        0.5
global: substring=     yes    branching=      no    wbranch=        no
em:     prior=   dirichlet    b=            0.01    maxiter=        50
        distance=    1e-05
data:   n=             320    N=              10    shuffle=        -1
strands: +
sample: seed=            0    ctfrac=         -1    maxwords=       -1
Letter frequencies in dataset:
A 0.275 C 0.219 G 0.212 T 0.294 
Background letter frequencies (from dataset with add-one prior applied):
A 0.275 C 0.219 G 0.213 T 0.293 
********************************************************************************


********************************************************************************
MOTIF  1 MEME	width =  32  sites =  10  llr = 184  E-value = 1.7e-040
********************************************************************************
--------------------------------------------------------------------------------
	Motif 1 Description
--------------------------------------------------------------------------------
Simplified        A  ::1:1aa:3333333333333333:::1a:96
pos.-specific     C  ::::9::a2222222222222222:::2:9::
probability       G  ::9:::::2222222222222222a::6::12
matrix            T  aa:a::::3333333333333333:aa1:1:2

         bits    2.2        *                *       
                 2.0        *                *       
                 1.8 ********                *** **  
                 1.6 ********                *** **  
Relative         1.3 ********                *** *** 
Entropy          1.1 ********                *** *** 
(26.5 bits)      0.9 ********                *** *** 
                 0.7 ********                ******* 
                 0.4 ********                ********
                 0.2 ********                ********
                 0.0 --------------------------------

Multilevel           TTGTCAACTTTTTTTTTTTTTTTTGTTGACAA
consensus                    AAAAAAAAAAAAAAAA   C   G
sequence                     CCCCCCCCCCCCCCCC       T
                             GGGGGGGGGGGGGGGG        
--------------------------------------------------------------------------------

--------------------------------------------------------------------------------
	Motif 1 sites sorted by position p-value
--------------------------------------------------------------------------------
Sequence name             Start   P-value                          Site            
-------------             ----- ---------            --------------------------------
Cvib_1712(birA)Score=9.4      1  3.45e-10          . TTGTCAACNNNNNNNNNNNNNNNNGTTGACAA           
Plut_2071(birA)Score=9.4      1  3.45e-10          . TTGTCAACNNNNNNNNNNNNNNNNGTTGACAA           
Cphamn1_2459(birA)Score=      1  3.45e-10          . TTGTCAACNNNNNNNNNNNNNNNNGTTGACAA           
Cpar_2017(birA)Score=9.4      1  3.45e-10          . TTGTCAACNNNNNNNNNNNNNNNNGTTGACAA           
Clim_2431(birA)Score=8.9      1  6.12e-10          . TTGTCAACNNNNNNNNNNNNNNNNGTTGACAG           
Cpha266_0111(birA)Score=      1  2.79e-09          . TTGTCAACNNNNNNNNNNNNNNNNGTTTACAA           
CferDRAFT_1619(birA)Scor      1  3.17e-09          . TTGTCAACNNNNNNNNNNNNNNNNGTTCACAT           
Paes_2191(birA)Score=8.2      1  4.72e-09          . TTGTCAACNNNNNNNNNNNNNNNNGTTGACGG           
Ppha_2840(birA)Score=8,P      1  1.82e-08          . TTGTAAACNNNNNNNNNNNNNNNNGTTCACAT           
Cag_0077(birA)Score=7.8,      1  4.80e-08          . TTATCAACNNNNNNNNNNNNNNNNGTTAATAA           
--------------------------------------------------------------------------------

--------------------------------------------------------------------------------
	Motif 1 block diagrams
--------------------------------------------------------------------------------
SEQUENCE NAME            POSITION P-VALUE  MOTIF DIAGRAM
-------------            ----------------  -------------
Cvib_1712(birA)Score=9.4          3.4e-10  [+1]
Plut_2071(birA)Score=9.4          3.4e-10  [+1]
Cphamn1_2459(birA)Score=          3.4e-10  [+1]
Cpar_2017(birA)Score=9.4          3.4e-10  [+1]
Clim_2431(birA)Score=8.9          6.1e-10  [+1]
Cpha266_0111(birA)Score=          2.8e-09  [+1]
CferDRAFT_1619(birA)Scor          3.2e-09  [+1]
Paes_2191(birA)Score=8.2          4.7e-09  [+1]
Ppha_2840(birA)Score=8,P          1.8e-08  [+1]
Cag_0077(birA)Score=7.8,          4.8e-08  [+1]
--------------------------------------------------------------------------------

--------------------------------------------------------------------------------
	Motif 1 in BLOCKS format
--------------------------------------------------------------------------------
BL   MOTIF 1 width=32 seqs=10
Cvib_1712(birA)Score=9.4 (    1) TTGTCAACNNNNNNNNNNNNNNNNGTTGACAA  1 
Plut_2071(birA)Score=9.4 (    1) TTGTCAACNNNNNNNNNNNNNNNNGTTGACAA  1 
Cphamn1_2459(birA)Score= (    1) TTGTCAACNNNNNNNNNNNNNNNNGTTGACAA  1 
Cpar_2017(birA)Score=9.4 (    1) TTGTCAACNNNNNNNNNNNNNNNNGTTGACAA  1 
Clim_2431(birA)Score=8.9 (    1) TTGTCAACNNNNNNNNNNNNNNNNGTTGACAG  1 
Cpha266_0111(birA)Score= (    1) TTGTCAACNNNNNNNNNNNNNNNNGTTTACAA  1 
CferDRAFT_1619(birA)Scor (    1) TTGTCAACNNNNNNNNNNNNNNNNGTTCACAT  1 
Paes_2191(birA)Score=8.2 (    1) TTGTCAACNNNNNNNNNNNNNNNNGTTGACGG  1 
Ppha_2840(birA)Score=8,P (    1) TTGTAAACNNNNNNNNNNNNNNNNGTTCACAT  1 
Cag_0077(birA)Score=7.8, (    1) TTATCAACNNNNNNNNNNNNNNNNGTTAATAA  1 
//

--------------------------------------------------------------------------------

--------------------------------------------------------------------------------
	Motif 1 position-specific scoring matrix
--------------------------------------------------------------------------------
log-odds matrix: alength= 4 w= 32 n= 10 bayes= 0.830075 E= 1.7e-040 
  -997   -997   -997    177 
  -997   -997   -997    177 
  -146   -997    208   -997 
  -997   -997   -997    177 
  -146    204   -997   -997 
   186   -997   -997   -997 
   186   -997   -997   -997 
  -997    219   -997   -997 
     0      0      0      0 
     0      0      0      0 
     0      0      0      0 
     0      0      0      0 
     0      0      0      0 
     0      0      0      0 
     0      0      0      0 
     0      0      0      0 
     0      0      0      0 
     0      0      0      0 
     0      0      0      0 
     0      0      0      0 
     0      0      0      0 
     0      0      0      0 
     0      0      0      0 
     0      0      0      0 
  -997   -997    223   -997 
  -997   -997   -997    177 
  -997   -997   -997    177 
  -146    -13    149   -155 
   186   -997   -997   -997 
  -997    204   -997   -155 
   171   -997   -109   -997 
   113   -997     -9    -55 
--------------------------------------------------------------------------------

--------------------------------------------------------------------------------
	Motif 1 position-specific probability matrix
--------------------------------------------------------------------------------
letter-probability matrix: alength= 4 w= 32 nsites= 10 E= 1.7e-040 
 0.000000  0.000000  0.000000  1.000000 
 0.000000  0.000000  0.000000  1.000000 
 0.100000  0.000000  0.900000  0.000000 
 0.000000  0.000000  0.000000  1.000000 
 0.100000  0.900000  0.000000  0.000000 
 1.000000  0.000000  0.000000  0.000000 
 1.000000  0.000000  0.000000  0.000000 
 0.000000  1.000000  0.000000  0.000000 
 0.274691  0.219136  0.212963  0.293210 
 0.274691  0.219136  0.212963  0.293210 
 0.274691  0.219136  0.212963  0.293210 
 0.274691  0.219136  0.212963  0.293210 
 0.274691  0.219136  0.212963  0.293210 
 0.274691  0.219136  0.212963  0.293210 
 0.274691  0.219136  0.212963  0.293210 
 0.274691  0.219136  0.212963  0.293210 
 0.274691  0.219136  0.212963  0.293210 
 0.274691  0.219136  0.212963  0.293210 
 0.274691  0.219136  0.212963  0.293210 
 0.274691  0.219136  0.212963  0.293210 
 0.274691  0.219136  0.212963  0.293210 
 0.274691  0.219136  0.212963  0.293210 
 0.274691  0.219136  0.212963  0.293210 
 0.274691  0.219136  0.212963  0.293210 
 0.000000  0.000000  1.000000  0.000000 
 0.000000  0.000000  0.000000  1.000000 
 0.000000  0.000000  0.000000  1.000000 
 0.100000  0.200000  0.600000  0.100000 
 1.000000  0.000000  0.000000  0.000000 
 0.000000  0.900000  0.000000  0.100000 
 0.900000  0.000000  0.100000  0.000000 
 0.600000  0.000000  0.200000  0.200000 
--------------------------------------------------------------------------------

--------------------------------------------------------------------------------
	Motif 1 regular expression
--------------------------------------------------------------------------------
TTGTCAAC[TACG][TACG][TACG][TACG][TACG][TACG][TACG][TACG][TACG][TACG][TACG][TACG][TACG][TACG][TACG][TACG]GTT[GC]ACA[AGT]
--------------------------------------------------------------------------------




Time  0.04 secs.

********************************************************************************


********************************************************************************
SUMMARY OF MOTIFS
********************************************************************************

--------------------------------------------------------------------------------
	Combined block diagrams: non-overlapping sites with p-value < 0.0001
--------------------------------------------------------------------------------
SEQUENCE NAME            COMBINED P-VALUE  MOTIF DIAGRAM
-------------            ----------------  -------------
Cpar_2017(birA)Score=9.4         3.45e-10  [+1(3.45e-10)]
Cag_0077(birA)Score=7.8,         4.80e-08  [+1(4.80e-08)]
CferDRAFT_1619(birA)Scor         3.17e-09  [+1(3.17e-09)]
Clim_2431(birA)Score=8.9         6.12e-10  [+1(6.12e-10)]
Cphamn1_2459(birA)Score=         3.45e-10  [+1(3.45e-10)]
Cpha266_0111(birA)Score=         2.79e-09  [+1(2.79e-09)]
Plut_2071(birA)Score=9.4         3.45e-10  [+1(3.45e-10)]
Ppha_2840(birA)Score=8,P         1.82e-08  [+1(1.82e-08)]
Paes_2191(birA)Score=8.2         4.72e-09  [+1(4.72e-09)]
Cvib_1712(birA)Score=9.4         3.45e-10  [+1(3.45e-10)]
--------------------------------------------------------------------------------

********************************************************************************


********************************************************************************
Stopped because requested number of motifs (1) found.
********************************************************************************

CPU: leftraru1

********************************************************************************
