********************************************************************************
MEME - Motif discovery tool
********************************************************************************
MEME version 4.11.2 (Release date: Thu May 05 14:58:55 2016 -0700)

For further information on how to interpret these results or to get
a copy of the MEME software please access http://meme-suite.org .

This file may be used as input to the MAST algorithm for searching
sequence databases for matches to groups of motifs.  MAST is available
for interactive use and downloading at http://meme-suite.org .
********************************************************************************


********************************************************************************
REFERENCE
********************************************************************************
If you use this program in your research, please cite:

Timothy L. Bailey and Charles Elkan,
"Fitting a mixture model by expectation maximization to discover
motifs in biopolymers", Proceedings of the Second International
Conference on Intelligent Systems for Molecular Biology, pp. 28-36,
AAAI Press, Menlo Park, California, 1994.
********************************************************************************


********************************************************************************
TRAINING SET
********************************************************************************
DATAFILE= BirA_Desulfuromonadales.fasta
ALPHABET= ACGT
Sequence name            Weight Length  Sequence name            Weight Length  
-------------            ------ ------  -------------            ------ ------  
Gmet_0842(bioF)Score=8.4 1.0000     32  Gmet_1582(bioB)Score=7.9 1.0000     32  
GSU2629(bioF)Score=8.4,P 1.0000     32  GSU1584(bioB)Score=8.6,P 1.0000     32  
Gura_2242(bioB)Score=8.4 1.0000     32  Gura_3246(bioF)Score=7.7 1.0000     32  
Geob_3008(bioB)Score=8.4 1.0000     32  Geob_2084(bioF)Score=7.1 1.0000     32  
GM21_2164(bioB)Score=8.4 1.0000     32  GM21_3430(bioF)Score=8.4 1.0000     32  
Glov_1662(bioF)Score=7.9 1.0000     32  Glov_2370(bioB)Score=9,P 1.0000     32  
Ppro_2093(bioF)Score=8,P 1.0000     32  Pcar_1666(bioW)Score=8.2 1.0000     32  
Pcar_1458(bioB)Score=8.4 1.0000     32  
********************************************************************************

********************************************************************************
COMMAND LINE SUMMARY
********************************************************************************
This information can also be useful in the event you wish to report a
problem with the MEME software.

command: meme -dna BirA_Desulfuromonadales.fasta -oc BirA_Desulfuromonadales 

model:  mod=         zoops    nmotifs=         1    evt=           inf
object function=  E-value of product of p-values
width:  minw=            8    maxw=           32
width:  wg=             11    ws=              1    endgaps=       yes
nsites: minsites=        2    maxsites=       15    wnsites=       0.8
theta:  spmap=         uni    spfuzz=        0.5
global: substring=     yes    branching=      no    wbranch=        no
em:     prior=   dirichlet    b=            0.01    maxiter=        50
        distance=    1e-05
data:   n=             480    N=              15    shuffle=        -1
strands: +
sample: seed=            0    ctfrac=         -1    maxwords=       -1
Letter frequencies in dataset:
A 0.261 C 0.234 G 0.234 T 0.270 
Background letter frequencies (from dataset with add-one prior applied):
A 0.261 C 0.235 G 0.235 T 0.270 
********************************************************************************


********************************************************************************
MOTIF  1 MEME	width =  32  sites =  15  llr = 319  E-value = 6.6e-090
********************************************************************************
--------------------------------------------------------------------------------
	Motif 1 Description
--------------------------------------------------------------------------------
Simplified        A  1::::aa::333333333333331:::1a:6a
pos.-specific     C  :3::8::a922222222222222::::::a1:
probability       G  ::a::::::222222222222227a::9::3:
matrix            T  97:a2:::1333333333333331:aa:::::

         bits    2.1   *    *                *    *  
                 1.9   ** ***                *** ** *
                 1.7   ** ***                ****** *
                 1.5 * ** ****               ****** *
Relative         1.3 * *******               ****** *
Entropy          1.0 *********               ****** *
(30.7 bits)      0.8 *********              *********
                 0.6 *********              *********
                 0.4 *********              *********
                 0.2 *********              *********
                 0.0 --------------------------------

Multilevel           TTGTCAACCTTTTTTTTTTTTTTGGTTGACAA
consensus             C  T    AAAAAAAAAAAAAA       G 
sequence                      CCCCCCCCCCCCCC         
                              GGGGGGGGGGGGGG         
--------------------------------------------------------------------------------

--------------------------------------------------------------------------------
	Motif 1 sites sorted by position p-value
--------------------------------------------------------------------------------
Sequence name             Start   P-value                          Site            
-------------             ----- ---------            --------------------------------
Glov_2370(bioB)Score=9,P      1  1.64e-11          . TTGTCAACCNNNNNNNNNNNNNNGGTTGACAA           
GM21_3430(bioF)Score=8.4      1  3.12e-11          . TTGTCAACCNNNNNNNNNNNNNNGGTTGACGA           
GSU2629(bioF)Score=8.4,P      1  3.12e-11          . TTGTCAACCNNNNNNNNNNNNNNGGTTGACGA           
Gmet_0842(bioF)Score=8.4      1  3.12e-11          . TTGTCAACCNNNNNNNNNNNNNNGGTTGACGA           
GM21_2164(bioB)Score=8.4      1  4.54e-11          . TCGTCAACCNNNNNNNNNNNNNNGGTTGACAA           
Geob_3008(bioB)Score=8.4      1  4.54e-11          . TCGTCAACCNNNNNNNNNNNNNNGGTTGACAA           
Gura_2242(bioB)Score=8.4      1  4.54e-11          . TCGTCAACCNNNNNNNNNNNNNNGGTTGACAA           
GSU1584(bioB)Score=8.6,P      1  9.53e-11          . TTGTCAACCNNNNNNNNNNNNNNAGTTGACAA           
Pcar_1458(bioB)Score=8.4      1  1.14e-10          . TTGTCAACCNNNNNNNNNNNNNNTGTTGACAA           
Gura_3246(bioF)Score=7.7      1  1.31e-10          . TTGTTAACCNNNNNNNNNNNNNNGGTTGACGA           
Geob_2084(bioF)Score=7.1      1  3.12e-10          . TCGTTAACCNNNNNNNNNNNNNNGGTTGACGA           
Gmet_1582(bioB)Score=7.9      1  4.22e-10          . TTGTTAACCNNNNNNNNNNNNNNAGTTGACAA           
Ppro_2093(bioF)Score=8,P      1  7.41e-10          . TTGTCAACTNNNNNNNNNNNNNNGGTTGACCA           
Pcar_1666(bioW)Score=8.2      1  9.08e-10          . ATGTCAACCNNNNNNNNNNNNNNTGTTGACAA           
Glov_1662(bioF)Score=7.9      1  1.10e-09          . TTGTCAACTNNNNNNNNNNNNNNGGTTAACAA           
--------------------------------------------------------------------------------

--------------------------------------------------------------------------------
	Motif 1 block diagrams
--------------------------------------------------------------------------------
SEQUENCE NAME            POSITION P-VALUE  MOTIF DIAGRAM
-------------            ----------------  -------------
Glov_2370(bioB)Score=9,P          1.6e-11  [+1]
GM21_3430(bioF)Score=8.4          3.1e-11  [+1]
GSU2629(bioF)Score=8.4,P          3.1e-11  [+1]
Gmet_0842(bioF)Score=8.4          3.1e-11  [+1]
GM21_2164(bioB)Score=8.4          4.5e-11  [+1]
Geob_3008(bioB)Score=8.4          4.5e-11  [+1]
Gura_2242(bioB)Score=8.4          4.5e-11  [+1]
GSU1584(bioB)Score=8.6,P          9.5e-11  [+1]
Pcar_1458(bioB)Score=8.4          1.1e-10  [+1]
Gura_3246(bioF)Score=7.7          1.3e-10  [+1]
Geob_2084(bioF)Score=7.1          3.1e-10  [+1]
Gmet_1582(bioB)Score=7.9          4.2e-10  [+1]
Ppro_2093(bioF)Score=8,P          7.4e-10  [+1]
Pcar_1666(bioW)Score=8.2          9.1e-10  [+1]
Glov_1662(bioF)Score=7.9          1.1e-09  [+1]
--------------------------------------------------------------------------------

--------------------------------------------------------------------------------
	Motif 1 in BLOCKS format
--------------------------------------------------------------------------------
BL   MOTIF 1 width=32 seqs=15
Glov_2370(bioB)Score=9,P (    1) TTGTCAACCNNNNNNNNNNNNNNGGTTGACAA  1 
GM21_3430(bioF)Score=8.4 (    1) TTGTCAACCNNNNNNNNNNNNNNGGTTGACGA  1 
GSU2629(bioF)Score=8.4,P (    1) TTGTCAACCNNNNNNNNNNNNNNGGTTGACGA  1 
Gmet_0842(bioF)Score=8.4 (    1) TTGTCAACCNNNNNNNNNNNNNNGGTTGACGA  1 
GM21_2164(bioB)Score=8.4 (    1) TCGTCAACCNNNNNNNNNNNNNNGGTTGACAA  1 
Geob_3008(bioB)Score=8.4 (    1) TCGTCAACCNNNNNNNNNNNNNNGGTTGACAA  1 
Gura_2242(bioB)Score=8.4 (    1) TCGTCAACCNNNNNNNNNNNNNNGGTTGACAA  1 
GSU1584(bioB)Score=8.6,P (    1) TTGTCAACCNNNNNNNNNNNNNNAGTTGACAA  1 
Pcar_1458(bioB)Score=8.4 (    1) TTGTCAACCNNNNNNNNNNNNNNTGTTGACAA  1 
Gura_3246(bioF)Score=7.7 (    1) TTGTTAACCNNNNNNNNNNNNNNGGTTGACGA  1 
Geob_2084(bioF)Score=7.1 (    1) TCGTTAACCNNNNNNNNNNNNNNGGTTGACGA  1 
Gmet_1582(bioB)Score=7.9 (    1) TTGTTAACCNNNNNNNNNNNNNNAGTTGACAA  1 
Ppro_2093(bioF)Score=8,P (    1) TTGTCAACTNNNNNNNNNNNNNNGGTTGACCA  1 
Pcar_1666(bioW)Score=8.2 (    1) ATGTCAACCNNNNNNNNNNNNNNTGTTGACAA  1 
Glov_1662(bioF)Score=7.9 (    1) TTGTCAACTNNNNNNNNNNNNNNGGTTAACAA  1 
//

--------------------------------------------------------------------------------

--------------------------------------------------------------------------------
	Motif 1 position-specific scoring matrix
--------------------------------------------------------------------------------
log-odds matrix: alength= 4 w= 32 n= 15 bayes= 1.17688 E= 6.6e-090 
  -197  -1055  -1055    179 
 -1055     19  -1055    144 
 -1055  -1055    209  -1055 
 -1055  -1055  -1055    189 
 -1055    177  -1055    -43 
   194  -1055  -1055  -1055 
   194  -1055  -1055  -1055 
 -1055    209  -1055  -1055 
 -1055    189  -1055   -101 
     0      0      0      0 
     0      0      0      0 
     0      0      0      0 
     0      0      0      0 
     0      0      0      0 
     0      0      0      0 
     0      0      0      0 
     0      0      0      0 
     0      0      0      0 
     0      0      0      0 
     0      0      0      0 
     0      0      0      0 
     0      0      0      0 
     0      0      0      0 
   -97  -1055    164   -101 
 -1055  -1055    209  -1055 
 -1055  -1055  -1055    189 
 -1055  -1055  -1055    189 
  -197  -1055    199  -1055 
   194  -1055  -1055  -1055 
 -1055    209  -1055  -1055 
   120   -181     51  -1055 
   194  -1055  -1055  -1055 
--------------------------------------------------------------------------------

--------------------------------------------------------------------------------
	Motif 1 position-specific probability matrix
--------------------------------------------------------------------------------
letter-probability matrix: alength= 4 w= 32 nsites= 15 E= 6.6e-090 
 0.066667  0.000000  0.000000  0.933333 
 0.000000  0.266667  0.000000  0.733333 
 0.000000  0.000000  1.000000  0.000000 
 0.000000  0.000000  0.000000  1.000000 
 0.000000  0.800000  0.000000  0.200000 
 1.000000  0.000000  0.000000  0.000000 
 1.000000  0.000000  0.000000  0.000000 
 0.000000  1.000000  0.000000  0.000000 
 0.000000  0.866667  0.000000  0.133333 
 0.261364  0.234504  0.234504  0.269628 
 0.261364  0.234504  0.234504  0.269628 
 0.261364  0.234504  0.234504  0.269628 
 0.261364  0.234504  0.234504  0.269628 
 0.261364  0.234504  0.234504  0.269628 
 0.261364  0.234504  0.234504  0.269628 
 0.261364  0.234504  0.234504  0.269628 
 0.261364  0.234504  0.234504  0.269628 
 0.261364  0.234504  0.234504  0.269628 
 0.261364  0.234504  0.234504  0.269628 
 0.261364  0.234504  0.234504  0.269628 
 0.261364  0.234504  0.234504  0.269628 
 0.261364  0.234504  0.234504  0.269628 
 0.261364  0.234504  0.234504  0.269628 
 0.133333  0.000000  0.733333  0.133333 
 0.000000  0.000000  1.000000  0.000000 
 0.000000  0.000000  0.000000  1.000000 
 0.000000  0.000000  0.000000  1.000000 
 0.066667  0.000000  0.933333  0.000000 
 1.000000  0.000000  0.000000  0.000000 
 0.000000  1.000000  0.000000  0.000000 
 0.600000  0.066667  0.333333  0.000000 
 1.000000  0.000000  0.000000  0.000000 
--------------------------------------------------------------------------------

--------------------------------------------------------------------------------
	Motif 1 regular expression
--------------------------------------------------------------------------------
T[TC]GT[CT]AACC[TACG][TACG][TACG][TACG][TACG][TACG][TACG][TACG][TACG][TACG][TACG][TACG][TACG][TACG]GGTTGAC[AG]A
--------------------------------------------------------------------------------




Time  0.04 secs.

********************************************************************************


********************************************************************************
SUMMARY OF MOTIFS
********************************************************************************

--------------------------------------------------------------------------------
	Combined block diagrams: non-overlapping sites with p-value < 0.0001
--------------------------------------------------------------------------------
SEQUENCE NAME            COMBINED P-VALUE  MOTIF DIAGRAM
-------------            ----------------  -------------
Gmet_0842(bioF)Score=8.4         3.12e-11  [+1(3.12e-11)]
Gmet_1582(bioB)Score=7.9         4.22e-10  [+1(4.22e-10)]
GSU2629(bioF)Score=8.4,P         3.12e-11  [+1(3.12e-11)]
GSU1584(bioB)Score=8.6,P         9.53e-11  [+1(9.53e-11)]
Gura_2242(bioB)Score=8.4         4.54e-11  [+1(4.54e-11)]
Gura_3246(bioF)Score=7.7         1.31e-10  [+1(1.31e-10)]
Geob_3008(bioB)Score=8.4         4.54e-11  [+1(4.54e-11)]
Geob_2084(bioF)Score=7.1         3.12e-10  [+1(3.12e-10)]
GM21_2164(bioB)Score=8.4         4.54e-11  [+1(4.54e-11)]
GM21_3430(bioF)Score=8.4         3.12e-11  [+1(3.12e-11)]
Glov_1662(bioF)Score=7.9         1.10e-09  [+1(1.10e-09)]
Glov_2370(bioB)Score=9,P         1.64e-11  [+1(1.64e-11)]
Ppro_2093(bioF)Score=8,P         7.41e-10  [+1(7.41e-10)]
Pcar_1666(bioW)Score=8.2         9.08e-10  [+1(9.08e-10)]
Pcar_1458(bioB)Score=8.4         1.14e-10  [+1(1.14e-10)]
--------------------------------------------------------------------------------

********************************************************************************


********************************************************************************
Stopped because requested number of motifs (1) found.
********************************************************************************

CPU: leftraru1

********************************************************************************
