********************************************************************************
MEME - Motif discovery tool
********************************************************************************
MEME version 4.11.2 (Release date: Thu May 05 14:58:55 2016 -0700)

For further information on how to interpret these results or to get
a copy of the MEME software please access http://meme-suite.org .

This file may be used as input to the MAST algorithm for searching
sequence databases for matches to groups of motifs.  MAST is available
for interactive use and downloading at http://meme-suite.org .
********************************************************************************


********************************************************************************
REFERENCE
********************************************************************************
If you use this program in your research, please cite:

Timothy L. Bailey and Charles Elkan,
"Fitting a mixture model by expectation maximization to discover
motifs in biopolymers", Proceedings of the Second International
Conference on Intelligent Systems for Molecular Biology, pp. 28-36,
AAAI Press, Menlo Park, California, 1994.
********************************************************************************


********************************************************************************
TRAINING SET
********************************************************************************
DATAFILE= BirA_Desulfovibrionales.fasta
ALPHABET= ACGT
Sequence name            Weight Length  Sequence name            Weight Length  
-------------            ------ ------  -------------            ------ ------  
DVU2557(birA)Score=8.5,P 1.0000     33  DVU2558(bioB)Score=8.5,P 1.0000     33  
DvMF_1001(bioB)Score=9.1 1.0000     33  DvMF_1000(birA)Score=9.1 1.0000     33  
Dde_2654(birA)Score=8.7, 1.0000     33  Dde_2655(bioB)Score=8.7, 1.0000     33  
********************************************************************************

********************************************************************************
COMMAND LINE SUMMARY
********************************************************************************
This information can also be useful in the event you wish to report a
problem with the MEME software.

command: meme -dna BirA_Desulfovibrionales.fasta -oc BirA_Desulfovibrionales 

model:  mod=         zoops    nmotifs=         1    evt=           inf
object function=  E-value of product of p-values
width:  minw=            8    maxw=           33
width:  wg=             11    ws=              1    endgaps=       yes
nsites: minsites=        2    maxsites=        6    wnsites=       0.8
theta:  spmap=         uni    spfuzz=        0.5
global: substring=     yes    branching=      no    wbranch=        no
em:     prior=   dirichlet    b=            0.01    maxiter=        50
        distance=    1e-05
data:   n=             198    N=               6    shuffle=        -1
strands: +
sample: seed=            0    ctfrac=         -1    maxwords=       -1
Letter frequencies in dataset:
A 0.280 C 0.220 G 0.220 T 0.280 
Background letter frequencies (from dataset with add-one prior applied):
A 0.280 C 0.220 G 0.220 T 0.280 
********************************************************************************


********************************************************************************
MOTIF  1 MEME	width =  33  sites =   6  llr = 123  E-value = 5.7e-017
********************************************************************************
--------------------------------------------------------------------------------
	Motif 1 Description
--------------------------------------------------------------------------------
Simplified        A  ::::5aa::3333333333333332::::a:a8
pos.-specific     C  2:::5::a72222222222222222:::::a::
probability       G  ::a:::::22222222222222227a::5:::2
matrix            T  8a:a::::2333333333333333::aa5::::

         bits    2.2   *    *                 *    *  
                 2.0   *    *                 *    *  
                 1.7  *** ***                 *** *** 
                 1.5  *** ***                 *** *** 
Relative         1.3 **** ***                 *** ****
Entropy          1.1 ********                 ********
(29.7 bits)      0.9 *********               *********
                 0.7 *********               *********
                 0.4 *********               *********
                 0.2 *********               *********
                 0.0 ---------------------------------

Multilevel           TTGTAAACCAAAAAAAAAAAAAAAGGTTGACAA
consensus                C    TTTTTTTTTTTTTTT    T    
sequence                      CCCCCCCCCCCCCCC         
                              GGGGGGGGGGGGGGG         
--------------------------------------------------------------------------------

--------------------------------------------------------------------------------
	Motif 1 sites sorted by position p-value
--------------------------------------------------------------------------------
Sequence name             Start   P-value                          Site             
-------------             ----- ---------            ---------------------------------
DvMF_1000(birA)Score=9.1      1  5.76e-11          . TTGTCAACCNNNNNNNNNNNNNNNGGTTTACAA           
DvMF_1001(bioB)Score=9.1      1  5.76e-11          . TTGTAAACCNNNNNNNNNNNNNNNGGTTGACAA           
Dde_2655(bioB)Score=8.7,      1  5.30e-10          . TTGTAAACCNNNNNNNNNNNNNNNAGTTGACAA           
Dde_2654(birA)Score=8.7,      1  5.30e-10          . TTGTCAACTNNNNNNNNNNNNNNNGGTTTACAA           
DVU2558(bioB)Score=8.5,P      1  9.78e-10          . TTGTAAACCNNNNNNNNNNNNNNNCGTTGACAG           
DVU2557(birA)Score=8.5,P      1  9.78e-10          . CTGTCAACGNNNNNNNNNNNNNNNGGTTTACAA           
--------------------------------------------------------------------------------

--------------------------------------------------------------------------------
	Motif 1 block diagrams
--------------------------------------------------------------------------------
SEQUENCE NAME            POSITION P-VALUE  MOTIF DIAGRAM
-------------            ----------------  -------------
DvMF_1000(birA)Score=9.1          5.8e-11  [+1]
DvMF_1001(bioB)Score=9.1          5.8e-11  [+1]
Dde_2655(bioB)Score=8.7,          5.3e-10  [+1]
Dde_2654(birA)Score=8.7,          5.3e-10  [+1]
DVU2558(bioB)Score=8.5,P          9.8e-10  [+1]
DVU2557(birA)Score=8.5,P          9.8e-10  [+1]
--------------------------------------------------------------------------------

--------------------------------------------------------------------------------
	Motif 1 in BLOCKS format
--------------------------------------------------------------------------------
BL   MOTIF 1 width=33 seqs=6
DvMF_1000(birA)Score=9.1 (    1) TTGTCAACCNNNNNNNNNNNNNNNGGTTTACAA  1 
DvMF_1001(bioB)Score=9.1 (    1) TTGTAAACCNNNNNNNNNNNNNNNGGTTGACAA  1 
Dde_2655(bioB)Score=8.7, (    1) TTGTAAACCNNNNNNNNNNNNNNNAGTTGACAA  1 
Dde_2654(birA)Score=8.7, (    1) TTGTCAACTNNNNNNNNNNNNNNNGGTTTACAA  1 
DVU2558(bioB)Score=8.5,P (    1) TTGTAAACCNNNNNNNNNNNNNNNCGTTGACAG  1 
DVU2557(birA)Score=8.5,P (    1) CTGTCAACGNNNNNNNNNNNNNNNGGTTTACAA  1 
//

--------------------------------------------------------------------------------

--------------------------------------------------------------------------------
	Motif 1 position-specific scoring matrix
--------------------------------------------------------------------------------
log-odds matrix: alength= 4 w= 33 n= 6 bayes= 0.192645 E= 5.7e-017 
  -923    -40   -923    157 
  -923   -923   -923    184 
  -923   -923    218   -923 
  -923   -923   -923    184 
    84    118   -923   -923 
   184   -923   -923   -923 
   184   -923   -923   -923 
  -923    218   -923   -923 
  -923    160    -40    -75 
     0      0      0      0 
     0      0      0      0 
     0      0      0      0 
     0      0      0      0 
     0      0      0      0 
     0      0      0      0 
     0      0      0      0 
     0      0      0      0 
     0      0      0      0 
     0      0      0      0 
     0      0      0      0 
     0      0      0      0 
     0      0      0      0 
     0      0      0      0 
     0      0      0      0 
   -75    -40    160   -923 
  -923   -923    218   -923 
  -923   -923   -923    184 
  -923   -923   -923    184 
  -923   -923    118     84 
   184   -923   -923   -923 
  -923    218   -923   -923 
   184   -923   -923   -923 
   157   -923    -40   -923 
--------------------------------------------------------------------------------

--------------------------------------------------------------------------------
	Motif 1 position-specific probability matrix
--------------------------------------------------------------------------------
letter-probability matrix: alength= 4 w= 33 nsites= 6 E= 5.7e-017 
 0.000000  0.166667  0.000000  0.833333 
 0.000000  0.000000  0.000000  1.000000 
 0.000000  0.000000  1.000000  0.000000 
 0.000000  0.000000  0.000000  1.000000 
 0.500000  0.500000  0.000000  0.000000 
 1.000000  0.000000  0.000000  0.000000 
 1.000000  0.000000  0.000000  0.000000 
 0.000000  1.000000  0.000000  0.000000 
 0.000000  0.666667  0.166667  0.166667 
 0.279703  0.220297  0.220297  0.279703 
 0.279703  0.220297  0.220297  0.279703 
 0.279703  0.220297  0.220297  0.279703 
 0.279703  0.220297  0.220297  0.279703 
 0.279703  0.220297  0.220297  0.279703 
 0.279703  0.220297  0.220297  0.279703 
 0.279703  0.220297  0.220297  0.279703 
 0.279703  0.220297  0.220297  0.279703 
 0.279703  0.220297  0.220297  0.279703 
 0.279703  0.220297  0.220297  0.279703 
 0.279703  0.220297  0.220297  0.279703 
 0.279703  0.220297  0.220297  0.279703 
 0.279703  0.220297  0.220297  0.279703 
 0.279703  0.220297  0.220297  0.279703 
 0.279703  0.220297  0.220297  0.279703 
 0.166667  0.166667  0.666667  0.000000 
 0.000000  0.000000  1.000000  0.000000 
 0.000000  0.000000  0.000000  1.000000 
 0.000000  0.000000  0.000000  1.000000 
 0.000000  0.000000  0.500000  0.500000 
 1.000000  0.000000  0.000000  0.000000 
 0.000000  1.000000  0.000000  0.000000 
 1.000000  0.000000  0.000000  0.000000 
 0.833333  0.000000  0.166667  0.000000 
--------------------------------------------------------------------------------

--------------------------------------------------------------------------------
	Motif 1 regular expression
--------------------------------------------------------------------------------
TTGT[AC]AACC[ATCG][ATCG][ATCG][ATCG][ATCG][ATCG][ATCG][ATCG][ATCG][ATCG][ATCG][ATCG][ATCG][ATCG][ATCG]GGTT[GT]ACAA
--------------------------------------------------------------------------------




Time  0.02 secs.

********************************************************************************


********************************************************************************
SUMMARY OF MOTIFS
********************************************************************************

--------------------------------------------------------------------------------
	Combined block diagrams: non-overlapping sites with p-value < 0.0001
--------------------------------------------------------------------------------
SEQUENCE NAME            COMBINED P-VALUE  MOTIF DIAGRAM
-------------            ----------------  -------------
DVU2557(birA)Score=8.5,P         9.78e-10  [+1(9.78e-10)]
DVU2558(bioB)Score=8.5,P         9.78e-10  [+1(9.78e-10)]
DvMF_1001(bioB)Score=9.1         5.76e-11  [+1(5.76e-11)]
DvMF_1000(birA)Score=9.1         5.76e-11  [+1(5.76e-11)]
Dde_2654(birA)Score=8.7,         5.30e-10  [+1(5.30e-10)]
Dde_2655(bioB)Score=8.7,         5.30e-10  [+1(5.30e-10)]
--------------------------------------------------------------------------------

********************************************************************************


********************************************************************************
Stopped because requested number of motifs (1) found.
********************************************************************************

CPU: leftraru1

********************************************************************************
