********************************************************************************
MEME - Motif discovery tool
********************************************************************************
MEME version 4.11.2 (Release date: Thu May 05 14:58:55 2016 -0700)

For further information on how to interpret these results or to get
a copy of the MEME software please access http://meme-suite.org .

This file may be used as input to the MAST algorithm for searching
sequence databases for matches to groups of motifs.  MAST is available
for interactive use and downloading at http://meme-suite.org .
********************************************************************************


********************************************************************************
REFERENCE
********************************************************************************
If you use this program in your research, please cite:

Timothy L. Bailey and Charles Elkan,
"Fitting a mixture model by expectation maximization to discover
motifs in biopolymers", Proceedings of the Second International
Conference on Intelligent Systems for Molecular Biology, pp. 28-36,
AAAI Press, Menlo Park, California, 1994.
********************************************************************************


********************************************************************************
TRAINING SET
********************************************************************************
DATAFILE= CadR-PbrR_Rhodobacterales.fasta
ALPHABET= ACGT
Sequence name            Weight Length  Sequence name            Weight Length  
-------------            ------ ------  -------------            ------ ------  
RSP_1791(cadA)Score=5.1, 1.0000     21  Pden_2344(cadA)Score=6.1 1.0000     21  
Pden_0212(cadA)Score=5.8 1.0000     21  RB2654_22328(cadA)Score= 1.0000     21  
RB2654_22408(PF01841)Sco 1.0000     21  RB2654_10329(czcD2)Score 1.0000     21  
RB2654_22398(cadR)Score= 1.0000     21  RB2654_22323(PF03734)Sco 1.0000     21  
OG2516_17805(cadA)Score= 1.0000     21  OB2597_05255(PF01841)Sco 1.0000     21  
OB2597_05245(cadR2)Score 1.0000     21  OB2597_16652(PF01841)Sco 1.0000     21  
OB2597_16572(cadA)Score= 1.0000     21  OB2597_05215(cadA)Score= 1.0000     21  
OB2597_16642(cadR)Score= 1.0000     21  OB2597_16567(PF03734)Sco 1.0000     21  
ISM_17525(PF01841)Score= 1.0000     21  ISM_17615(cadA)Score=5.2 1.0000     21  
ISM_17625(PF03734)Score= 1.0000     21  ISM_17535(cadR)Score=6,P 1.0000     21  
ROS217_02950(cadR)Score= 1.0000     21  ROS217_03080(cadA)Score= 1.0000     21  
ROS217_13921(czcD)Score= 1.0000     21  ROS217_02920(PF03734)Sco 1.0000     21  
ROS217_02925(PF03734)Sco 1.0000     21  EE36_00940,Score=4.8,Pos 1.0000     21  
TM1040_2930(czcD)Score=6 1.0000     21  MED193_02180(cadA)Score= 1.0000     21  
MED193_02240(cadR)Score= 1.0000     21  MED193_02255(PF01841)Sco 1.0000     21  
MED193_02170(PF03734)Sco 1.0000     21  MED193_15017(cadA)Score= 1.0000     21  
HNE_1727(czcD)Score=5.9, 1.0000     21  
********************************************************************************

********************************************************************************
COMMAND LINE SUMMARY
********************************************************************************
This information can also be useful in the event you wish to report a
problem with the MEME software.

command: meme -dna CadR-PbrR_Rhodobacterales.fasta -oc CadR-PbrR_Rhodobacterales 

model:  mod=         zoops    nmotifs=         1    evt=           inf
object function=  E-value of product of p-values
width:  minw=            8    maxw=           21
width:  wg=             11    ws=              1    endgaps=       yes
nsites: minsites=        2    maxsites=       33    wnsites=       0.8
theta:  spmap=         uni    spfuzz=        0.5
global: substring=     yes    branching=      no    wbranch=        no
em:     prior=   dirichlet    b=            0.01    maxiter=        50
        distance=    1e-05
data:   n=             693    N=              33    shuffle=        -1
strands: +
sample: seed=            0    ctfrac=         -1    maxwords=       -1
Letter frequencies in dataset:
A 0.289 C 0.205 G 0.247 T 0.260 
Background letter frequencies (from dataset with add-one prior applied):
A 0.288 C 0.205 G 0.247 T 0.260 
********************************************************************************


********************************************************************************
MOTIF  1 MEME	width =  20  sites =  33  llr = 613  E-value = 1.3e-211
********************************************************************************
--------------------------------------------------------------------------------
	Motif 1 Description
--------------------------------------------------------------------------------
Simplified        A  a8:::3:a::16::5:a113
pos.-specific     C  ::5a:72::33:9:::::2:
probability       G  ::5:::::a:241:55:972
matrix            T  :2::a:8::75::a15:::5

         bits    2.3    *                
                 2.1    **   *    *      
                 1.8 *  **  **   **  *   
                 1.6 *  **  **   **  **  
Relative         1.4 *  **  **   **  **  
Entropy          1.1 **********  **  **  
(26.8 bits)      0.9 ********** *** **** 
                 0.7 ********** *** **** 
                 0.5 ********** ******** 
                 0.2 ********************
                 0.0 --------------------

Multilevel           AACCTCTAGTTACTATAGGT
consensus              G  AC  CCG  GG   A
sequence                                G
                                         
--------------------------------------------------------------------------------

--------------------------------------------------------------------------------
	Motif 1 sites sorted by position p-value
--------------------------------------------------------------------------------
Sequence name             Start   P-value                    Site      
-------------             ----- ---------            --------------------
MED193_15017(cadA)Score=      1  6.24e-12          . AACCTCTAGTCACTGTAGGT C         
ROS217_03080(cadA)Score=      1  6.15e-11          . AAGCTCTAGTTACTGTAGGG G         
OB2597_16572(cadA)Score=      1  6.15e-11          . AAGCTCTAGTTACTGTAGGG G         
RB2654_22328(cadA)Score=      1  6.15e-11          . AAGCTCTAGTTACTGTAGGG G         
RB2654_10329(czcD2)Score      1  1.18e-10          . AACCTCTAGTCGCTAGAGGA A         
Pden_2344(cadA)Score=6.1      1  1.64e-10          . AAGCTCTAGTCGCTAGAGGA A         
MED193_02180(cadA)Score=      1  2.24e-10          . AAGCTCTAGCTACTGTAGGG G         
ISM_17615(cadA)Score=5.2      1  2.24e-10          . AAGCTCTAGCTACTGTAGGG G         
ROS217_02950(cadR)Score=      1  5.00e-10          . ATCCTCTAGCTACTGTAGGT T         
OB2597_16642(cadR)Score=      1  5.00e-10          . ATCCTCTAGCTACTGTAGGT T         
RB2654_22398(cadR)Score=      1  5.00e-10          . ATCCTCTAGCTACTGTAGGT T         
MED193_02240(cadR)Score=      1  7.56e-10          . ATCCTCTAGCTACTAGAGGT T         
TM1040_2930(czcD)Score=6      1  7.56e-10          . AACCTCTAGTCACTAGAGCA A         
OB2597_05215(cadA)Score=      1  7.56e-10          . AACCTACAGTTGCTGTAGGT C         
Pden_0212(cadA)Score=5.8      1  8.47e-10          . AACCTCTAGTTGCTAGAGAT C         
EE36_00940,Score=4.8,Pos      1  9.66e-10          . AAGCTACAGTTGCTGTAGGT C         
ROS217_02920(PF03734)Sco      1  1.50e-09          . AAGCTCTAGTTGGTAGAGGT T         
ROS217_13921(czcD)Score=      1  2.30e-09          . AAGCTCTAGTCACTAGAGAG A         
HNE_1727(czcD)Score=5.9,      1  3.04e-09          . ATCCTCTAGTTACTTGAGGA T         
ROS217_02925(PF03734)Sco      1  3.34e-09          . AAGCTCTAGTGGGTGGAGGT C         
OB2597_16567(PF03734)Sco      1  3.34e-09          . AACCTCTAGTAGCTTTAGGA G         
RB2654_22323(PF03734)Sco      1  3.34e-09          . AACCTCTAGTAGCTTTAGGA G         
ISM_17535(cadR)Score=6,P      1  3.98e-09          . ATCCTCTAGCAGCTAGAGGT T         
MED193_02170(PF03734)Sco      1  4.33e-09          . AACCTCTAGCCACTAGAAGT C         
ISM_17625(PF03734)Score=      1  4.33e-09          . AACCTCTAGCCACTAGAAGT C         
ISM_17525(PF01841)Score=      1  5.94e-09          . AAGCTATAGTGACTATAGCA A         
OB2597_05255(PF01841)Sco      1  6.89e-09          . AAGCTACAGTCGCTGTAGCA A         
OG2516_17805(cadA)Score=      1  9.67e-09          . AACCTACAGTCGGTAGAGGT C         
OB2597_16652(PF01841)Sco      1  1.03e-08          . AAGCTACAGTGACTGTAGCA A         
RB2654_22408(PF01841)Sco      1  1.03e-08          . AAGCTACAGTGACTGTAGCA A         
OB2597_05245(cadR2)Score      1  1.72e-08          . AAGCTACAGTGGGTAGAGGT T         
RSP_1791(cadA)Score=5.1,      1  1.72e-08          . AACCTATAGTTGCTAGAGAC A         
MED193_02255(PF01841)Sco      1  2.19e-08          . AAGCTACAGTAACTATAGAG A         
--------------------------------------------------------------------------------

--------------------------------------------------------------------------------
	Motif 1 block diagrams
--------------------------------------------------------------------------------
SEQUENCE NAME            POSITION P-VALUE  MOTIF DIAGRAM
-------------            ----------------  -------------
MED193_15017(cadA)Score=          6.2e-12  [+1]_1
ROS217_03080(cadA)Score=          6.1e-11  [+1]_1
OB2597_16572(cadA)Score=          6.1e-11  [+1]_1
RB2654_22328(cadA)Score=          6.1e-11  [+1]_1
RB2654_10329(czcD2)Score          1.2e-10  [+1]_1
Pden_2344(cadA)Score=6.1          1.6e-10  [+1]_1
MED193_02180(cadA)Score=          2.2e-10  [+1]_1
ISM_17615(cadA)Score=5.2          2.2e-10  [+1]_1
ROS217_02950(cadR)Score=            5e-10  [+1]_1
OB2597_16642(cadR)Score=            5e-10  [+1]_1
RB2654_22398(cadR)Score=            5e-10  [+1]_1
MED193_02240(cadR)Score=          7.6e-10  [+1]_1
TM1040_2930(czcD)Score=6          7.6e-10  [+1]_1
OB2597_05215(cadA)Score=          7.6e-10  [+1]_1
Pden_0212(cadA)Score=5.8          8.5e-10  [+1]_1
EE36_00940,Score=4.8,Pos          9.7e-10  [+1]_1
ROS217_02920(PF03734)Sco          1.5e-09  [+1]_1
ROS217_13921(czcD)Score=          2.3e-09  [+1]_1
HNE_1727(czcD)Score=5.9,            3e-09  [+1]_1
ROS217_02925(PF03734)Sco          3.3e-09  [+1]_1
OB2597_16567(PF03734)Sco          3.3e-09  [+1]_1
RB2654_22323(PF03734)Sco          3.3e-09  [+1]_1
ISM_17535(cadR)Score=6,P            4e-09  [+1]_1
MED193_02170(PF03734)Sco          4.3e-09  [+1]_1
ISM_17625(PF03734)Score=          4.3e-09  [+1]_1
ISM_17525(PF01841)Score=          5.9e-09  [+1]_1
OB2597_05255(PF01841)Sco          6.9e-09  [+1]_1
OG2516_17805(cadA)Score=          9.7e-09  [+1]_1
OB2597_16652(PF01841)Sco            1e-08  [+1]_1
RB2654_22408(PF01841)Sco            1e-08  [+1]_1
OB2597_05245(cadR2)Score          1.7e-08  [+1]_1
RSP_1791(cadA)Score=5.1,          1.7e-08  [+1]_1
MED193_02255(PF01841)Sco          2.2e-08  [+1]_1
--------------------------------------------------------------------------------

--------------------------------------------------------------------------------
	Motif 1 in BLOCKS format
--------------------------------------------------------------------------------
BL   MOTIF 1 width=20 seqs=33
MED193_15017(cadA)Score= (    1) AACCTCTAGTCACTGTAGGT  1 
ROS217_03080(cadA)Score= (    1) AAGCTCTAGTTACTGTAGGG  1 
OB2597_16572(cadA)Score= (    1) AAGCTCTAGTTACTGTAGGG  1 
RB2654_22328(cadA)Score= (    1) AAGCTCTAGTTACTGTAGGG  1 
RB2654_10329(czcD2)Score (    1) AACCTCTAGTCGCTAGAGGA  1 
Pden_2344(cadA)Score=6.1 (    1) AAGCTCTAGTCGCTAGAGGA  1 
MED193_02180(cadA)Score= (    1) AAGCTCTAGCTACTGTAGGG  1 
ISM_17615(cadA)Score=5.2 (    1) AAGCTCTAGCTACTGTAGGG  1 
ROS217_02950(cadR)Score= (    1) ATCCTCTAGCTACTGTAGGT  1 
OB2597_16642(cadR)Score= (    1) ATCCTCTAGCTACTGTAGGT  1 
RB2654_22398(cadR)Score= (    1) ATCCTCTAGCTACTGTAGGT  1 
MED193_02240(cadR)Score= (    1) ATCCTCTAGCTACTAGAGGT  1 
TM1040_2930(czcD)Score=6 (    1) AACCTCTAGTCACTAGAGCA  1 
OB2597_05215(cadA)Score= (    1) AACCTACAGTTGCTGTAGGT  1 
Pden_0212(cadA)Score=5.8 (    1) AACCTCTAGTTGCTAGAGAT  1 
EE36_00940,Score=4.8,Pos (    1) AAGCTACAGTTGCTGTAGGT  1 
ROS217_02920(PF03734)Sco (    1) AAGCTCTAGTTGGTAGAGGT  1 
ROS217_13921(czcD)Score= (    1) AAGCTCTAGTCACTAGAGAG  1 
HNE_1727(czcD)Score=5.9, (    1) ATCCTCTAGTTACTTGAGGA  1 
ROS217_02925(PF03734)Sco (    1) AAGCTCTAGTGGGTGGAGGT  1 
OB2597_16567(PF03734)Sco (    1) AACCTCTAGTAGCTTTAGGA  1 
RB2654_22323(PF03734)Sco (    1) AACCTCTAGTAGCTTTAGGA  1 
ISM_17535(cadR)Score=6,P (    1) ATCCTCTAGCAGCTAGAGGT  1 
MED193_02170(PF03734)Sco (    1) AACCTCTAGCCACTAGAAGT  1 
ISM_17625(PF03734)Score= (    1) AACCTCTAGCCACTAGAAGT  1 
ISM_17525(PF01841)Score= (    1) AAGCTATAGTGACTATAGCA  1 
OB2597_05255(PF01841)Sco (    1) AAGCTACAGTCGCTGTAGCA  1 
OG2516_17805(cadA)Score= (    1) AACCTACAGTCGGTAGAGGT  1 
OB2597_16652(PF01841)Sco (    1) AAGCTACAGTGACTGTAGCA  1 
RB2654_22408(PF01841)Sco (    1) AAGCTACAGTGACTGTAGCA  1 
OB2597_05245(cadR2)Score (    1) AAGCTACAGTGGGTAGAGGT  1 
RSP_1791(cadA)Score=5.1, (    1) AACCTATAGTTGCTAGAGAC  1 
MED193_02255(PF01841)Sco (    1) AAGCTACAGTAACTATAGAG  1 
//

--------------------------------------------------------------------------------

--------------------------------------------------------------------------------
	Motif 1 position-specific scoring matrix
--------------------------------------------------------------------------------
log-odds matrix: alength= 4 w= 20 n= 66 bayes= 2.81737 E= 1.3e-211 
   179  -1169  -1169  -1169 
   150  -1169  -1169    -51 
 -1169    133     97  -1169 
 -1169    228  -1169  -1169 
 -1169  -1169  -1169    194 
     7    176  -1169  -1169 
 -1169     24  -1169    154 
   179  -1169  -1169  -1169 
 -1169  -1169    202  -1169 
 -1169     41  -1169    149 
  -125     41    -70     81 
   100  -1169     78  -1169 
 -1169    210   -103  -1169 
 -1169  -1169  -1169    194 
    66  -1169     88   -151 
 -1169  -1169     88    107 
   179  -1169  -1169  -1169 
  -225  -1169    193  -1169 
  -125    -44    156  -1169 
     7   -276    -22     81 
--------------------------------------------------------------------------------

--------------------------------------------------------------------------------
	Motif 1 position-specific probability matrix
--------------------------------------------------------------------------------
letter-probability matrix: alength= 4 w= 20 nsites= 33 E= 1.3e-211 
 1.000000  0.000000  0.000000  0.000000 
 0.818182  0.000000  0.000000  0.181818 
 0.000000  0.515152  0.484848  0.000000 
 0.000000  1.000000  0.000000  0.000000 
 0.000000  0.000000  0.000000  1.000000 
 0.303030  0.696970  0.000000  0.000000 
 0.000000  0.242424  0.000000  0.757576 
 1.000000  0.000000  0.000000  0.000000 
 0.000000  0.000000  1.000000  0.000000 
 0.000000  0.272727  0.000000  0.727273 
 0.121212  0.272727  0.151515  0.454545 
 0.575758  0.000000  0.424242  0.000000 
 0.000000  0.878788  0.121212  0.000000 
 0.000000  0.000000  0.000000  1.000000 
 0.454545  0.000000  0.454545  0.090909 
 0.000000  0.000000  0.454545  0.545455 
 1.000000  0.000000  0.000000  0.000000 
 0.060606  0.000000  0.939394  0.000000 
 0.121212  0.151515  0.727273  0.000000 
 0.303030  0.030303  0.212121  0.454545 
--------------------------------------------------------------------------------

--------------------------------------------------------------------------------
	Motif 1 regular expression
--------------------------------------------------------------------------------
AA[CG]CT[CA][TC]AG[TC][TC][AG]CT[AG][TG]AGG[TAG]
--------------------------------------------------------------------------------




Time  0.07 secs.

********************************************************************************


********************************************************************************
SUMMARY OF MOTIFS
********************************************************************************

--------------------------------------------------------------------------------
	Combined block diagrams: non-overlapping sites with p-value < 0.0001
--------------------------------------------------------------------------------
SEQUENCE NAME            COMBINED P-VALUE  MOTIF DIAGRAM
-------------            ----------------  -------------
RSP_1791(cadA)Score=5.1,         3.44e-08  [+1(1.72e-08)]_1
Pden_2344(cadA)Score=6.1         3.27e-10  [+1(1.64e-10)]_1
Pden_0212(cadA)Score=5.8         1.69e-09  [+1(8.47e-10)]_1
RB2654_22328(cadA)Score=         1.23e-10  [+1(6.15e-11)]_1
RB2654_22408(PF01841)Sco         2.06e-08  [+1(1.03e-08)]_1
RB2654_10329(czcD2)Score         2.35e-10  [+1(1.18e-10)]_1
RB2654_22398(cadR)Score=         1.00e-09  [+1(5.00e-10)]_1
RB2654_22323(PF03734)Sco         6.67e-09  [+1(3.34e-09)]_1
OG2516_17805(cadA)Score=         1.93e-08  [+1(9.67e-09)]_1
OB2597_05255(PF01841)Sco         1.38e-08  [+1(6.89e-09)]_1
OB2597_05245(cadR2)Score         3.44e-08  [+1(1.72e-08)]_1
OB2597_16652(PF01841)Sco         2.06e-08  [+1(1.03e-08)]_1
OB2597_16572(cadA)Score=         1.23e-10  [+1(6.15e-11)]_1
OB2597_05215(cadA)Score=         1.51e-09  [+1(7.56e-10)]_1
OB2597_16642(cadR)Score=         1.00e-09  [+1(5.00e-10)]_1
OB2597_16567(PF03734)Sco         6.67e-09  [+1(3.34e-09)]_1
ISM_17525(PF01841)Score=         1.19e-08  [+1(5.94e-09)]_1
ISM_17615(cadA)Score=5.2         4.49e-10  [+1(2.24e-10)]_1
ISM_17625(PF03734)Score=         8.66e-09  [+1(4.33e-09)]_1
ISM_17535(cadR)Score=6,P         7.95e-09  [+1(3.98e-09)]_1
ROS217_02950(cadR)Score=         1.00e-09  [+1(5.00e-10)]_1
ROS217_03080(cadA)Score=         1.23e-10  [+1(6.15e-11)]_1
ROS217_13921(czcD)Score=         4.60e-09  [+1(2.30e-09)]_1
ROS217_02920(PF03734)Sco         3.00e-09  [+1(1.50e-09)]_1
ROS217_02925(PF03734)Sco         6.67e-09  [+1(3.34e-09)]_1
EE36_00940,Score=4.8,Pos         1.93e-09  [+1(9.66e-10)]_1
TM1040_2930(czcD)Score=6         1.51e-09  [+1(7.56e-10)]_1
MED193_02180(cadA)Score=         4.49e-10  [+1(2.24e-10)]_1
MED193_02240(cadR)Score=         1.51e-09  [+1(7.56e-10)]_1
MED193_02255(PF01841)Sco         4.37e-08  [+1(2.19e-08)]_1
MED193_02170(PF03734)Sco         8.66e-09  [+1(4.33e-09)]_1
MED193_15017(cadA)Score=         1.25e-11  [+1(6.24e-12)]_1
HNE_1727(czcD)Score=5.9,         6.08e-09  [+1(3.04e-09)]_1
--------------------------------------------------------------------------------

********************************************************************************


********************************************************************************
Stopped because requested number of motifs (1) found.
********************************************************************************

CPU: leftraru1

********************************************************************************
