********************************************************************************
MEME - Motif discovery tool
********************************************************************************
MEME version 4.11.2 (Release date: Thu May 05 14:58:55 2016 -0700)

For further information on how to interpret these results or to get
a copy of the MEME software please access http://meme-suite.org .

This file may be used as input to the MAST algorithm for searching
sequence databases for matches to groups of motifs.  MAST is available
for interactive use and downloading at http://meme-suite.org .
********************************************************************************


********************************************************************************
REFERENCE
********************************************************************************
If you use this program in your research, please cite:

Timothy L. Bailey and Charles Elkan,
"Fitting a mixture model by expectation maximization to discover
motifs in biopolymers", Proceedings of the Second International
Conference on Intelligent Systems for Molecular Biology, pp. 28-36,
AAAI Press, Menlo Park, California, 1994.
********************************************************************************


********************************************************************************
TRAINING SET
********************************************************************************
DATAFILE= CadR-PbrR_Various_betaproteobacteria.fasta
ALPHABET= ACGT
Sequence name            Weight Length  Sequence name            Weight Length  
-------------            ------ ------  -------------            ------ ------  
Tmz1t_2390(cadA)Score=5. 1.0000     21  Tmz1t_2103(cadA)Score=5. 1.0000     21  
Daro_2631(cadA)Score=5.6 1.0000     21  Daro_2257(cadA)Score=6.5 1.0000     21  
CV1154(cadA)Score=6.7,Po 1.0000     21  LHK_00449(cadA)Score=6.2 1.0000     21  
Mfla_0694(czcD)Score=5.3 1.0000     21  
********************************************************************************

********************************************************************************
COMMAND LINE SUMMARY
********************************************************************************
This information can also be useful in the event you wish to report a
problem with the MEME software.

command: meme -dna CadR-PbrR_Various_betaproteobacteria.fasta -oc CadR-PbrR_Various_betaproteobacteria 

model:  mod=         zoops    nmotifs=         1    evt=           inf
object function=  E-value of product of p-values
width:  minw=            8    maxw=           21
width:  wg=             11    ws=              1    endgaps=       yes
nsites: minsites=        2    maxsites=        7    wnsites=       0.8
theta:  spmap=         uni    spfuzz=        0.5
global: substring=     yes    branching=      no    wbranch=        no
em:     prior=   dirichlet    b=            0.01    maxiter=        50
        distance=    1e-05
data:   n=             147    N=               7    shuffle=        -1
strands: +
sample: seed=            0    ctfrac=         -1    maxwords=       -1
Letter frequencies in dataset:
A 0.245 C 0.238 G 0.238 T 0.279 
Background letter frequencies (from dataset with add-one prior applied):
A 0.245 C 0.238 G 0.238 T 0.278 
********************************************************************************


********************************************************************************
MOTIF  1 MEME	width =  21  sites =   7  llr = 150  E-value = 7.6e-033
********************************************************************************
--------------------------------------------------------------------------------
	Motif 1 Description
--------------------------------------------------------------------------------
Simplified        A  a::::3:a::47::617:3::
pos.-specific     C  :a6a:1:::11:a:37:::::
probability       G  :::::6::a:43:::13977:
matrix            T  ::4:a:a::9:::a1::1:3a

         bits    2.1 ** *   **   *        
                 1.9 ** ** ***   **      *
                 1.7 ** ** ***   **      *
                 1.4 ** ** ***   **   *  *
Relative         1.2 ** ** **** ***  *****
Entropy          1.0 ***** **** ***  *****
(31.0 bits)      0.8 ***** **** *** ******
                 0.6 *********************
                 0.4 *********************
                 0.2 *********************
                 0.0 ---------------------

Multilevel           ACCCTGTAGTAACTACAGGGT
consensus              T  A    GG  C G AT 
sequence                                  
                                          
--------------------------------------------------------------------------------

--------------------------------------------------------------------------------
	Motif 1 sites sorted by position p-value
--------------------------------------------------------------------------------
Sequence name             Start   P-value                    Site       
-------------             ----- ---------            ---------------------
CV1154(cadA)Score=6.7,Po      1  4.13e-13          . ACCCTGTAGTGACTACAGGGT           
Daro_2257(cadA)Score=6.5      1  1.05e-11          . ACCCTATAGTAGCTACAGGGT           
LHK_00449(cadA)Score=6.2      1  3.04e-11          . ACCCTATAGTAGCTCCAGGGT           
Tmz1t_2103(cadA)Score=5.      1  1.23e-10          . ACTCTGTAGTGACTACGGATT           
Tmz1t_2390(cadA)Score=5.      1  1.23e-10          . ACTCTGTAGTGACTACGGATT           
Daro_2631(cadA)Score=5.6      1  6.71e-10          . ACTCTGTAGCCACTCAAGGGT           
Mfla_0694(czcD)Score=5.3      1  1.07e-09          . ACCCTCTAGTAACTTGATGGT           
--------------------------------------------------------------------------------

--------------------------------------------------------------------------------
	Motif 1 block diagrams
--------------------------------------------------------------------------------
SEQUENCE NAME            POSITION P-VALUE  MOTIF DIAGRAM
-------------            ----------------  -------------
CV1154(cadA)Score=6.7,Po          4.1e-13  [+1]
Daro_2257(cadA)Score=6.5            1e-11  [+1]
LHK_00449(cadA)Score=6.2            3e-11  [+1]
Tmz1t_2103(cadA)Score=5.          1.2e-10  [+1]
Tmz1t_2390(cadA)Score=5.          1.2e-10  [+1]
Daro_2631(cadA)Score=5.6          6.7e-10  [+1]
Mfla_0694(czcD)Score=5.3          1.1e-09  [+1]
--------------------------------------------------------------------------------

--------------------------------------------------------------------------------
	Motif 1 in BLOCKS format
--------------------------------------------------------------------------------
BL   MOTIF 1 width=21 seqs=7
CV1154(cadA)Score=6.7,Po (    1) ACCCTGTAGTGACTACAGGGT  1 
Daro_2257(cadA)Score=6.5 (    1) ACCCTATAGTAGCTACAGGGT  1 
LHK_00449(cadA)Score=6.2 (    1) ACCCTATAGTAGCTCCAGGGT  1 
Tmz1t_2103(cadA)Score=5. (    1) ACTCTGTAGTGACTACGGATT  1 
Tmz1t_2390(cadA)Score=5. (    1) ACTCTGTAGTGACTACGGATT  1 
Daro_2631(cadA)Score=5.6 (    1) ACTCTGTAGCCACTCAAGGGT  1 
Mfla_0694(czcD)Score=5.3 (    1) ACCCTCTAGTAACTTGATGGT  1 
//

--------------------------------------------------------------------------------

--------------------------------------------------------------------------------
	Motif 1 position-specific scoring matrix
--------------------------------------------------------------------------------
log-odds matrix: alength= 4 w= 21 n= 7 bayes= 0.415037 E= 7.6e-033 
   203   -945   -945   -945 
  -945    207   -945   -945 
  -945    126   -945     62 
  -945    207   -945   -945 
  -945   -945   -945    184 
    22    -74    126   -945 
  -945   -945   -945    184 
   203   -945   -945   -945 
  -945   -945    207   -945 
  -945    -74   -945    162 
    81    -74     85   -945 
   154   -945     26   -945 
  -945    207   -945   -945 
  -945   -945   -945    184 
   122     26   -945    -96 
   -78    158    -74   -945 
   154   -945     26   -945 
  -945   -945    184    -96 
    22   -945    158   -945 
  -945   -945    158      4 
  -945   -945   -945    184 
--------------------------------------------------------------------------------

--------------------------------------------------------------------------------
	Motif 1 position-specific probability matrix
--------------------------------------------------------------------------------
letter-probability matrix: alength= 4 w= 21 nsites= 7 E= 7.6e-033 
 1.000000  0.000000  0.000000  0.000000 
 0.000000  1.000000  0.000000  0.000000 
 0.000000  0.571429  0.000000  0.428571 
 0.000000  1.000000  0.000000  0.000000 
 0.000000  0.000000  0.000000  1.000000 
 0.285714  0.142857  0.571429  0.000000 
 0.000000  0.000000  0.000000  1.000000 
 1.000000  0.000000  0.000000  0.000000 
 0.000000  0.000000  1.000000  0.000000 
 0.000000  0.142857  0.000000  0.857143 
 0.428571  0.142857  0.428571  0.000000 
 0.714286  0.000000  0.285714  0.000000 
 0.000000  1.000000  0.000000  0.000000 
 0.000000  0.000000  0.000000  1.000000 
 0.571429  0.285714  0.000000  0.142857 
 0.142857  0.714286  0.142857  0.000000 
 0.714286  0.000000  0.285714  0.000000 
 0.000000  0.000000  0.857143  0.142857 
 0.285714  0.000000  0.714286  0.000000 
 0.000000  0.000000  0.714286  0.285714 
 0.000000  0.000000  0.000000  1.000000 
--------------------------------------------------------------------------------

--------------------------------------------------------------------------------
	Motif 1 regular expression
--------------------------------------------------------------------------------
AC[CT]CT[GA]TAGT[AG][AG]CT[AC]C[AG]G[GA][GT]T
--------------------------------------------------------------------------------




Time  0.02 secs.

********************************************************************************


********************************************************************************
SUMMARY OF MOTIFS
********************************************************************************

--------------------------------------------------------------------------------
	Combined block diagrams: non-overlapping sites with p-value < 0.0001
--------------------------------------------------------------------------------
SEQUENCE NAME            COMBINED P-VALUE  MOTIF DIAGRAM
-------------            ----------------  -------------
Tmz1t_2390(cadA)Score=5.         1.23e-10  [+1(1.23e-10)]
Tmz1t_2103(cadA)Score=5.         1.23e-10  [+1(1.23e-10)]
Daro_2631(cadA)Score=5.6         6.71e-10  [+1(6.71e-10)]
Daro_2257(cadA)Score=6.5         1.05e-11  [+1(1.05e-11)]
CV1154(cadA)Score=6.7,Po         4.13e-13  [+1(4.13e-13)]
LHK_00449(cadA)Score=6.2         3.04e-11  [+1(3.04e-11)]
Mfla_0694(czcD)Score=5.3         1.07e-09  [+1(1.07e-09)]
--------------------------------------------------------------------------------

********************************************************************************


********************************************************************************
Stopped because requested number of motifs (1) found.
********************************************************************************

CPU: leftraru1

********************************************************************************
