********************************************************************************
MEME - Motif discovery tool
********************************************************************************
MEME version 4.11.2 (Release date: Thu May 05 14:58:55 2016 -0700)

For further information on how to interpret these results or to get
a copy of the MEME software please access http://meme-suite.org .

This file may be used as input to the MAST algorithm for searching
sequence databases for matches to groups of motifs.  MAST is available
for interactive use and downloading at http://meme-suite.org .
********************************************************************************


********************************************************************************
REFERENCE
********************************************************************************
If you use this program in your research, please cite:

Timothy L. Bailey and Charles Elkan,
"Fitting a mixture model by expectation maximization to discover
motifs in biopolymers", Proceedings of the Second International
Conference on Intelligent Systems for Molecular Biology, pp. 28-36,
AAAI Press, Menlo Park, California, 1994.
********************************************************************************


********************************************************************************
TRAINING SET
********************************************************************************
DATAFILE= CadR-PbrR_Sphingomonadales.fasta
ALPHABET= ACGT
Sequence name            Weight Length  Sequence name            Weight Length  
-------------            ------ ------  -------------            ------ ------  
ELI_04460(czcD)Score=5.7 1.0000     21  Saro_2151(czcD)Score=4.6 1.0000     21  
Sala_2444(czcD)Score=6.2 1.0000     21  Sala_2560(czcD)Score=5.4 1.0000     21  
SJA_C1-05430(czcD)Score= 1.0000     21  ZMO0204(czcD)Score=5,Pos 1.0000     21  
********************************************************************************

********************************************************************************
COMMAND LINE SUMMARY
********************************************************************************
This information can also be useful in the event you wish to report a
problem with the MEME software.

command: meme -dna CadR-PbrR_Sphingomonadales.fasta -oc CadR-PbrR_Sphingomonadales 

model:  mod=         zoops    nmotifs=         1    evt=           inf
object function=  E-value of product of p-values
width:  minw=            8    maxw=           21
width:  wg=             11    ws=              1    endgaps=       yes
nsites: minsites=        2    maxsites=        6    wnsites=       0.8
theta:  spmap=         uni    spfuzz=        0.5
global: substring=     yes    branching=      no    wbranch=        no
em:     prior=   dirichlet    b=            0.01    maxiter=        50
        distance=    1e-05
data:   n=             126    N=               6    shuffle=        -1
strands: +
sample: seed=            0    ctfrac=         -1    maxwords=       -1
Letter frequencies in dataset:
A 0.246 C 0.230 G 0.238 T 0.286 
Background letter frequencies (from dataset with add-one prior applied):
A 0.246 C 0.231 G 0.238 T 0.285 
********************************************************************************


********************************************************************************
MOTIF  1 MEME	width =  21  sites =   6  llr = 118  E-value = 4.1e-022
********************************************************************************
--------------------------------------------------------------------------------
	Motif 1 Description
--------------------------------------------------------------------------------
Simplified        A  7::::5:a::38::3:a:32:
pos.-specific     C  337a:37::2::a::2:::2:
probability       G  :::::2::a:32::77:a722
matrix            T  :73:a:3::83::a:2:::58

         bits    2.1    *   **   *   **   
                 1.9    **  **   **  **   
                 1.7    **  **   **  **   
                 1.5    **  **  ***  **   
Relative         1.3    **  *** ***  **  *
Entropy          1.1 ***** **** **** *** *
(28.3 bits)      0.8 ***** **** ******** *
                 0.6 ********** ******** *
                 0.4 ******************* *
                 0.2 *********************
                 0.0 ---------------------

Multilevel           ATCCTACAGTAACTGGAGGTT
consensus            CCT  CT   G   A   A  
sequence                       T          
                                          
--------------------------------------------------------------------------------

--------------------------------------------------------------------------------
	Motif 1 sites sorted by position p-value
--------------------------------------------------------------------------------
Sequence name             Start   P-value                    Site       
-------------             ----- ---------            ---------------------
ELI_04460(czcD)Score=5.7      1  9.90e-12          . ATCCTCCAGTAACTGGAGATT           
Sala_2444(czcD)Score=6.2      1  1.67e-11          . ATCCTCCAGTGACTGGAGGAT           
Sala_2560(czcD)Score=5.4      1  4.56e-11          . CTTCTACAGTTACTGGAGGTT           
SJA_C1-05430(czcD)Score=      1  1.56e-09          . CTTCTACAGCGACTGGAGGTG           
ZMO0204(czcD)Score=5,Pos      1  3.26e-09          . ACCCTATAGTAACTATAGACT           
Saro_2151(czcD)Score=4.6      1  8.04e-09          . ACCCTGTAGTTGCTACAGGGT           
--------------------------------------------------------------------------------

--------------------------------------------------------------------------------
	Motif 1 block diagrams
--------------------------------------------------------------------------------
SEQUENCE NAME            POSITION P-VALUE  MOTIF DIAGRAM
-------------            ----------------  -------------
ELI_04460(czcD)Score=5.7          9.9e-12  [+1]
Sala_2444(czcD)Score=6.2          1.7e-11  [+1]
Sala_2560(czcD)Score=5.4          4.6e-11  [+1]
SJA_C1-05430(czcD)Score=          1.6e-09  [+1]
ZMO0204(czcD)Score=5,Pos          3.3e-09  [+1]
Saro_2151(czcD)Score=4.6            8e-09  [+1]
--------------------------------------------------------------------------------

--------------------------------------------------------------------------------
	Motif 1 in BLOCKS format
--------------------------------------------------------------------------------
BL   MOTIF 1 width=21 seqs=6
ELI_04460(czcD)Score=5.7 (    1) ATCCTCCAGTAACTGGAGATT  1 
Sala_2444(czcD)Score=6.2 (    1) ATCCTCCAGTGACTGGAGGAT  1 
Sala_2560(czcD)Score=5.4 (    1) CTTCTACAGTTACTGGAGGTT  1 
SJA_C1-05430(czcD)Score= (    1) CTTCTACAGCGACTGGAGGTG  1 
ZMO0204(czcD)Score=5,Pos (    1) ACCCTATAGTAACTATAGACT  1 
Saro_2151(czcD)Score=4.6 (    1) ACCCTGTAGTTGCTACAGGGT  1 
//

--------------------------------------------------------------------------------

--------------------------------------------------------------------------------
	Motif 1 position-specific scoring matrix
--------------------------------------------------------------------------------
log-odds matrix: alength= 4 w= 21 n= 6 bayes= 0.192645 E= 4.1e-022 
   144     53   -923   -923 
  -923     53   -923    123 
  -923    153   -923     23 
  -923    211   -923   -923 
  -923   -923   -923    181 
   102     53    -52   -923 
  -923    153   -923     23 
   202   -923   -923   -923 
  -923   -923    207   -923 
  -923    -47   -923    155 
    44   -923     48     23 
   176   -923    -52   -923 
  -923    211   -923   -923 
  -923   -923   -923    181 
    44   -923    148   -923 
  -923    -47    148    -77 
   202   -923   -923   -923 
  -923   -923    207   -923 
    44   -923    148   -923 
   -56    -47    -52     81 
  -923   -923    -52    155 
--------------------------------------------------------------------------------

--------------------------------------------------------------------------------
	Motif 1 position-specific probability matrix
--------------------------------------------------------------------------------
letter-probability matrix: alength= 4 w= 21 nsites= 6 E= 4.1e-022 
 0.666667  0.333333  0.000000  0.000000 
 0.000000  0.333333  0.000000  0.666667 
 0.000000  0.666667  0.000000  0.333333 
 0.000000  1.000000  0.000000  0.000000 
 0.000000  0.000000  0.000000  1.000000 
 0.500000  0.333333  0.166667  0.000000 
 0.000000  0.666667  0.000000  0.333333 
 1.000000  0.000000  0.000000  0.000000 
 0.000000  0.000000  1.000000  0.000000 
 0.000000  0.166667  0.000000  0.833333 
 0.333333  0.000000  0.333333  0.333333 
 0.833333  0.000000  0.166667  0.000000 
 0.000000  1.000000  0.000000  0.000000 
 0.000000  0.000000  0.000000  1.000000 
 0.333333  0.000000  0.666667  0.000000 
 0.000000  0.166667  0.666667  0.166667 
 1.000000  0.000000  0.000000  0.000000 
 0.000000  0.000000  1.000000  0.000000 
 0.333333  0.000000  0.666667  0.000000 
 0.166667  0.166667  0.166667  0.500000 
 0.000000  0.000000  0.166667  0.833333 
--------------------------------------------------------------------------------

--------------------------------------------------------------------------------
	Motif 1 regular expression
--------------------------------------------------------------------------------
[AC][TC][CT]CT[AC][CT]AGT[AGT]ACT[GA]GAG[GA]TT
--------------------------------------------------------------------------------




Time  0.02 secs.

********************************************************************************


********************************************************************************
SUMMARY OF MOTIFS
********************************************************************************

--------------------------------------------------------------------------------
	Combined block diagrams: non-overlapping sites with p-value < 0.0001
--------------------------------------------------------------------------------
SEQUENCE NAME            COMBINED P-VALUE  MOTIF DIAGRAM
-------------            ----------------  -------------
ELI_04460(czcD)Score=5.7         9.90e-12  [+1(9.90e-12)]
Saro_2151(czcD)Score=4.6         8.04e-09  [+1(8.04e-09)]
Sala_2444(czcD)Score=6.2         1.67e-11  [+1(1.67e-11)]
Sala_2560(czcD)Score=5.4         4.56e-11  [+1(4.56e-11)]
SJA_C1-05430(czcD)Score=         1.56e-09  [+1(1.56e-09)]
ZMO0204(czcD)Score=5,Pos         3.26e-09  [+1(3.26e-09)]
--------------------------------------------------------------------------------

********************************************************************************


********************************************************************************
Stopped because requested number of motifs (1) found.
********************************************************************************

CPU: leftraru1

********************************************************************************
