********************************************************************************
MEME - Motif discovery tool
********************************************************************************
MEME version 4.11.2 (Release date: Thu May 05 14:58:55 2016 -0700)

For further information on how to interpret these results or to get
a copy of the MEME software please access http://meme-suite.org .

This file may be used as input to the MAST algorithm for searching
sequence databases for matches to groups of motifs.  MAST is available
for interactive use and downloading at http://meme-suite.org .
********************************************************************************


********************************************************************************
REFERENCE
********************************************************************************
If you use this program in your research, please cite:

Timothy L. Bailey and Charles Elkan,
"Fitting a mixture model by expectation maximization to discover
motifs in biopolymers", Proceedings of the Second International
Conference on Intelligent Systems for Molecular Biology, pp. 28-36,
AAAI Press, Menlo Park, California, 1994.
********************************************************************************


********************************************************************************
TRAINING SET
********************************************************************************
DATAFILE= CadR-PbrR_Comamonadaceae.fasta
ALPHABET= ACGT
Sequence name            Weight Length  Sequence name            Weight Length  
-------------            ------ ------  -------------            ------ ------  
Aave_1815(cadA)Score=5.2 1.0000     21  Ajs_1335(cadA)Score=5.5, 1.0000     21  
Ajs_1241(pbrR)Score=6.3P 1.0000     21  Ajs_1242(cadA)Score=6.3, 1.0000     21  
Ajs_3474(czcD)Score=5.2, 1.0000     21  Ajs_2594(cadA)Score=5.7, 1.0000     21  
CtesDRAFT_1695(cadA)Scor 1.0000     21  CtesDRAFT_2651(pbrR)Scor 1.0000     21  
CtesDRAFT_2650(cadA)Scor 1.0000     21  CtesDRAFT_1793(cadA)Scor 1.0000     21  
CtesDRAFT_0050(cadA)Scor 1.0000     21  Daci_0479(cadA)Score=5.7 1.0000     21  
Daci_2915(cadA)Score=4.9 1.0000     21  Pnap_4001(cadA)Score=4.9 1.0000     21  
Bpro_3481(czcD)Score=5.3 1.0000     21  Rfer_0854(cadA)Score=5.7 1.0000     21  
Vapar_3562(cadA)Score=4. 1.0000     21  Veis_2983(czcD)Score=6.2 1.0000     21  
Veis_1666(czcD)Score=4.7 1.0000     21  Mpe_A2353(pbrT)Score=5.4 1.0000     21  
Mpe_A1655(czcD)Score=6Po 1.0000     21  
********************************************************************************

********************************************************************************
COMMAND LINE SUMMARY
********************************************************************************
This information can also be useful in the event you wish to report a
problem with the MEME software.

command: meme -dna CadR-PbrR_Comamonadaceae.fasta -oc CadR-PbrR_Comamonadaceae 

model:  mod=         zoops    nmotifs=         1    evt=           inf
object function=  E-value of product of p-values
width:  minw=            8    maxw=           21
width:  wg=             11    ws=              1    endgaps=       yes
nsites: minsites=        2    maxsites=       21    wnsites=       0.8
theta:  spmap=         uni    spfuzz=        0.5
global: substring=     yes    branching=      no    wbranch=        no
em:     prior=   dirichlet    b=            0.01    maxiter=        50
        distance=    1e-05
data:   n=             441    N=              21    shuffle=        -1
strands: +
sample: seed=            0    ctfrac=         -1    maxwords=       -1
Letter frequencies in dataset:
A 0.256 C 0.229 G 0.224 T 0.290 
Background letter frequencies (from dataset with add-one prior applied):
A 0.256 C 0.229 G 0.225 T 0.290 
********************************************************************************


********************************************************************************
MOTIF  1 MEME	width =  21  sites =  21  llr = 366  E-value = 1.3e-117
********************************************************************************
--------------------------------------------------------------------------------
	Motif 1 Description
--------------------------------------------------------------------------------
Simplified        A  a::::53a::25::5:a12::
pos.-specific     C  :a56:1::25::9:16:::::
probability       G  :::::42:7:451::::77a:
matrix            T  ::44a:4:154::a44:1::a

         bits    2.2  *                   
                 1.9 **     *           * 
                 1.7 **  *  *    **  *  **
                 1.5 **  *  *    **  *  **
Relative         1.3 **  *  *    **  *  **
Entropy          1.1 **  *  **  ***  *  **
(25.2 bits)      0.9 ** **  *** *** ******
                 0.6 ****** *** *** ******
                 0.4 ****** *** **********
                 0.2 *********************
                 0.0 ---------------------

Multilevel           ACCCTATAGCGACTACAGGGT
consensus              TT GA  TTG  TT  A  
sequence                   G              
                                          
--------------------------------------------------------------------------------

--------------------------------------------------------------------------------
	Motif 1 sites sorted by position p-value
--------------------------------------------------------------------------------
Sequence name             Start   P-value                    Site       
-------------             ----- ---------            ---------------------
Veis_2983(czcD)Score=6.2      1  2.62e-11          . ACCCTAGAGTTGCTACAGGGT           
Mpe_A1655(czcD)Score=6Po      1  1.35e-10          . ACTCTGGAGCAGCTACAGGGT           
CtesDRAFT_2651(pbrR)Scor      1  2.47e-10          . ACCCTATAGCTACTATAGAGT           
CtesDRAFT_2650(cadA)Scor      1  3.21e-10          . ACTCTATAGTAGCTATAGGGT           
CtesDRAFT_1695(cadA)Scor      1  5.34e-10          . ACTCTATACCAACTACAGGGT           
Rfer_0854(cadA)Score=5.7      1  6.03e-10          . ACTCTATACCTACTATAGGGT           
Ajs_1241(pbrR)Score=6.3P      1  7.71e-10          . ACTCTATAGTTACTATAGAGT           
Ajs_1242(cadA)Score=6.3,      1  1.54e-09          . ACTCTATAGTAACTATAGAGT           
Ajs_2594(cadA)Score=5.7,      1  1.72e-09          . ACCTTGGAGTGGCTTCAAGGT           
Daci_0479(cadA)Score=5.7      1  3.58e-09          . ACCTTGGAGCTACTCCAAGGT           
Ajs_1335(cadA)Score=5.5,      1  3.95e-09          . ACTCTATACCCACTTCAGGGT           
Vapar_3562(cadA)Score=4.      1  4.36e-09          . ACTCTACACCTGCTTCAGGGT           
Bpro_3481(czcD)Score=5.3      1  6.28e-09          . ACCTTGAAGTGGGTCCAGGGT           
Pnap_4001(cadA)Score=4.9      1  8.12e-09          . ACCTTCAAGTGGGTTCAGGGT           
CtesDRAFT_1793(cadA)Scor      1  1.12e-08          . ACTCTCAATCTGCTTTAGGGT           
Aave_1815(cadA)Score=5.2      1  1.32e-08          . ACCTTGAAGCGGCTTGAAGGT           
Daci_2915(cadA)Score=4.9      1  4.36e-08          . ACCTTGAAGTGACTTCACCGT           
Veis_1666(czcD)Score=4.7      1  5.24e-08          . ACCATCGATCGACTCCAGGGT           
Mpe_A2353(pbrT)Score=5.4      1  5.56e-08          . ACCCTGTAGTGGCTACGGACT           
Ajs_3474(czcD)Score=5.2,      1  5.56e-08          . ACATTATAGCTACTATATAGT           
CtesDRAFT_0050(cadA)Scor      1  5.89e-08          . ACCTTGAAGTGACTTTATTGT           
--------------------------------------------------------------------------------

--------------------------------------------------------------------------------
	Motif 1 block diagrams
--------------------------------------------------------------------------------
SEQUENCE NAME            POSITION P-VALUE  MOTIF DIAGRAM
-------------            ----------------  -------------
Veis_2983(czcD)Score=6.2          2.6e-11  [+1]
Mpe_A1655(czcD)Score=6Po          1.4e-10  [+1]
CtesDRAFT_2651(pbrR)Scor          2.5e-10  [+1]
CtesDRAFT_2650(cadA)Scor          3.2e-10  [+1]
CtesDRAFT_1695(cadA)Scor          5.3e-10  [+1]
Rfer_0854(cadA)Score=5.7            6e-10  [+1]
Ajs_1241(pbrR)Score=6.3P          7.7e-10  [+1]
Ajs_1242(cadA)Score=6.3,          1.5e-09  [+1]
Ajs_2594(cadA)Score=5.7,          1.7e-09  [+1]
Daci_0479(cadA)Score=5.7          3.6e-09  [+1]
Ajs_1335(cadA)Score=5.5,            4e-09  [+1]
Vapar_3562(cadA)Score=4.          4.4e-09  [+1]
Bpro_3481(czcD)Score=5.3          6.3e-09  [+1]
Pnap_4001(cadA)Score=4.9          8.1e-09  [+1]
CtesDRAFT_1793(cadA)Scor          1.1e-08  [+1]
Aave_1815(cadA)Score=5.2          1.3e-08  [+1]
Daci_2915(cadA)Score=4.9          4.4e-08  [+1]
Veis_1666(czcD)Score=4.7          5.2e-08  [+1]
Mpe_A2353(pbrT)Score=5.4          5.6e-08  [+1]
Ajs_3474(czcD)Score=5.2,          5.6e-08  [+1]
CtesDRAFT_0050(cadA)Scor          5.9e-08  [+1]
--------------------------------------------------------------------------------

--------------------------------------------------------------------------------
	Motif 1 in BLOCKS format
--------------------------------------------------------------------------------
BL   MOTIF 1 width=21 seqs=21
Veis_2983(czcD)Score=6.2 (    1) ACCCTAGAGTTGCTACAGGGT  1 
Mpe_A1655(czcD)Score=6Po (    1) ACTCTGGAGCAGCTACAGGGT  1 
CtesDRAFT_2651(pbrR)Scor (    1) ACCCTATAGCTACTATAGAGT  1 
CtesDRAFT_2650(cadA)Scor (    1) ACTCTATAGTAGCTATAGGGT  1 
CtesDRAFT_1695(cadA)Scor (    1) ACTCTATACCAACTACAGGGT  1 
Rfer_0854(cadA)Score=5.7 (    1) ACTCTATACCTACTATAGGGT  1 
Ajs_1241(pbrR)Score=6.3P (    1) ACTCTATAGTTACTATAGAGT  1 
Ajs_1242(cadA)Score=6.3, (    1) ACTCTATAGTAACTATAGAGT  1 
Ajs_2594(cadA)Score=5.7, (    1) ACCTTGGAGTGGCTTCAAGGT  1 
Daci_0479(cadA)Score=5.7 (    1) ACCTTGGAGCTACTCCAAGGT  1 
Ajs_1335(cadA)Score=5.5, (    1) ACTCTATACCCACTTCAGGGT  1 
Vapar_3562(cadA)Score=4. (    1) ACTCTACACCTGCTTCAGGGT  1 
Bpro_3481(czcD)Score=5.3 (    1) ACCTTGAAGTGGGTCCAGGGT  1 
Pnap_4001(cadA)Score=4.9 (    1) ACCTTCAAGTGGGTTCAGGGT  1 
CtesDRAFT_1793(cadA)Scor (    1) ACTCTCAATCTGCTTTAGGGT  1 
Aave_1815(cadA)Score=5.2 (    1) ACCTTGAAGCGGCTTGAAGGT  1 
Daci_2915(cadA)Score=4.9 (    1) ACCTTGAAGTGACTTCACCGT  1 
Veis_1666(czcD)Score=4.7 (    1) ACCATCGATCGACTCCAGGGT  1 
Mpe_A2353(pbrT)Score=5.4 (    1) ACCCTGTAGTGGCTACGGACT  1 
Ajs_3474(czcD)Score=5.2, (    1) ACATTATAGCTACTATATAGT  1 
CtesDRAFT_0050(cadA)Scor (    1) ACCTTGAAGTGACTTTATTGT  1 
//

--------------------------------------------------------------------------------

--------------------------------------------------------------------------------
	Motif 1 position-specific scoring matrix
--------------------------------------------------------------------------------
log-odds matrix: alength= 4 w= 21 n= 21 bayes= 1.38995 E= 1.3e-117 
   196  -1104  -1104  -1104 
 -1104    212  -1104  -1104 
  -242    119  -1104     56 
  -242    132  -1104     39 
 -1104  -1104  -1104    179 
    89    -68     76  -1104 
    16   -226      8     56 
   196  -1104  -1104  -1104 
 -1104    -27    167   -160 
 -1104    119  -1104     72 
   -43   -226     76     39 
   103  -1104    108  -1104 
 -1104    198   -124  -1104 
 -1104  -1104  -1104    179 
    89    -68  -1104     39 
 -1104    132   -224     39 
   189  -1104   -224  -1104 
   -84   -226    167   -160 
   -11   -226    157   -260 
 -1104   -226    208  -1104 
 -1104  -1104  -1104    179 
--------------------------------------------------------------------------------

--------------------------------------------------------------------------------
	Motif 1 position-specific probability matrix
--------------------------------------------------------------------------------
letter-probability matrix: alength= 4 w= 21 nsites= 21 E= 1.3e-117 
 1.000000  0.000000  0.000000  0.000000 
 0.000000  1.000000  0.000000  0.000000 
 0.047619  0.523810  0.000000  0.428571 
 0.047619  0.571429  0.000000  0.380952 
 0.000000  0.000000  0.000000  1.000000 
 0.476190  0.142857  0.380952  0.000000 
 0.285714  0.047619  0.238095  0.428571 
 1.000000  0.000000  0.000000  0.000000 
 0.000000  0.190476  0.714286  0.095238 
 0.000000  0.523810  0.000000  0.476190 
 0.190476  0.047619  0.380952  0.380952 
 0.523810  0.000000  0.476190  0.000000 
 0.000000  0.904762  0.095238  0.000000 
 0.000000  0.000000  0.000000  1.000000 
 0.476190  0.142857  0.000000  0.380952 
 0.000000  0.571429  0.047619  0.380952 
 0.952381  0.000000  0.047619  0.000000 
 0.142857  0.047619  0.714286  0.095238 
 0.238095  0.047619  0.666667  0.047619 
 0.000000  0.047619  0.952381  0.000000 
 0.000000  0.000000  0.000000  1.000000 
--------------------------------------------------------------------------------

--------------------------------------------------------------------------------
	Motif 1 regular expression
--------------------------------------------------------------------------------
AC[CT][CT]T[AG][TAG]AG[CT][GT][AG]CT[AT][CT]AG[GA]GT
--------------------------------------------------------------------------------




Time  0.05 secs.

********************************************************************************


********************************************************************************
SUMMARY OF MOTIFS
********************************************************************************

--------------------------------------------------------------------------------
	Combined block diagrams: non-overlapping sites with p-value < 0.0001
--------------------------------------------------------------------------------
SEQUENCE NAME            COMBINED P-VALUE  MOTIF DIAGRAM
-------------            ----------------  -------------
Aave_1815(cadA)Score=5.2         1.32e-08  [+1(1.32e-08)]
Ajs_1335(cadA)Score=5.5,         3.95e-09  [+1(3.95e-09)]
Ajs_1241(pbrR)Score=6.3P         7.71e-10  [+1(7.71e-10)]
Ajs_1242(cadA)Score=6.3,         1.54e-09  [+1(1.54e-09)]
Ajs_3474(czcD)Score=5.2,         5.56e-08  [+1(5.56e-08)]
Ajs_2594(cadA)Score=5.7,         1.72e-09  [+1(1.72e-09)]
CtesDRAFT_1695(cadA)Scor         5.34e-10  [+1(5.34e-10)]
CtesDRAFT_2651(pbrR)Scor         2.47e-10  [+1(2.47e-10)]
CtesDRAFT_2650(cadA)Scor         3.21e-10  [+1(3.21e-10)]
CtesDRAFT_1793(cadA)Scor         1.12e-08  [+1(1.12e-08)]
CtesDRAFT_0050(cadA)Scor         5.89e-08  [+1(5.89e-08)]
Daci_0479(cadA)Score=5.7         3.58e-09  [+1(3.58e-09)]
Daci_2915(cadA)Score=4.9         4.36e-08  [+1(4.36e-08)]
Pnap_4001(cadA)Score=4.9         8.12e-09  [+1(8.12e-09)]
Bpro_3481(czcD)Score=5.3         6.28e-09  [+1(6.28e-09)]
Rfer_0854(cadA)Score=5.7         6.03e-10  [+1(6.03e-10)]
Vapar_3562(cadA)Score=4.         4.36e-09  [+1(4.36e-09)]
Veis_2983(czcD)Score=6.2         2.62e-11  [+1(2.62e-11)]
Veis_1666(czcD)Score=4.7         5.24e-08  [+1(5.24e-08)]
Mpe_A2353(pbrT)Score=5.4         5.56e-08  [+1(5.56e-08)]
Mpe_A1655(czcD)Score=6Po         1.35e-10  [+1(1.35e-10)]
--------------------------------------------------------------------------------

********************************************************************************


********************************************************************************
Stopped because requested number of motifs (1) found.
********************************************************************************

CPU: leftraru1

********************************************************************************
