********************************************************************************
MEME - Motif discovery tool
********************************************************************************
MEME version 4.11.2 (Release date: Thu May 05 14:58:55 2016 -0700)

For further information on how to interpret these results or to get
a copy of the MEME software please access http://meme-suite.org .

This file may be used as input to the MAST algorithm for searching
sequence databases for matches to groups of motifs.  MAST is available
for interactive use and downloading at http://meme-suite.org .
********************************************************************************


********************************************************************************
REFERENCE
********************************************************************************
If you use this program in your research, please cite:

Timothy L. Bailey and Charles Elkan,
"Fitting a mixture model by expectation maximization to discover
motifs in biopolymers", Proceedings of the Second International
Conference on Intelligent Systems for Molecular Biology, pp. 28-36,
AAAI Press, Menlo Park, California, 1994.
********************************************************************************


********************************************************************************
TRAINING SET
********************************************************************************
DATAFILE= CadR-PbrR_Rhizobiales.fasta
ALPHABET= ACGT
Sequence name            Weight Length  Sequence name            Weight Length  
-------------            ------ ------  -------------            ------ ------  
SMc04128(cadA)Score=6,Po 1.0000     21  NGR_c34490(cadA)Score=6, 1.0000     21  
RL4262(cadA)Score=6.3,Po 1.0000     21  RHE_CH03719(cadA)Score=6 1.0000     21  
Atu0889Score=5.2,Pos=-20 1.0000     21  Atu0843(cadA)Score=5.8,P 1.0000     21  
Meso_4426(cadR2)Score=5. 1.0000     21  Meso_4216(PF00501)Score= 1.0000     21  
Meso_4216(PF00501)Score= 1.0000     21  Meso_2849(cadA)Score=6.2 1.0000     21  
Meso_4129(cadA2)Score=5. 1.0000     21  mll2475(cadA)Score=6.1,P 1.0000     21  
BMEI0053(cadA)Score=6.3, 1.0000     21  RPA3260(cadA)Score=4.6Po 1.0000     21  
BBta_7421(cadA)Score=6.2 1.0000     21  Nwi_3134(cadA)Score=5.1, 1.0000     21  
AZC_1456(cadA)Score=6.4P 1.0000     21  Xaut_3978(cadA)Score=6,P 1.0000     21  
Xaut_3338(cadA)Score=6,P 1.0000     21  
********************************************************************************

********************************************************************************
COMMAND LINE SUMMARY
********************************************************************************
This information can also be useful in the event you wish to report a
problem with the MEME software.

command: meme -dna CadR-PbrR_Rhizobiales.fasta -oc CadR-PbrR_Rhizobiales 

model:  mod=         zoops    nmotifs=         1    evt=           inf
object function=  E-value of product of p-values
width:  minw=            8    maxw=           21
width:  wg=             11    ws=              1    endgaps=       yes
nsites: minsites=        2    maxsites=       19    wnsites=       0.8
theta:  spmap=         uni    spfuzz=        0.5
global: substring=     yes    branching=      no    wbranch=        no
em:     prior=   dirichlet    b=            0.01    maxiter=        50
        distance=    1e-05
data:   n=             399    N=              19    shuffle=        -1
strands: +
sample: seed=            0    ctfrac=         -1    maxwords=       -1
Letter frequencies in dataset:
A 0.256 C 0.246 G 0.231 T 0.268 
Background letter frequencies (from dataset with add-one prior applied):
A 0.256 C 0.246 G 0.231 T 0.268 
********************************************************************************


********************************************************************************
MOTIF  1 MEME	width =  20  sites =  19  llr = 352  E-value = 4.4e-108
********************************************************************************
--------------------------------------------------------------------------------
	Motif 1 Description
--------------------------------------------------------------------------------
Simplified        A  54:::1:a:::4::a:a:17
pos.-specific     C  426a:71::24:a1:2::1:
probability       G  ::2::1::a:45:::7:a71
matrix            T  152:a19::821:9:1::12

         bits    2.1    *    *   *    *  
                 1.9    **  **   * * **  
                 1.7    ** ***   * * **  
                 1.5    ** ***   *** **  
Relative         1.3    ** ****  *** **  
Entropy          1.1    ** ****  ******  
(26.7 bits)      0.8    ** **** *********
                 0.6 * ******** *********
                 0.4 ********************
                 0.2 ********************
                 0.0 --------------------

Multilevel           ATCCTCTAGTCGCTAGAGGA
consensus            CAG      CGA   C   T
sequence                       T         
                                         
--------------------------------------------------------------------------------

--------------------------------------------------------------------------------
	Motif 1 sites sorted by position p-value
--------------------------------------------------------------------------------
Sequence name             Start   P-value                    Site      
-------------             ----- ---------            --------------------
RHE_CH03719(cadA)Score=6      1  5.92e-12          . CACCTCTAGTCGCTAGAGGA T         
RL4262(cadA)Score=6.3,Po      1  5.92e-12          . CACCTCTAGTCGCTAGAGGA T         
AZC_1456(cadA)Score=6.4P      1  1.14e-11          . CTCCTCTAGTGACTAGAGGA C         
BMEI0053(cadA)Score=6.3,      1  3.05e-11          . CTCCTCTAGTTACTAGAGGA T         
SMc04128(cadA)Score=6,Po      1  4.90e-11          . AACCTCTAGCCGCTAGAGGA C         
BBta_7421(cadA)Score=6.2      1  8.92e-11          . CTCCTCTAGCGACTAGAGGA C         
Meso_2849(cadA)Score=6.2      1  2.02e-10          . CTCCTATAGTCACTAGAGGA A         
Xaut_3338(cadA)Score=6,P      1  3.24e-10          . CTCCTCTAGTGACTAGAGTA T         
Xaut_3978(cadA)Score=6,P      1  3.24e-10          . CTCCTCTAGTGACTAGAGTA T         
Atu0843(cadA)Score=5.8,P      1  6.31e-10          . AAGCTCTAGTTGCTAGAGGT G         
NGR_c34490(cadA)Score=6,      1  1.58e-09          . TAGCTCTAGTCGCTAGAGGT T         
mll2475(cadA)Score=6.1,P      1  2.08e-09          . AAGCTCTAGTGACTAGAGCA A         
Meso_4426(cadR2)Score=5.      1  4.12e-09          . ATGCTTTAGTCGCCAGAGGA T         
Meso_4216(PF00501)Score=      1  1.56e-08          . ATTCTGTAGTGGCCACAGGA A         
Meso_4216(PF00501)Score=      1  1.76e-08          . ATTCTTTAGTGGCTACAGAA T         
Meso_4129(cadA2)Score=5.      1  1.98e-08          . ACCCTCTAGCTGCTATAGGT C         
Nwi_3134(cadA)Score=5.1,      1  2.09e-08          . ACCCTATAGTTACTACAGGG T         
RPA3260(cadA)Score=4.6Po      1  2.09e-08          . ACCCTGTAGCCGCTACAGGG T         
Atu0889Score=5.2,Pos=-20      1  1.59e-07          . TATCTCCAGTCTCTAGAGAT A         
--------------------------------------------------------------------------------

--------------------------------------------------------------------------------
	Motif 1 block diagrams
--------------------------------------------------------------------------------
SEQUENCE NAME            POSITION P-VALUE  MOTIF DIAGRAM
-------------            ----------------  -------------
RHE_CH03719(cadA)Score=6          5.9e-12  [+1]_1
RL4262(cadA)Score=6.3,Po          5.9e-12  [+1]_1
AZC_1456(cadA)Score=6.4P          1.1e-11  [+1]_1
BMEI0053(cadA)Score=6.3,            3e-11  [+1]_1
SMc04128(cadA)Score=6,Po          4.9e-11  [+1]_1
BBta_7421(cadA)Score=6.2          8.9e-11  [+1]_1
Meso_2849(cadA)Score=6.2            2e-10  [+1]_1
Xaut_3338(cadA)Score=6,P          3.2e-10  [+1]_1
Xaut_3978(cadA)Score=6,P          3.2e-10  [+1]_1
Atu0843(cadA)Score=5.8,P          6.3e-10  [+1]_1
NGR_c34490(cadA)Score=6,          1.6e-09  [+1]_1
mll2475(cadA)Score=6.1,P          2.1e-09  [+1]_1
Meso_4426(cadR2)Score=5.          4.1e-09  [+1]_1
Meso_4216(PF00501)Score=          1.6e-08  [+1]_1
Meso_4216(PF00501)Score=          1.8e-08  [+1]_1
Meso_4129(cadA2)Score=5.            2e-08  [+1]_1
Nwi_3134(cadA)Score=5.1,          2.1e-08  [+1]_1
RPA3260(cadA)Score=4.6Po          2.1e-08  [+1]_1
Atu0889Score=5.2,Pos=-20          1.6e-07  [+1]_1
--------------------------------------------------------------------------------

--------------------------------------------------------------------------------
	Motif 1 in BLOCKS format
--------------------------------------------------------------------------------
BL   MOTIF 1 width=20 seqs=19
RHE_CH03719(cadA)Score=6 (    1) CACCTCTAGTCGCTAGAGGA  1 
RL4262(cadA)Score=6.3,Po (    1) CACCTCTAGTCGCTAGAGGA  1 
AZC_1456(cadA)Score=6.4P (    1) CTCCTCTAGTGACTAGAGGA  1 
BMEI0053(cadA)Score=6.3, (    1) CTCCTCTAGTTACTAGAGGA  1 
SMc04128(cadA)Score=6,Po (    1) AACCTCTAGCCGCTAGAGGA  1 
BBta_7421(cadA)Score=6.2 (    1) CTCCTCTAGCGACTAGAGGA  1 
Meso_2849(cadA)Score=6.2 (    1) CTCCTATAGTCACTAGAGGA  1 
Xaut_3338(cadA)Score=6,P (    1) CTCCTCTAGTGACTAGAGTA  1 
Xaut_3978(cadA)Score=6,P (    1) CTCCTCTAGTGACTAGAGTA  1 
Atu0843(cadA)Score=5.8,P (    1) AAGCTCTAGTTGCTAGAGGT  1 
NGR_c34490(cadA)Score=6, (    1) TAGCTCTAGTCGCTAGAGGT  1 
mll2475(cadA)Score=6.1,P (    1) AAGCTCTAGTGACTAGAGCA  1 
Meso_4426(cadR2)Score=5. (    1) ATGCTTTAGTCGCCAGAGGA  1 
Meso_4216(PF00501)Score= (    1) ATTCTGTAGTGGCCACAGGA  1 
Meso_4216(PF00501)Score= (    1) ATTCTTTAGTGGCTACAGAA  1 
Meso_4129(cadA2)Score=5. (    1) ACCCTCTAGCTGCTATAGGT  1 
Nwi_3134(cadA)Score=5.1, (    1) ACCCTATAGTTACTACAGGG  1 
RPA3260(cadA)Score=4.6Po (    1) ACCCTGTAGCCGCTACAGGG  1 
Atu0889Score=5.2,Pos=-20 (    1) TATCTCCAGTCTCTAGAGAT  1 
//

--------------------------------------------------------------------------------

--------------------------------------------------------------------------------
	Motif 1 position-specific scoring matrix
--------------------------------------------------------------------------------
log-odds matrix: alength= 4 w= 20 n= 38 bayes= 2.59384 E= 4.4e-108 
    89     78  -1089   -135 
    53    -64  -1089     82 
 -1089    136    -13    -76 
 -1089    202  -1089  -1089 
 -1089  -1089  -1089    190 
  -128    148   -113   -135 
 -1089   -222  -1089    182 
   197  -1089  -1089  -1089 
 -1089  -1089    211  -1089 
 -1089    -22  -1089    156 
 -1089     78     67    -35 
    72  -1089    119   -235 
 -1089    202  -1089  -1089 
 -1089   -122  -1089    174 
   197  -1089  -1089  -1089 
 -1089    -22    167   -235 
   197  -1089  -1089  -1089 
 -1089  -1089    211  -1089 
  -128   -222    167   -135 
   142  -1089   -113    -35 
--------------------------------------------------------------------------------

--------------------------------------------------------------------------------
	Motif 1 position-specific probability matrix
--------------------------------------------------------------------------------
letter-probability matrix: alength= 4 w= 20 nsites= 19 E= 4.4e-108 
 0.473684  0.421053  0.000000  0.105263 
 0.368421  0.157895  0.000000  0.473684 
 0.000000  0.631579  0.210526  0.157895 
 0.000000  1.000000  0.000000  0.000000 
 0.000000  0.000000  0.000000  1.000000 
 0.105263  0.684211  0.105263  0.105263 
 0.000000  0.052632  0.000000  0.947368 
 1.000000  0.000000  0.000000  0.000000 
 0.000000  0.000000  1.000000  0.000000 
 0.000000  0.210526  0.000000  0.789474 
 0.000000  0.421053  0.368421  0.210526 
 0.421053  0.000000  0.526316  0.052632 
 0.000000  1.000000  0.000000  0.000000 
 0.000000  0.105263  0.000000  0.894737 
 1.000000  0.000000  0.000000  0.000000 
 0.000000  0.210526  0.736842  0.052632 
 1.000000  0.000000  0.000000  0.000000 
 0.000000  0.000000  1.000000  0.000000 
 0.105263  0.052632  0.736842  0.105263 
 0.684211  0.000000  0.105263  0.210526 
--------------------------------------------------------------------------------

--------------------------------------------------------------------------------
	Motif 1 regular expression
--------------------------------------------------------------------------------
[AC][TA][CG]CTCTAG[TC][CGT][GA]CTA[GC]AGG[AT]
--------------------------------------------------------------------------------




Time  0.04 secs.

********************************************************************************


********************************************************************************
SUMMARY OF MOTIFS
********************************************************************************

--------------------------------------------------------------------------------
	Combined block diagrams: non-overlapping sites with p-value < 0.0001
--------------------------------------------------------------------------------
SEQUENCE NAME            COMBINED P-VALUE  MOTIF DIAGRAM
-------------            ----------------  -------------
SMc04128(cadA)Score=6,Po         9.81e-11  [+1(4.90e-11)]_1
NGR_c34490(cadA)Score=6,         3.17e-09  [+1(1.58e-09)]_1
RL4262(cadA)Score=6.3,Po         1.18e-11  [+1(5.92e-12)]_1
RHE_CH03719(cadA)Score=6         1.18e-11  [+1(5.92e-12)]_1
Atu0889Score=5.2,Pos=-20         3.18e-07  [+1(1.59e-07)]_1
Atu0843(cadA)Score=5.8,P         1.26e-09  [+1(6.31e-10)]_1
Meso_4426(cadR2)Score=5.         8.24e-09  [+1(4.12e-09)]_1
Meso_4216(PF00501)Score=         3.12e-08  [+1(1.56e-08)]_1
Meso_4216(PF00501)Score=         3.52e-08  [+1(1.76e-08)]_1
Meso_2849(cadA)Score=6.2         4.04e-10  [+1(2.02e-10)]_1
Meso_4129(cadA2)Score=5.         3.95e-08  [+1(1.98e-08)]_1
mll2475(cadA)Score=6.1,P         4.16e-09  [+1(2.08e-09)]_1
BMEI0053(cadA)Score=6.3,         6.10e-11  [+1(3.05e-11)]_1
RPA3260(cadA)Score=4.6Po         4.18e-08  [+1(2.09e-08)]_1
BBta_7421(cadA)Score=6.2         1.78e-10  [+1(8.92e-11)]_1
Nwi_3134(cadA)Score=5.1,         4.18e-08  [+1(2.09e-08)]_1
AZC_1456(cadA)Score=6.4P         2.29e-11  [+1(1.14e-11)]_1
Xaut_3978(cadA)Score=6,P         6.49e-10  [+1(3.24e-10)]_1
Xaut_3338(cadA)Score=6,P         6.49e-10  [+1(3.24e-10)]_1
--------------------------------------------------------------------------------

********************************************************************************


********************************************************************************
Stopped because requested number of motifs (1) found.
********************************************************************************

CPU: leftraru1

********************************************************************************
