********************************************************************************
MEME - Motif discovery tool
********************************************************************************
MEME version 5.0.5 (Release date: Mon Mar 18 20:12:19 2019 -0700)

For further information on how to interpret please access http://meme-suite.org.
To get a copy of the MEME software please access http://meme-suite.org.

********************************************************************************


********************************************************************************
REFERENCE
********************************************************************************
If you use this program in your research, please cite:

Timothy L. Bailey and Charles Elkan,
"Fitting a mixture model by expectation maximization to discover
motifs in biopolymers", Proceedings of the Second International
Conference on Intelligent Systems for Molecular Biology, pp. 28-36,
AAAI Press, Menlo Park, California, 1994.
********************************************************************************


********************************************************************************
TRAINING SET
********************************************************************************
PRIMARY SEQUENCES= /home/dtravisany/gitrepo/RegPrecise/Motif_PWM/Nocardiaceae/CsoR_Nocardiaceae.Xml.fasta
CONTROL SEQUENCES= --none--
ALPHABET= ACGT
Sequence name            Weight Length  Sequence name            Weight Length  
-------------            ------ ------  -------------            ------ ------  
RER_43570_p-87(copZ)     1.0000     17  RER_05700_p-49(RER_05700 1.0000     17  
nfa1610_p-27(n/a)        1.0000     17  nfa8420_p-60(csoR)       1.0000     17  
ROP_pROB01-02400_p-82(co 1.0000     17  ROP_pROB01-02370_p-61(cs 1.0000     17  
RHA1_ro03535_p-63(copZ)  1.0000     17  
********************************************************************************

********************************************************************************
COMMAND LINE SUMMARY
********************************************************************************
This information can also be useful in the event you wish to report a
problem with the MEME software.

command: meme -dna /home/dtravisany/gitrepo/RegPrecise/Motif_PWM/Nocardiaceae/CsoR_Nocardiaceae.Xml.fasta -oc /home/dtravisany/gitrepo/RegPrecise/Motif_PWM/Nocardiaceae/CsoR_Nocardiaceae 

model:  mod=         zoops    nmotifs=         1    evt=           inf
objective function:           em=       E-value of product of p-values
                              starts=   E-value of product of p-values
strands: +
width:  minw=            8    maxw=           17
nsites: minsites=        2    maxsites=        7    wnsites=       0.8
theta:  spmap=         uni    spfuzz=        0.5
em:     prior=   dirichlet    b=            0.01    maxiter=        50
        distance=    1e-05
trim:   wg=             11    ws=              1    endgaps=       yes
data:   n=             119    N=               7
sample: seed=            0    hsfrac=          0
        searchsize=    119    norand=         no    csites=       1000
Letter frequencies in dataset:
A 0.202 C 0.193 G 0.395 T 0.21 
Background letter frequencies (from file dataset with add-one prior applied):
A 0.203 C 0.195 G 0.39 T 0.211 
Background model order: 0
********************************************************************************


********************************************************************************
MOTIF ATACCCTAGGGGGGTAT MEME-1	width =  17  sites =   7  llr = 125  E-value = 8.1e-029
********************************************************************************
--------------------------------------------------------------------------------
	Motif ATACCCTAGGGGGGTAT MEME-1 Description
--------------------------------------------------------------------------------
Simplified        A  7:a::::7:::::::a:
pos.-specific     C  :::a7731::1:::1:1
probability       G  3:::33:19a9aaa:::
matrix            T  :a::::7:1:::::9:9

         bits    2.4  ***           * 
                 2.1  ***           * 
                 1.9  ***           * 
                 1.7  ***          ***
Relative         1.4  ***  *  * ******
Entropy          1.2 *******  * ******
(25.8 bits)      0.9 *****************
                 0.7 *****************
                 0.5 *****************
                 0.2 *****************
                 0.0 -----------------

Multilevel           ATACCCTAGGGGGGTAT
consensus            G   GGC          
sequence                              
                                      
--------------------------------------------------------------------------------

--------------------------------------------------------------------------------
	Motif ATACCCTAGGGGGGTAT MEME-1 sites sorted by position p-value
--------------------------------------------------------------------------------
Sequence name             Start   P-value                  Site     
-------------             ----- ---------            -----------------
RER_05700_p-49(RER_05700      1  8.78e-11          . ATACCCTAGGGGGGTAT           
nfa8420_p-60(csoR)            1  5.13e-10          . GTACCCTAGGGGGGTAT           
nfa1610_p-27(n/a)             1  5.13e-10          . GTACCCTAGGGGGGTAT           
RHA1_ro03535_p-63(copZ)       1  4.98e-09          . ATACGGTAGGGGGGTAT           
ROP_pROB01-02400_p-82(co      1  4.98e-09          . ATACGGTAGGGGGGTAT           
RER_43570_p-87(copZ)          1  2.37e-08          . ATACCCCCTGGGGGTAC           
ROP_pROB01-02370_p-61(cs      1  3.49e-08          . ATACCCCGGGCGGGCAT           
--------------------------------------------------------------------------------

--------------------------------------------------------------------------------
	Motif ATACCCTAGGGGGGTAT MEME-1 block diagrams
--------------------------------------------------------------------------------
SEQUENCE NAME            POSITION P-VALUE  MOTIF DIAGRAM
-------------            ----------------  -------------
RER_05700_p-49(RER_05700          8.8e-11  [+1]
nfa8420_p-60(csoR)                5.1e-10  [+1]
nfa1610_p-27(n/a)                 5.1e-10  [+1]
RHA1_ro03535_p-63(copZ)             5e-09  [+1]
ROP_pROB01-02400_p-82(co            5e-09  [+1]
RER_43570_p-87(copZ)              2.4e-08  [+1]
ROP_pROB01-02370_p-61(cs          3.5e-08  [+1]
--------------------------------------------------------------------------------

--------------------------------------------------------------------------------
	Motif ATACCCTAGGGGGGTAT MEME-1 in BLOCKS format
--------------------------------------------------------------------------------
BL   MOTIF ATACCCTAGGGGGGTAT width=17 seqs=7
RER_05700_p-49(RER_05700 (    1) ATACCCTAGGGGGGTAT  1 
nfa8420_p-60(csoR)       (    1) GTACCCTAGGGGGGTAT  1 
nfa1610_p-27(n/a)        (    1) GTACCCTAGGGGGGTAT  1 
RHA1_ro03535_p-63(copZ)  (    1) ATACGGTAGGGGGGTAT  1 
ROP_pROB01-02400_p-82(co (    1) ATACGGTAGGGGGGTAT  1 
RER_43570_p-87(copZ)     (    1) ATACCCCCTGGGGGTAC  1 
ROP_pROB01-02370_p-61(cs (    1) ATACCCCGGGCGGGCAT  1 
//

--------------------------------------------------------------------------------

--------------------------------------------------------------------------------
	Motif ATACCCTAGGGGGGTAT MEME-1 position-specific scoring matrix
--------------------------------------------------------------------------------
log-odds matrix: alength= 4 w= 17 n= 7 bayes= 0.415037 E= 8.1e-029 
   181   -945    -45   -945 
  -945   -945   -945    224 
   230   -945   -945   -945 
  -945    236   -945   -945 
  -945    187    -45   -945 
  -945    187    -45   -945 
  -945     55   -945    176 
   181    -45   -145   -945 
  -945   -945    113    -56 
  -945   -945    136   -945 
  -945    -45    113   -945 
  -945   -945    136   -945 
  -945   -945    136   -945 
  -945   -945    136   -945 
  -945    -45   -945    202 
   230   -945   -945   -945 
  -945    -45   -945    202 
--------------------------------------------------------------------------------

--------------------------------------------------------------------------------
	Motif ATACCCTAGGGGGGTAT MEME-1 position-specific probability matrix
--------------------------------------------------------------------------------
letter-probability matrix: alength= 4 w= 17 nsites= 7 E= 8.1e-029 
 0.714286  0.000000  0.285714  0.000000 
 0.000000  0.000000  0.000000  1.000000 
 1.000000  0.000000  0.000000  0.000000 
 0.000000  1.000000  0.000000  0.000000 
 0.000000  0.714286  0.285714  0.000000 
 0.000000  0.714286  0.285714  0.000000 
 0.000000  0.285714  0.000000  0.714286 
 0.714286  0.142857  0.142857  0.000000 
 0.000000  0.000000  0.857143  0.142857 
 0.000000  0.000000  1.000000  0.000000 
 0.000000  0.142857  0.857143  0.000000 
 0.000000  0.000000  1.000000  0.000000 
 0.000000  0.000000  1.000000  0.000000 
 0.000000  0.000000  1.000000  0.000000 
 0.000000  0.142857  0.000000  0.857143 
 1.000000  0.000000  0.000000  0.000000 
 0.000000  0.142857  0.000000  0.857143 
--------------------------------------------------------------------------------

--------------------------------------------------------------------------------
	Motif ATACCCTAGGGGGGTAT MEME-1 regular expression
--------------------------------------------------------------------------------
[AG]TAC[CG][CG][TC]AGGGGGGTAT
--------------------------------------------------------------------------------




Time  0.02 secs.

********************************************************************************


********************************************************************************
SUMMARY OF MOTIFS
********************************************************************************

--------------------------------------------------------------------------------
	Combined block diagrams: non-overlapping sites with p-value < 0.0001
--------------------------------------------------------------------------------
SEQUENCE NAME            COMBINED P-VALUE  MOTIF DIAGRAM
-------------            ----------------  -------------
RER_43570_p-87(copZ)             2.37e-08  [+1(2.37e-08)]
RER_05700_p-49(RER_05700         8.78e-11  [+1(8.78e-11)]
nfa1610_p-27(n/a)                5.13e-10  [+1(5.13e-10)]
nfa8420_p-60(csoR)               5.13e-10  [+1(5.13e-10)]
ROP_pROB01-02400_p-82(co         4.98e-09  [+1(4.98e-09)]
ROP_pROB01-02370_p-61(cs         3.49e-08  [+1(3.49e-08)]
RHA1_ro03535_p-63(copZ)          4.98e-09  [+1(4.98e-09)]
--------------------------------------------------------------------------------

********************************************************************************


********************************************************************************
Stopped because requested number of motifs (1) found.
********************************************************************************

CPU: optimus

********************************************************************************
