********************************************************************************
MEME - Motif discovery tool
********************************************************************************
MEME version 4.11.2 (Release date: Thu May 05 14:58:55 2016 -0700)

For further information on how to interpret these results or to get
a copy of the MEME software please access http://meme-suite.org .

This file may be used as input to the MAST algorithm for searching
sequence databases for matches to groups of motifs.  MAST is available
for interactive use and downloading at http://meme-suite.org .
********************************************************************************


********************************************************************************
REFERENCE
********************************************************************************
If you use this program in your research, please cite:

Timothy L. Bailey and Charles Elkan,
"Fitting a mixture model by expectation maximization to discover
motifs in biopolymers", Proceedings of the Second International
Conference on Intelligent Systems for Molecular Biology, pp. 28-36,
AAAI Press, Menlo Park, California, 1994.
********************************************************************************


********************************************************************************
TRAINING SET
********************************************************************************
DATAFILE= FabR2_Oceanospirillales_Alteromonadales.fasta
ALPHABET= ACGT
Sequence name            Weight Length  Sequence name            Weight Length  
-------------            ------ ------  -------------            ------ ------  
HCH_06403(fabA)Score=5.1 1.0000     18  HCH_03838(desC)Score=4.8 1.0000     18  
Maqu_3819(COG2072)Score= 1.0000     18  Maqu_3819(COG2072)Score= 1.0000     18  
MED297_00660(hyIII)Score 1.0000     18  MED297_11585(lcfH)Score= 1.0000     18  
********************************************************************************

********************************************************************************
COMMAND LINE SUMMARY
********************************************************************************
This information can also be useful in the event you wish to report a
problem with the MEME software.

command: meme -dna FabR2_Oceanospirillales_Alteromonadales.fasta -oc FabR2_Oceanospirillales_Alteromonadales 

model:  mod=         zoops    nmotifs=         1    evt=           inf
object function=  E-value of product of p-values
width:  minw=            8    maxw=           18
width:  wg=             11    ws=              1    endgaps=       yes
nsites: minsites=        2    maxsites=        6    wnsites=       0.8
theta:  spmap=         uni    spfuzz=        0.5
global: substring=     yes    branching=      no    wbranch=        no
em:     prior=   dirichlet    b=            0.01    maxiter=        50
        distance=    1e-05
data:   n=             108    N=               6    shuffle=        -1
strands: +
sample: seed=            0    ctfrac=         -1    maxwords=       -1
Letter frequencies in dataset:
A 0.296 C 0.148 G 0.139 T 0.417 
Background letter frequencies (from dataset with add-one prior applied):
A 0.295 C 0.152 G 0.143 T 0.411 
********************************************************************************


********************************************************************************
MOTIF  1 MEME	width =  17  sites =   6  llr = 92  E-value = 9.4e-015
********************************************************************************
--------------------------------------------------------------------------------
	Motif 1 Description
--------------------------------------------------------------------------------
Simplified        A  3:82a:a2::::7:8::
pos.-specific     C  2::::a:25:::3::32
probability       G  5:2::::23:a::::::
matrix            T  :a:8:::52a:a:a278

         bits    2.8      *    *      
                 2.5      *    *      
                 2.2      *    *      
                 2.0      *    *      
Relative         1.7     ***   *      
Entropy          1.4  ** ***  *** *   
(22.2 bits)      1.1 *** *** *******  
                 0.8 ******* *********
                 0.6 ******* *********
                 0.3 ******* *********
                 0.0 -----------------

Multilevel           GTATACATCTGTATATT
consensus            A       G   C  C 
sequence                              
                                      
--------------------------------------------------------------------------------

--------------------------------------------------------------------------------
	Motif 1 sites sorted by position p-value
--------------------------------------------------------------------------------
Sequence name             Start   P-value                  Site     
-------------             ----- ---------            -----------------
Maqu_3819(COG2072)Score=      2  3.84e-09          G GTATACAGGTGTCTACT           
Maqu_3819(COG2072)Score=      2  7.48e-09          G GTATACATGTGTCTACC           
MED297_11585(lcfH)Score=      2  2.14e-08          A ATATACATCTGTATATT           
HCH_03838(desC)Score=4.8      2  1.34e-07          T GTGAACAACTGTATATT           
HCH_06403(fabA)Score=5.1      2  1.56e-07          T CTATACATCTGTATTTT           
MED297_00660(hyIII)Score      2  1.97e-07          A ATATACACTTGTATATT           
--------------------------------------------------------------------------------

--------------------------------------------------------------------------------
	Motif 1 block diagrams
--------------------------------------------------------------------------------
SEQUENCE NAME            POSITION P-VALUE  MOTIF DIAGRAM
-------------            ----------------  -------------
Maqu_3819(COG2072)Score=          3.8e-09  1_[+1]
Maqu_3819(COG2072)Score=          7.5e-09  1_[+1]
MED297_11585(lcfH)Score=          2.1e-08  1_[+1]
HCH_03838(desC)Score=4.8          1.3e-07  1_[+1]
HCH_06403(fabA)Score=5.1          1.6e-07  1_[+1]
MED297_00660(hyIII)Score            2e-07  1_[+1]
--------------------------------------------------------------------------------

--------------------------------------------------------------------------------
	Motif 1 in BLOCKS format
--------------------------------------------------------------------------------
BL   MOTIF 1 width=17 seqs=6
Maqu_3819(COG2072)Score= (    2) GTATACAGGTGTCTACT  1 
Maqu_3819(COG2072)Score= (    2) GTATACATGTGTCTACC  1 
MED297_11585(lcfH)Score= (    2) ATATACATCTGTATATT  1 
HCH_03838(desC)Score=4.8 (    2) GTGAACAACTGTATATT  1 
HCH_06403(fabA)Score=5.1 (    2) CTATACATCTGTATTTT  1 
MED297_00660(hyIII)Score (    2) ATATACACTTGTATATT  1 
//

--------------------------------------------------------------------------------

--------------------------------------------------------------------------------
	Motif 1 position-specific scoring matrix
--------------------------------------------------------------------------------
log-odds matrix: alength= 4 w= 17 n= 12 bayes= 1.71621 E= 9.4e-015 
    18     13    181   -923 
  -923   -923   -923    128 
   150   -923     22   -923 
   -82   -923   -923    102 
   176   -923   -923   -923 
  -923    272   -923   -923 
   176   -923   -923   -923 
   -82     13     22     28 
  -923    172    122   -130 
  -923   -923   -923    128 
  -923   -923    281   -923 
  -923   -923   -923    128 
   118    113   -923   -923 
  -923   -923   -923    128 
   150   -923   -923   -130 
  -923    113   -923     70 
  -923     13   -923    102 
--------------------------------------------------------------------------------

--------------------------------------------------------------------------------
	Motif 1 position-specific probability matrix
--------------------------------------------------------------------------------
letter-probability matrix: alength= 4 w= 17 nsites= 6 E= 9.4e-015 
 0.333333  0.166667  0.500000  0.000000 
 0.000000  0.000000  0.000000  1.000000 
 0.833333  0.000000  0.166667  0.000000 
 0.166667  0.000000  0.000000  0.833333 
 1.000000  0.000000  0.000000  0.000000 
 0.000000  1.000000  0.000000  0.000000 
 1.000000  0.000000  0.000000  0.000000 
 0.166667  0.166667  0.166667  0.500000 
 0.000000  0.500000  0.333333  0.166667 
 0.000000  0.000000  0.000000  1.000000 
 0.000000  0.000000  1.000000  0.000000 
 0.000000  0.000000  0.000000  1.000000 
 0.666667  0.333333  0.000000  0.000000 
 0.000000  0.000000  0.000000  1.000000 
 0.833333  0.000000  0.000000  0.166667 
 0.000000  0.333333  0.000000  0.666667 
 0.000000  0.166667  0.000000  0.833333 
--------------------------------------------------------------------------------

--------------------------------------------------------------------------------
	Motif 1 regular expression
--------------------------------------------------------------------------------
[GA]TATACAT[CG]TGT[AC]TA[TC]T
--------------------------------------------------------------------------------




Time  0.01 secs.

********************************************************************************


********************************************************************************
SUMMARY OF MOTIFS
********************************************************************************

--------------------------------------------------------------------------------
	Combined block diagrams: non-overlapping sites with p-value < 0.0001
--------------------------------------------------------------------------------
SEQUENCE NAME            COMBINED P-VALUE  MOTIF DIAGRAM
-------------            ----------------  -------------
HCH_06403(fabA)Score=5.1         3.11e-07  1_[+1(1.56e-07)]
HCH_03838(desC)Score=4.8         2.68e-07  1_[+1(1.34e-07)]
Maqu_3819(COG2072)Score=         1.50e-08  1_[+1(7.48e-09)]
Maqu_3819(COG2072)Score=         7.69e-09  1_[+1(3.84e-09)]
MED297_00660(hyIII)Score         3.93e-07  1_[+1(1.97e-07)]
MED297_11585(lcfH)Score=         4.27e-08  1_[+1(2.14e-08)]
--------------------------------------------------------------------------------

********************************************************************************


********************************************************************************
Stopped because requested number of motifs (1) found.
********************************************************************************

CPU: leftraru1

********************************************************************************
