********************************************************************************
MEME - Motif discovery tool
********************************************************************************
MEME version 5.0.5 (Release date: Mon Mar 18 20:12:19 2019 -0700)

For further information on how to interpret please access http://meme-suite.org.
To get a copy of the MEME software please access http://meme-suite.org.

********************************************************************************


********************************************************************************
REFERENCE
********************************************************************************
If you use this program in your research, please cite:

Timothy L. Bailey and Charles Elkan,
"Fitting a mixture model by expectation maximization to discover
motifs in biopolymers", Proceedings of the Second International
Conference on Intelligent Systems for Molecular Biology, pp. 28-36,
AAAI Press, Menlo Park, California, 1994.
********************************************************************************


********************************************************************************
TRAINING SET
********************************************************************************
PRIMARY SEQUENCES= /home/dtravisany/gitrepo/RegPrecise/Motif_PWM/Pseudomonadaceae/FabR2_Pseudomonadaceae.Xml.fasta
CONTROL SEQUENCES= --none--
ALPHABET= ACGT
Sequence name            Weight Length  Sequence name            Weight Length  
-------------            ------ ------  -------------            ------ ------  
PA1538_p-33(COG2072)     1.0000     18  PA1539_p-98(fabR2)       1.0000     18  
Pmen_2620_p-68(COG2072)  1.0000     18  Pmen_2620_p-48(COG2072)  1.0000     18  
Pmen_2619_p-66(fabR2)    1.0000     18  Pmen_2619_p-86(fabR2)    1.0000     18  
********************************************************************************

********************************************************************************
COMMAND LINE SUMMARY
********************************************************************************
This information can also be useful in the event you wish to report a
problem with the MEME software.

command: meme -dna /home/dtravisany/gitrepo/RegPrecise/Motif_PWM/Pseudomonadaceae/FabR2_Pseudomonadaceae.Xml.fasta -oc /home/dtravisany/gitrepo/RegPrecise/Motif_PWM/Pseudomonadaceae/FabR2_Pseudomonadaceae 

model:  mod=         zoops    nmotifs=         1    evt=           inf
objective function:           em=       E-value of product of p-values
                              starts=   E-value of product of p-values
strands: +
width:  minw=            8    maxw=           18
nsites: minsites=        2    maxsites=        6    wnsites=       0.8
theta:  spmap=         uni    spfuzz=        0.5
em:     prior=   dirichlet    b=            0.01    maxiter=        50
        distance=    1e-05
trim:   wg=             11    ws=              1    endgaps=       yes
data:   n=             108    N=               6
sample: seed=            0    hsfrac=          0
        searchsize=    108    norand=         no    csites=       1000
Letter frequencies in dataset:
A 0.315 C 0.185 G 0.185 T 0.315 
Background letter frequencies (from file dataset with add-one prior applied):
A 0.312 C 0.188 G 0.188 T 0.312 
Background model order: 0
********************************************************************************


********************************************************************************
MOTIF GTAKACAKMTGTMTAC MEME-1	width =  16  sites =   6  llr = 105  E-value = 9.2e-019
********************************************************************************
--------------------------------------------------------------------------------
	Motif GTAKACAKMTGTMTAC MEME-1 Description
--------------------------------------------------------------------------------
Simplified        A  ::8:a:a:5:::7:a:
pos.-specific     C  ::2::a:23:::3::a
probability       G  a::3:::32:a::2::
matrix            T  :a:7:::5:a:a:8::

         bits    2.4 *    *    *    *
                 2.2 *    *    *    *
                 1.9 *    *    *    *
                 1.7 **  ***  ***  **
Relative         1.4 **  ***  ***  **
Entropy          1.2 *** ***  *** ***
(25.2 bits)      1.0 *******  *******
                 0.7 *******  *******
                 0.5 ****************
                 0.2 ****************
                 0.0 ----------------

Multilevel           GTATACATATGTATAC
consensus               G   GC   C   
sequence                             
                                     
--------------------------------------------------------------------------------

--------------------------------------------------------------------------------
	Motif GTAKACAKMTGTMTAC MEME-1 sites sorted by position p-value
--------------------------------------------------------------------------------
Sequence name             Start   P-value                  Site    
-------------             ----- ---------            ----------------
PA1539_p-98(fabR2)            2  4.74e-09          T GTAGACATCTGTATAC T         
PA1538_p-33(COG2072)          2  4.74e-09          A GTATACAGATGTCTAC A         
Pmen_2619_p-66(fabR2)         2  1.15e-08          G GTAGACATGTGTATAC T         
Pmen_2620_p-68(COG2072)       2  1.15e-08          A GTATACACATGTCTAC C         
Pmen_2619_p-86(fabR2)         2  1.38e-08          T GTCTACATCTGTATAC C         
Pmen_2620_p-48(COG2072)       2  1.38e-08          G GTATACAGATGTAGAC A         
--------------------------------------------------------------------------------

--------------------------------------------------------------------------------
	Motif GTAKACAKMTGTMTAC MEME-1 block diagrams
--------------------------------------------------------------------------------
SEQUENCE NAME            POSITION P-VALUE  MOTIF DIAGRAM
-------------            ----------------  -------------
PA1539_p-98(fabR2)                4.7e-09  1_[+1]_1
PA1538_p-33(COG2072)              4.7e-09  1_[+1]_1
Pmen_2619_p-66(fabR2)             1.2e-08  1_[+1]_1
Pmen_2620_p-68(COG2072)           1.2e-08  1_[+1]_1
Pmen_2619_p-86(fabR2)             1.4e-08  1_[+1]_1
Pmen_2620_p-48(COG2072)           1.4e-08  1_[+1]_1
--------------------------------------------------------------------------------

--------------------------------------------------------------------------------
	Motif GTAKACAKMTGTMTAC MEME-1 in BLOCKS format
--------------------------------------------------------------------------------
BL   MOTIF GTAKACAKMTGTMTAC width=16 seqs=6
PA1539_p-98(fabR2)       (    2) GTAGACATCTGTATAC  1 
PA1538_p-33(COG2072)     (    2) GTATACAGATGTCTAC  1 
Pmen_2619_p-66(fabR2)    (    2) GTAGACATGTGTATAC  1 
Pmen_2620_p-68(COG2072)  (    2) GTATACACATGTCTAC  1 
Pmen_2619_p-86(fabR2)    (    2) GTCTACATCTGTATAC  1 
Pmen_2620_p-48(COG2072)  (    2) GTATACAGATGTAGAC  1 
//

--------------------------------------------------------------------------------

--------------------------------------------------------------------------------
	Motif GTAKACAKMTGTMTAC MEME-1 position-specific scoring matrix
--------------------------------------------------------------------------------
log-odds matrix: alength= 4 w= 16 n= 18 bayes= 2.44057 E= 9.2e-019 
  -923   -923    241   -923 
  -923   -923   -923    168 
   141    -17   -923   -923 
  -923   -923     83    109 
   168   -923   -923   -923 
  -923    241   -923   -923 
   168   -923   -923   -923 
  -923    -17     83     68 
    68     83    -17   -923 
  -923   -923   -923    168 
  -923   -923    241   -923 
  -923   -923   -923    168 
   109     83   -923   -923 
  -923   -923    -17    141 
   168   -923   -923   -923 
  -923    241   -923   -923 
--------------------------------------------------------------------------------

--------------------------------------------------------------------------------
	Motif GTAKACAKMTGTMTAC MEME-1 position-specific probability matrix
--------------------------------------------------------------------------------
letter-probability matrix: alength= 4 w= 16 nsites= 6 E= 9.2e-019 
 0.000000  0.000000  1.000000  0.000000 
 0.000000  0.000000  0.000000  1.000000 
 0.833333  0.166667  0.000000  0.000000 
 0.000000  0.000000  0.333333  0.666667 
 1.000000  0.000000  0.000000  0.000000 
 0.000000  1.000000  0.000000  0.000000 
 1.000000  0.000000  0.000000  0.000000 
 0.000000  0.166667  0.333333  0.500000 
 0.500000  0.333333  0.166667  0.000000 
 0.000000  0.000000  0.000000  1.000000 
 0.000000  0.000000  1.000000  0.000000 
 0.000000  0.000000  0.000000  1.000000 
 0.666667  0.333333  0.000000  0.000000 
 0.000000  0.000000  0.166667  0.833333 
 1.000000  0.000000  0.000000  0.000000 
 0.000000  1.000000  0.000000  0.000000 
--------------------------------------------------------------------------------

--------------------------------------------------------------------------------
	Motif GTAKACAKMTGTMTAC MEME-1 regular expression
--------------------------------------------------------------------------------
GTA[TG]ACA[TG][AC]TGT[AC]TAC
--------------------------------------------------------------------------------




Time  0.01 secs.

********************************************************************************


********************************************************************************
SUMMARY OF MOTIFS
********************************************************************************

--------------------------------------------------------------------------------
	Combined block diagrams: non-overlapping sites with p-value < 0.0001
--------------------------------------------------------------------------------
SEQUENCE NAME            COMBINED P-VALUE  MOTIF DIAGRAM
-------------            ----------------  -------------
PA1538_p-33(COG2072)             1.42e-08  1_[+1(4.74e-09)]_1
PA1539_p-98(fabR2)               1.42e-08  1_[+1(4.74e-09)]_1
Pmen_2620_p-68(COG2072)          3.46e-08  1_[+1(1.15e-08)]_1
Pmen_2620_p-48(COG2072)          4.15e-08  1_[+1(1.38e-08)]_1
Pmen_2619_p-66(fabR2)            3.46e-08  1_[+1(1.15e-08)]_1
Pmen_2619_p-86(fabR2)            4.15e-08  1_[+1(1.38e-08)]_1
--------------------------------------------------------------------------------

********************************************************************************


********************************************************************************
Stopped because requested number of motifs (1) found.
********************************************************************************

CPU: optimus

********************************************************************************
