********************************************************************************
MEME - Motif discovery tool
********************************************************************************
MEME version 5.0.5 (Release date: Mon Mar 18 20:12:19 2019 -0700)

For further information on how to interpret please access http://meme-suite.org.
To get a copy of the MEME software please access http://meme-suite.org.

********************************************************************************


********************************************************************************
REFERENCE
********************************************************************************
If you use this program in your research, please cite:

Timothy L. Bailey and Charles Elkan,
"Fitting a mixture model by expectation maximization to discover
motifs in biopolymers", Proceedings of the Second International
Conference on Intelligent Systems for Molecular Biology, pp. 28-36,
AAAI Press, Menlo Park, California, 1994.
********************************************************************************


********************************************************************************
TRAINING SET
********************************************************************************
PRIMARY SEQUENCES= /home/dtravisany/gitrepo/RegPrecise/Motif_PWM/Oceanospirillales_Alteromonadales/GntR_Oceanospirillales_Alteromonadales.Xml.fasta
CONTROL SEQUENCES= --none--
ALPHABET= ACGT
Sequence name            Weight Length  Sequence name            Weight Length  
-------------            ------ ------  -------------            ------ ------  
HCH_03539_p-129(gntX)    1.0000     20  HCH_03539_p-103(gntX)    1.0000     20  
Mmwyl1_0698_p-123(gntX)  1.0000     20  Mmwyl1_0698_p-100(gntX)  1.0000     20  
Csal_0926_p-69(gntK)     1.0000     20  Csal_0927_p-53(gntR)     1.0000     20  
Csal_0925_p-107(gntU)    1.0000     20  Csal_0925_p-40(gntU)     1.0000     20  
********************************************************************************

********************************************************************************
COMMAND LINE SUMMARY
********************************************************************************
This information can also be useful in the event you wish to report a
problem with the MEME software.

command: meme -dna /home/dtravisany/gitrepo/RegPrecise/Motif_PWM/Oceanospirillales_Alteromonadales/GntR_Oceanospirillales_Alteromonadales.Xml.fasta -oc /home/dtravisany/gitrepo/RegPrecise/Motif_PWM/Oceanospirillales_Alteromonadales/GntR_Oceanospirillales_Alteromonadales 

model:  mod=         zoops    nmotifs=         1    evt=           inf
objective function:           em=       E-value of product of p-values
                              starts=   E-value of product of p-values
strands: +
width:  minw=            8    maxw=           20
nsites: minsites=        2    maxsites=        8    wnsites=       0.8
theta:  spmap=         uni    spfuzz=        0.5
em:     prior=   dirichlet    b=            0.01    maxiter=        50
        distance=    1e-05
trim:   wg=             11    ws=              1    endgaps=       yes
data:   n=             160    N=               8
sample: seed=            0    hsfrac=          0
        searchsize=    160    norand=         no    csites=       1000
Letter frequencies in dataset:
A 0.287 C 0.25 G 0.231 T 0.231 
Background letter frequencies (from file dataset with add-one prior applied):
A 0.287 C 0.25 G 0.232 T 0.232 
Background model order: 0
********************************************************************************


********************************************************************************
MOTIF GTTACCGGTAACA MEME-1	width =  13  sites =   8  llr = 116  E-value = 9.9e-024
********************************************************************************
--------------------------------------------------------------------------------
	Motif GTTACCGGTAACA MEME-1 Description
--------------------------------------------------------------------------------
Simplified        A  :::9:::::99:8
pos.-specific     C  :1::9a:111:a:
probability       G  a:11::a9::1:3
matrix            T  :99:1:::9::::

         bits    2.1 *     *      
                 1.9 *    **    * 
                 1.7 *    **    * 
                 1.5 *** *****  * 
Relative         1.3 ************ 
Entropy          1.1 *************
(20.9 bits)      0.8 *************
                 0.6 *************
                 0.4 *************
                 0.2 *************
                 0.0 -------------

Multilevel           GTTACCGGTAACA
consensus                        G
sequence                          
                                  
--------------------------------------------------------------------------------

--------------------------------------------------------------------------------
	Motif GTTACCGGTAACA MEME-1 sites sorted by position p-value
--------------------------------------------------------------------------------
Sequence name             Start   P-value                Site   
-------------             ----- ---------            -------------
Csal_0925_p-107(gntU)         5  1.65e-08       GAAT GTTACCGGTAACA TTC       
Mmwyl1_0698_p-100(gntX)       5  1.65e-08       TCTA GTTACCGGTAACA TTT       
HCH_03539_p-103(gntX)         5  1.65e-08       GAAT GTTACCGGTAACA CGC       
HCH_03539_p-129(gntX)         5  1.65e-08       AAAA GTTACCGGTAACA AAT       
Mmwyl1_0698_p-123(gntX)       5  8.64e-08       AAAT GTTATCGGTAACA TCA       
Csal_0927_p-53(gntR)          5  1.56e-07       GAAC GTTACCGCTAACA TCG       
Csal_0925_p-40(gntU)          5  1.83e-06       CCTC GTTGCCGGTCGCG CCT       
Csal_0926_p-69(gntK)          5  2.48e-06       AGGC GCGACCGGCAACG AGG       
--------------------------------------------------------------------------------

--------------------------------------------------------------------------------
	Motif GTTACCGGTAACA MEME-1 block diagrams
--------------------------------------------------------------------------------
SEQUENCE NAME            POSITION P-VALUE  MOTIF DIAGRAM
-------------            ----------------  -------------
Csal_0925_p-107(gntU)             1.7e-08  4_[+1]_3
Mmwyl1_0698_p-100(gntX)           1.7e-08  4_[+1]_3
HCH_03539_p-103(gntX)             1.7e-08  4_[+1]_3
HCH_03539_p-129(gntX)             1.7e-08  4_[+1]_3
Mmwyl1_0698_p-123(gntX)           8.6e-08  4_[+1]_3
Csal_0927_p-53(gntR)              1.6e-07  4_[+1]_3
Csal_0925_p-40(gntU)              1.8e-06  4_[+1]_3
Csal_0926_p-69(gntK)              2.5e-06  4_[+1]_3
--------------------------------------------------------------------------------

--------------------------------------------------------------------------------
	Motif GTTACCGGTAACA MEME-1 in BLOCKS format
--------------------------------------------------------------------------------
BL   MOTIF GTTACCGGTAACA width=13 seqs=8
Csal_0925_p-107(gntU)    (    5) GTTACCGGTAACA  1 
Mmwyl1_0698_p-100(gntX)  (    5) GTTACCGGTAACA  1 
HCH_03539_p-103(gntX)    (    5) GTTACCGGTAACA  1 
HCH_03539_p-129(gntX)    (    5) GTTACCGGTAACA  1 
Mmwyl1_0698_p-123(gntX)  (    5) GTTATCGGTAACA  1 
Csal_0927_p-53(gntR)     (    5) GTTACCGCTAACA  1 
Csal_0925_p-40(gntU)     (    5) GTTGCCGGTCGCG  1 
Csal_0926_p-69(gntK)     (    5) GCGACCGGCAACG  1 
//

--------------------------------------------------------------------------------

--------------------------------------------------------------------------------
	Motif GTTACCGGTAACA MEME-1 position-specific scoring matrix
--------------------------------------------------------------------------------
log-odds matrix: alength= 4 w= 13 n= 64 bayes= 4.24793 E= 9.9e-024 
  -965   -965    211   -965 
  -965   -100   -965    192 
  -965   -965    -89    192 
   161   -965    -89   -965 
  -965    181   -965    -89 
  -965    200   -965   -965 
  -965   -965    211   -965 
  -965   -100    192   -965 
  -965   -100   -965    192 
   161   -100   -965   -965 
   161   -965    -89   -965 
  -965    200   -965   -965 
   139   -965     11   -965 
--------------------------------------------------------------------------------

--------------------------------------------------------------------------------
	Motif GTTACCGGTAACA MEME-1 position-specific probability matrix
--------------------------------------------------------------------------------
letter-probability matrix: alength= 4 w= 13 nsites= 8 E= 9.9e-024 
 0.000000  0.000000  1.000000  0.000000 
 0.000000  0.125000  0.000000  0.875000 
 0.000000  0.000000  0.125000  0.875000 
 0.875000  0.000000  0.125000  0.000000 
 0.000000  0.875000  0.000000  0.125000 
 0.000000  1.000000  0.000000  0.000000 
 0.000000  0.000000  1.000000  0.000000 
 0.000000  0.125000  0.875000  0.000000 
 0.000000  0.125000  0.000000  0.875000 
 0.875000  0.125000  0.000000  0.000000 
 0.875000  0.000000  0.125000  0.000000 
 0.000000  1.000000  0.000000  0.000000 
 0.750000  0.000000  0.250000  0.000000 
--------------------------------------------------------------------------------

--------------------------------------------------------------------------------
	Motif GTTACCGGTAACA MEME-1 regular expression
--------------------------------------------------------------------------------
GTTACCGGTAAC[AG]
--------------------------------------------------------------------------------




Time  0.01 secs.

********************************************************************************


********************************************************************************
SUMMARY OF MOTIFS
********************************************************************************

--------------------------------------------------------------------------------
	Combined block diagrams: non-overlapping sites with p-value < 0.0001
--------------------------------------------------------------------------------
SEQUENCE NAME            COMBINED P-VALUE  MOTIF DIAGRAM
-------------            ----------------  -------------
HCH_03539_p-129(gntX)            1.32e-07  4_[+1(1.65e-08)]_3
HCH_03539_p-103(gntX)            1.32e-07  4_[+1(1.65e-08)]_3
Mmwyl1_0698_p-123(gntX)          6.91e-07  4_[+1(8.64e-08)]_3
Mmwyl1_0698_p-100(gntX)          1.32e-07  4_[+1(1.65e-08)]_3
Csal_0926_p-69(gntK)             1.98e-05  4_[+1(2.48e-06)]_3
Csal_0927_p-53(gntR)             1.25e-06  4_[+1(1.56e-07)]_3
Csal_0925_p-107(gntU)            1.32e-07  4_[+1(1.65e-08)]_3
Csal_0925_p-40(gntU)             1.47e-05  4_[+1(1.83e-06)]_3
--------------------------------------------------------------------------------

********************************************************************************


********************************************************************************
Stopped because requested number of motifs (1) found.
********************************************************************************

CPU: optimus

********************************************************************************
