********************************************************************************
MEME - Motif discovery tool
********************************************************************************
MEME version 5.0.5 (Release date: Mon Mar 18 20:12:19 2019 -0700)

For further information on how to interpret please access http://meme-suite.org.
To get a copy of the MEME software please access http://meme-suite.org.

********************************************************************************


********************************************************************************
REFERENCE
********************************************************************************
If you use this program in your research, please cite:

Timothy L. Bailey and Charles Elkan,
"Fitting a mixture model by expectation maximization to discover
motifs in biopolymers", Proceedings of the Second International
Conference on Intelligent Systems for Molecular Biology, pp. 28-36,
AAAI Press, Menlo Park, California, 1994.
********************************************************************************


********************************************************************************
TRAINING SET
********************************************************************************
PRIMARY SEQUENCES= /home/dtravisany/gitrepo/RegPrecise/Motif_PWM/Comamonadaceae/GntR_Comamonadaceae.Xml.fasta
CONTROL SEQUENCES= --none--
ALPHABET= ACGT
Sequence name            Weight Length  Sequence name            Weight Length  
-------------            ------ ------  -------------            ------ ------  
Aave_2797_p-109(gntK)    1.0000     20  Aave_2798_p-55(gntR)     1.0000     20  
Aave_2798_p-172(gntR)    1.0000     20  Ajs_2054_p-55(gntR)      1.0000     20  
Ajs_2054_p-219(gntR)     1.0000     20  Ajs_2053_p-180(gntK)     1.0000     20  
CtesDRAFT_0562_p-181(gnt 1.0000     20  CtesDRAFT_0562_p-55(gntR 1.0000     20  
CtesDRAFT_0561_p-21(gntK 1.0000     20  CtesDRAFT_0561_p-147(gnt 1.0000     20  
Daci_3761_p-120(gntK)    1.0000     20  Daci_3760_p-175(gntR)    1.0000     20  
Daci_3760_p-56(gntR)     1.0000     20  Pnap_0047_p-128(gntR)    1.0000     20  
Pnap_0046_p-140(gntK)    1.0000     20  Pnap_0046_p-30(gntK)     1.0000     20  
Rfer_0956_p-33(gntK)     1.0000     20  Rfer_0957_p-197(gntR)    1.0000     20  
Vapar_6142_p-66(gntT)    1.0000     20  Vapar_6142_p-141(gntT)   1.0000     20  
Vapar_6141_p-70(gntR)    1.0000     20  Vapar_6141_p-54(gntR)    1.0000     20  
Vapar_6141_p-145(gntR)   1.0000     20  Vapar_6142_p-157(gntT)   1.0000     20  
Lcho_0327_p-128(gntK)    1.0000     20  Lcho_0327_p-19(gntK)     1.0000     20  
Lcho_0328_p-170(gntR)    1.0000     20  Lcho_0328_p-61(gntR)     1.0000     20  
********************************************************************************

********************************************************************************
COMMAND LINE SUMMARY
********************************************************************************
This information can also be useful in the event you wish to report a
problem with the MEME software.

command: meme -dna /home/dtravisany/gitrepo/RegPrecise/Motif_PWM/Comamonadaceae/GntR_Comamonadaceae.Xml.fasta -oc /home/dtravisany/gitrepo/RegPrecise/Motif_PWM/Comamonadaceae/GntR_Comamonadaceae 

model:  mod=         zoops    nmotifs=         1    evt=           inf
objective function:           em=       E-value of product of p-values
                              starts=   E-value of product of p-values
strands: +
width:  minw=            8    maxw=           20
nsites: minsites=        2    maxsites=       28    wnsites=       0.8
theta:  spmap=         uni    spfuzz=        0.5
em:     prior=   dirichlet    b=            0.01    maxiter=        50
        distance=    1e-05
trim:   wg=             11    ws=              1    endgaps=       yes
data:   n=             560    N=              28
sample: seed=            0    hsfrac=          0
        searchsize=    560    norand=         no    csites=       1000
Letter frequencies in dataset:
A 0.263 C 0.234 G 0.234 T 0.27 
Background letter frequencies (from file dataset with add-one prior applied):
A 0.262 C 0.234 G 0.234 T 0.27 
Background model order: 0
********************************************************************************


********************************************************************************
MOTIF TDGGATAGCGCTATCCHA MEME-1	width =  18  sites =  28  llr = 512  E-value = 2.4e-171
********************************************************************************
--------------------------------------------------------------------------------
	Motif TDGGATAGCGCTATCCHA MEME-1 Description
--------------------------------------------------------------------------------
Simplified        A  143:a:a:::::9::136
pos.-specific     C  21:::1::a:a:::a72:
probability       G  :27a:::a:a::1:::11
matrix            T  731::9:::::a:a:343

         bits    2.1    *   ****   *   
                 1.9    ** ****** **   
                 1.7    ** ****** **   
                 1.5    ************   
Relative         1.3    ************   
Entropy          1.0    ************   
(26.4 bits)      0.8   **************  
                 0.6 * ************** *
                 0.4 * ************** *
                 0.2 **************** *
                 0.0 ------------------

Multilevel           TAGGATAGCGCTATCCTA
consensus             TA            TAT
sequence              G              C 
                                       
--------------------------------------------------------------------------------

--------------------------------------------------------------------------------
	Motif TDGGATAGCGCTATCCHA MEME-1 sites sorted by position p-value
--------------------------------------------------------------------------------
Sequence name             Start   P-value                   Site     
-------------             ----- ---------            ------------------
Lcho_0327_p-128(gntK)         2  4.52e-11          C TAGGATAGCGCTATCCAA A         
Pnap_0046_p-140(gntK)         2  4.52e-11          A TAGGATAGCGCTATCCCA A         
Lcho_0328_p-61(gntR)          2  7.58e-11          T TTGGATAGCGCTATCCTA G         
CtesDRAFT_0562_p-181(gnt      2  3.44e-10          T TTGGATAGCGCTATCCGA T         
CtesDRAFT_0561_p-21(gntK      2  5.59e-10          A TCGGATAGCGCTATCCAA A         
Daci_3760_p-175(gntR)         2  7.27e-10          T TGGGATAGCGCTATCCAT G         
Aave_2798_p-55(gntR)          2  1.12e-09          G CAAGATAGCGCTATCCTA G         
Pnap_0047_p-128(gntR)         2  1.35e-09          C TTGGATAGCGCTATCCGT T         
Aave_2798_p-172(gntR)         2  1.35e-09          C TTGGATAGCGCTATCCGT T         
Vapar_6141_p-70(gntR)         2  1.59e-09          C TGGGACAGCGCTATCCTA G         
Vapar_6142_p-141(gntT)        2  1.59e-09          C TAGGATAGCGCTGTCCCA G         
Aave_2797_p-109(gntK)         2  1.59e-09          C TAGGATAGCGCTATCTTG C         
Daci_3760_p-56(gntR)          2  2.36e-09          T TGGGATAGCGCTATCATA A         
Daci_3761_p-120(gntK)         2  2.36e-09          T TATGATAGCGCTATCCCA A         
Vapar_6142_p-66(gntT)         2  3.08e-09          G CGGGATAGCGCTATCCCT G         
Ajs_2053_p-180(gntK)          2  3.33e-09          T TAAGATAGCGCTATCTTT C         
Lcho_0327_p-19(gntK)          2  3.58e-09          A CGAGATAGCGCTATCCAA A         
Pnap_0046_p-30(gntK)          2  3.58e-09          A ACGGATAGCGCTATCCAA G         
Lcho_0328_p-170(gntR)         2  4.74e-09          T TTGGATAGCGCTATCTCG T         
Rfer_0956_p-33(gntK)          2  5.20e-09          T TAAGATAGCGCTATCTAT T         
Ajs_2054_p-55(gntR)           2  5.61e-09          G AAAGATAGCGCTATCTTA A         
Vapar_6141_p-145(gntR)        2  6.40e-09          C AGGGATAGCGCTATCCCG C         
Rfer_0957_p-197(gntR)         2  8.75e-09          A ATAGATAGCGCTATCTTA A         
Ajs_2054_p-219(gntR)          2  8.75e-09          T CAAGATAGCGCTATCTTT A         
Vapar_6141_p-54(gntR)         2  1.00e-08          C TAGGACAGCGCTGTCCAA T         
Vapar_6142_p-157(gntT)        2  1.08e-08          A TTGGACAGCGCTGTCCTA G         
CtesDRAFT_0561_p-147(gnt      2  1.21e-08          T TATGATAGCGCTATCCGG A         
CtesDRAFT_0562_p-55(gntR      2  1.21e-08          T CCGGATAGCGCTATCATA A         
--------------------------------------------------------------------------------

--------------------------------------------------------------------------------
	Motif TDGGATAGCGCTATCCHA MEME-1 block diagrams
--------------------------------------------------------------------------------
SEQUENCE NAME            POSITION P-VALUE  MOTIF DIAGRAM
-------------            ----------------  -------------
Lcho_0327_p-128(gntK)             4.5e-11  1_[+1]_1
Pnap_0046_p-140(gntK)             4.5e-11  1_[+1]_1
Lcho_0328_p-61(gntR)              7.6e-11  1_[+1]_1
CtesDRAFT_0562_p-181(gnt          3.4e-10  1_[+1]_1
CtesDRAFT_0561_p-21(gntK          5.6e-10  1_[+1]_1
Daci_3760_p-175(gntR)             7.3e-10  1_[+1]_1
Aave_2798_p-55(gntR)              1.1e-09  1_[+1]_1
Pnap_0047_p-128(gntR)             1.3e-09  1_[+1]_1
Aave_2798_p-172(gntR)             1.3e-09  1_[+1]_1
Vapar_6141_p-70(gntR)             1.6e-09  1_[+1]_1
Vapar_6142_p-141(gntT)            1.6e-09  1_[+1]_1
Aave_2797_p-109(gntK)             1.6e-09  1_[+1]_1
Daci_3760_p-56(gntR)              2.4e-09  1_[+1]_1
Daci_3761_p-120(gntK)             2.4e-09  1_[+1]_1
Vapar_6142_p-66(gntT)             3.1e-09  1_[+1]_1
Ajs_2053_p-180(gntK)              3.3e-09  1_[+1]_1
Lcho_0327_p-19(gntK)              3.6e-09  1_[+1]_1
Pnap_0046_p-30(gntK)              3.6e-09  1_[+1]_1
Lcho_0328_p-170(gntR)             4.7e-09  1_[+1]_1
Rfer_0956_p-33(gntK)              5.2e-09  1_[+1]_1
Ajs_2054_p-55(gntR)               5.6e-09  1_[+1]_1
Vapar_6141_p-145(gntR)            6.4e-09  1_[+1]_1
Rfer_0957_p-197(gntR)             8.8e-09  1_[+1]_1
Ajs_2054_p-219(gntR)              8.8e-09  1_[+1]_1
Vapar_6141_p-54(gntR)               1e-08  1_[+1]_1
Vapar_6142_p-157(gntT)            1.1e-08  1_[+1]_1
CtesDRAFT_0561_p-147(gnt          1.2e-08  1_[+1]_1
CtesDRAFT_0562_p-55(gntR          1.2e-08  1_[+1]_1
--------------------------------------------------------------------------------

--------------------------------------------------------------------------------
	Motif TDGGATAGCGCTATCCHA MEME-1 in BLOCKS format
--------------------------------------------------------------------------------
BL   MOTIF TDGGATAGCGCTATCCHA width=18 seqs=28
Lcho_0327_p-128(gntK)    (    2) TAGGATAGCGCTATCCAA  1 
Pnap_0046_p-140(gntK)    (    2) TAGGATAGCGCTATCCCA  1 
Lcho_0328_p-61(gntR)     (    2) TTGGATAGCGCTATCCTA  1 
CtesDRAFT_0562_p-181(gnt (    2) TTGGATAGCGCTATCCGA  1 
CtesDRAFT_0561_p-21(gntK (    2) TCGGATAGCGCTATCCAA  1 
Daci_3760_p-175(gntR)    (    2) TGGGATAGCGCTATCCAT  1 
Aave_2798_p-55(gntR)     (    2) CAAGATAGCGCTATCCTA  1 
Pnap_0047_p-128(gntR)    (    2) TTGGATAGCGCTATCCGT  1 
Aave_2798_p-172(gntR)    (    2) TTGGATAGCGCTATCCGT  1 
Vapar_6141_p-70(gntR)    (    2) TGGGACAGCGCTATCCTA  1 
Vapar_6142_p-141(gntT)   (    2) TAGGATAGCGCTGTCCCA  1 
Aave_2797_p-109(gntK)    (    2) TAGGATAGCGCTATCTTG  1 
Daci_3760_p-56(gntR)     (    2) TGGGATAGCGCTATCATA  1 
Daci_3761_p-120(gntK)    (    2) TATGATAGCGCTATCCCA  1 
Vapar_6142_p-66(gntT)    (    2) CGGGATAGCGCTATCCCT  1 
Ajs_2053_p-180(gntK)     (    2) TAAGATAGCGCTATCTTT  1 
Lcho_0327_p-19(gntK)     (    2) CGAGATAGCGCTATCCAA  1 
Pnap_0046_p-30(gntK)     (    2) ACGGATAGCGCTATCCAA  1 
Lcho_0328_p-170(gntR)    (    2) TTGGATAGCGCTATCTCG  1 
Rfer_0956_p-33(gntK)     (    2) TAAGATAGCGCTATCTAT  1 
Ajs_2054_p-55(gntR)      (    2) AAAGATAGCGCTATCTTA  1 
Vapar_6141_p-145(gntR)   (    2) AGGGATAGCGCTATCCCG  1 
Rfer_0957_p-197(gntR)    (    2) ATAGATAGCGCTATCTTA  1 
Ajs_2054_p-219(gntR)     (    2) CAAGATAGCGCTATCTTT  1 
Vapar_6141_p-54(gntR)    (    2) TAGGACAGCGCTGTCCAA  1 
Vapar_6142_p-157(gntT)   (    2) TTGGACAGCGCTGTCCTA  1 
CtesDRAFT_0561_p-147(gnt (    2) TATGATAGCGCTATCCGG  1 
CtesDRAFT_0562_p-55(gntR (    2) CCGGATAGCGCTATCATA  1 
//

--------------------------------------------------------------------------------

--------------------------------------------------------------------------------
	Motif TDGGATAGCGCTATCCHA MEME-1 position-specific scoring matrix
--------------------------------------------------------------------------------
log-odds matrix: alength= 4 w= 18 n= 84 bayes= 3.41504 E= 2.4e-171 
   -88    -39  -1145    133 
    71   -113    -13    -11 
    -7  -1145    154   -191 
 -1145  -1145    209  -1145 
   193  -1145  -1145  -1145 
 -1145   -113  -1145    173 
   193  -1145  -1145  -1145 
 -1145  -1145    209  -1145 
 -1145    209  -1145  -1145 
 -1145  -1145    209  -1145 
 -1145    209  -1145  -1145 
 -1145  -1145  -1145    189 
   177  -1145   -113  -1145 
 -1145  -1145  -1145    189 
 -1145    209  -1145  -1145 
  -188    154  -1145    -11 
    -7    -13    -71     54 
   121  -1145    -71    -11 
--------------------------------------------------------------------------------

--------------------------------------------------------------------------------
	Motif TDGGATAGCGCTATCCHA MEME-1 position-specific probability matrix
--------------------------------------------------------------------------------
letter-probability matrix: alength= 4 w= 18 nsites= 28 E= 2.4e-171 
 0.142857  0.178571  0.000000  0.678571 
 0.428571  0.107143  0.214286  0.250000 
 0.250000  0.000000  0.678571  0.071429 
 0.000000  0.000000  1.000000  0.000000 
 1.000000  0.000000  0.000000  0.000000 
 0.000000  0.107143  0.000000  0.892857 
 1.000000  0.000000  0.000000  0.000000 
 0.000000  0.000000  1.000000  0.000000 
 0.000000  1.000000  0.000000  0.000000 
 0.000000  0.000000  1.000000  0.000000 
 0.000000  1.000000  0.000000  0.000000 
 0.000000  0.000000  0.000000  1.000000 
 0.892857  0.000000  0.107143  0.000000 
 0.000000  0.000000  0.000000  1.000000 
 0.000000  1.000000  0.000000  0.000000 
 0.071429  0.678571  0.000000  0.250000 
 0.250000  0.214286  0.142857  0.392857 
 0.607143  0.000000  0.142857  0.250000 
--------------------------------------------------------------------------------

--------------------------------------------------------------------------------
	Motif TDGGATAGCGCTATCCHA MEME-1 regular expression
--------------------------------------------------------------------------------
T[ATG][GA]GATAGCGCTATC[CT][TAC][AT]
--------------------------------------------------------------------------------




Time  0.04 secs.

********************************************************************************


********************************************************************************
SUMMARY OF MOTIFS
********************************************************************************

--------------------------------------------------------------------------------
	Combined block diagrams: non-overlapping sites with p-value < 0.0001
--------------------------------------------------------------------------------
SEQUENCE NAME            COMBINED P-VALUE  MOTIF DIAGRAM
-------------            ----------------  -------------
Aave_2797_p-109(gntK)            4.78e-09  1_[+1(1.59e-09)]_1
Aave_2798_p-55(gntR)             3.36e-09  1_[+1(1.12e-09)]_1
Aave_2798_p-172(gntR)            4.04e-09  1_[+1(1.35e-09)]_1
Ajs_2054_p-55(gntR)              1.68e-08  1_[+1(5.61e-09)]_1
Ajs_2054_p-219(gntR)             2.63e-08  1_[+1(8.75e-09)]_1
Ajs_2053_p-180(gntK)             9.99e-09  1_[+1(3.33e-09)]_1
CtesDRAFT_0562_p-181(gnt         1.03e-09  1_[+1(3.44e-10)]_1
CtesDRAFT_0562_p-55(gntR         3.64e-08  1_[+1(1.21e-08)]_1
CtesDRAFT_0561_p-21(gntK         1.68e-09  1_[+1(5.59e-10)]_1
CtesDRAFT_0561_p-147(gnt         3.64e-08  1_[+1(1.21e-08)]_1
Daci_3761_p-120(gntK)            7.09e-09  1_[+1(2.36e-09)]_1
Daci_3760_p-175(gntR)            2.18e-09  1_[+1(7.27e-10)]_1
Daci_3760_p-56(gntR)             7.09e-09  1_[+1(2.36e-09)]_1
Pnap_0047_p-128(gntR)            4.04e-09  1_[+1(1.35e-09)]_1
Pnap_0046_p-140(gntK)            1.36e-10  1_[+1(4.52e-11)]_1
Pnap_0046_p-30(gntK)             1.08e-08  1_[+1(3.58e-09)]_1
Rfer_0956_p-33(gntK)             1.56e-08  1_[+1(5.20e-09)]_1
Rfer_0957_p-197(gntR)            2.63e-08  1_[+1(8.75e-09)]_1
Vapar_6142_p-66(gntT)            9.25e-09  1_[+1(3.08e-09)]_1
Vapar_6142_p-141(gntT)           4.78e-09  1_[+1(1.59e-09)]_1
Vapar_6141_p-70(gntR)            4.78e-09  1_[+1(1.59e-09)]_1
Vapar_6141_p-54(gntR)            3.01e-08  1_[+1(1.00e-08)]_1
Vapar_6141_p-145(gntR)           1.92e-08  1_[+1(6.40e-09)]_1
Vapar_6142_p-157(gntT)           3.25e-08  1_[+1(1.08e-08)]_1
Lcho_0327_p-128(gntK)            1.36e-10  1_[+1(4.52e-11)]_1
Lcho_0327_p-19(gntK)             1.08e-08  1_[+1(3.58e-09)]_1
Lcho_0328_p-170(gntR)            1.42e-08  1_[+1(4.74e-09)]_1
Lcho_0328_p-61(gntR)             2.27e-10  1_[+1(7.58e-11)]_1
--------------------------------------------------------------------------------

********************************************************************************


********************************************************************************
Stopped because requested number of motifs (1) found.
********************************************************************************

CPU: optimus

********************************************************************************
