********************************************************************************
MEME - Motif discovery tool
********************************************************************************
MEME version 5.0.5 (Release date: Mon Mar 18 20:12:19 2019 -0700)

For further information on how to interpret please access http://meme-suite.org.
To get a copy of the MEME software please access http://meme-suite.org.

********************************************************************************


********************************************************************************
REFERENCE
********************************************************************************
If you use this program in your research, please cite:

Timothy L. Bailey and Charles Elkan,
"Fitting a mixture model by expectation maximization to discover
motifs in biopolymers", Proceedings of the Second International
Conference on Intelligent Systems for Molecular Biology, pp. 28-36,
AAAI Press, Menlo Park, California, 1994.
********************************************************************************


********************************************************************************
TRAINING SET
********************************************************************************
PRIMARY SEQUENCES= /home/dtravisany/gitrepo/RegPrecise/Motif_PWM/Chloroflexi/HcpR_Chloroflexia.Xml.fasta
CONTROL SEQUENCES= --none--
ALPHABET= ACGT
Sequence name            Weight Length  Sequence name            Weight Length  
-------------            ------ ------  -------------            ------ ------  
Cagg_2669_p-86(Rcas_3898 1.0000     20  Cagg_2026_p-116(Rcas_389 1.0000     20  
Rcas_3898_p-111(Rcas_389 1.0000     20  RoseRS_0596_p-105(Rcas_3 1.0000     20  
********************************************************************************

********************************************************************************
COMMAND LINE SUMMARY
********************************************************************************
This information can also be useful in the event you wish to report a
problem with the MEME software.

command: meme -dna /home/dtravisany/gitrepo/RegPrecise/Motif_PWM/Chloroflexi/HcpR_Chloroflexia.Xml.fasta -oc /home/dtravisany/gitrepo/RegPrecise/Motif_PWM/Chloroflexi/HcpR_Chloroflexia 

model:  mod=         zoops    nmotifs=         1    evt=           inf
objective function:           em=       E-value of product of p-values
                              starts=   E-value of product of p-values
strands: +
width:  minw=            8    maxw=           20
nsites: minsites=        2    maxsites=        4    wnsites=       0.8
theta:  spmap=         uni    spfuzz=        0.5
em:     prior=   dirichlet    b=            0.01    maxiter=        50
        distance=    1e-05
trim:   wg=             11    ws=              1    endgaps=       yes
data:   n=              80    N=               4
sample: seed=            0    hsfrac=          0
        searchsize=     80    norand=         no    csites=       1000
Letter frequencies in dataset:
A 0.275 C 0.312 G 0.263 T 0.15 
Background letter frequencies (from file dataset with add-one prior applied):
A 0.274 C 0.31 G 0.262 T 0.155 
Background model order: 0
********************************************************************************


********************************************************************************
MOTIF AACTTGCGCYAGCGCAACGA MEME-1	width =  20  sites =   4  llr = 99  E-value = 1.3e-018
********************************************************************************
--------------------------------------------------------------------------------
	Motif AACTTGCGCYAGCGCAACGA MEME-1 Description
--------------------------------------------------------------------------------
Simplified        A  a8::::::::a::::aa::8
pos.-specific     C  ::8:::a:a5::a:a::a::
probability       G  ::3::a:a:::a:a::::a:
matrix            T  :3:aa::::5:::::::::3

         bits    2.7    **               
                 2.4    **               
                 2.2    **               
                 1.9 *  *** *  ** * ** * 
Relative         1.6 *  ****** ********* 
Entropy          1.3 ** ****** **********
(35.6 bits)      1.1 ** *****************
                 0.8 ********************
                 0.5 ********************
                 0.3 ********************
                 0.0 --------------------

Multilevel           AACTTGCGCCAGCGCAACGA
consensus             TG      T         T
sequence                                 
                                         
--------------------------------------------------------------------------------

--------------------------------------------------------------------------------
	Motif AACTTGCGCYAGCGCAACGA MEME-1 sites sorted by position p-value
--------------------------------------------------------------------------------
Sequence name             Start   P-value                    Site      
-------------             ----- ---------            --------------------
Cagg_2026_p-116(Rcas_389      1  3.68e-12          . ATCTTGCGCTAGCGCAACGA           
RoseRS_0596_p-105(Rcas_3      1  7.13e-12          . AACTTGCGCCAGCGCAACGA           
Rcas_3898_p-111(Rcas_389      1  7.13e-12          . AACTTGCGCCAGCGCAACGA           
Cagg_2669_p-86(Rcas_3898      1  1.47e-11          . AAGTTGCGCTAGCGCAACGT           
--------------------------------------------------------------------------------

--------------------------------------------------------------------------------
	Motif AACTTGCGCYAGCGCAACGA MEME-1 block diagrams
--------------------------------------------------------------------------------
SEQUENCE NAME            POSITION P-VALUE  MOTIF DIAGRAM
-------------            ----------------  -------------
Cagg_2026_p-116(Rcas_389          3.7e-12  [+1]
RoseRS_0596_p-105(Rcas_3          7.1e-12  [+1]
Rcas_3898_p-111(Rcas_389          7.1e-12  [+1]
Cagg_2669_p-86(Rcas_3898          1.5e-11  [+1]
--------------------------------------------------------------------------------

--------------------------------------------------------------------------------
	Motif AACTTGCGCYAGCGCAACGA MEME-1 in BLOCKS format
--------------------------------------------------------------------------------
BL   MOTIF AACTTGCGCYAGCGCAACGA width=20 seqs=4
Cagg_2026_p-116(Rcas_389 (    1) ATCTTGCGCTAGCGCAACGA  1 
RoseRS_0596_p-105(Rcas_3 (    1) AACTTGCGCCAGCGCAACGA  1 
Rcas_3898_p-111(Rcas_389 (    1) AACTTGCGCCAGCGCAACGA  1 
Cagg_2669_p-86(Rcas_3898 (    1) AAGTTGCGCTAGCGCAACGT  1 
//

--------------------------------------------------------------------------------

--------------------------------------------------------------------------------
	Motif AACTTGCGCYAGCGCAACGA MEME-1 position-specific scoring matrix
--------------------------------------------------------------------------------
log-odds matrix: alength= 4 w= 20 n= 4 bayes= -0.584963 E= 1.3e-018 
   187   -865   -865   -865 
   145   -865   -865     69 
  -865    127     -7   -865 
  -865   -865   -865    269 
  -865   -865   -865    269 
  -865   -865    193   -865 
  -865    169   -865   -865 
  -865   -865    193   -865 
  -865    169   -865   -865 
  -865     69   -865    169 
   187   -865   -865   -865 
  -865   -865    193   -865 
  -865    169   -865   -865 
  -865   -865    193   -865 
  -865    169   -865   -865 
   187   -865   -865   -865 
   187   -865   -865   -865 
  -865    169   -865   -865 
  -865   -865    193   -865 
   145   -865   -865     69 
--------------------------------------------------------------------------------

--------------------------------------------------------------------------------
	Motif AACTTGCGCYAGCGCAACGA MEME-1 position-specific probability matrix
--------------------------------------------------------------------------------
letter-probability matrix: alength= 4 w= 20 nsites= 4 E= 1.3e-018 
 1.000000  0.000000  0.000000  0.000000 
 0.750000  0.000000  0.000000  0.250000 
 0.000000  0.750000  0.250000  0.000000 
 0.000000  0.000000  0.000000  1.000000 
 0.000000  0.000000  0.000000  1.000000 
 0.000000  0.000000  1.000000  0.000000 
 0.000000  1.000000  0.000000  0.000000 
 0.000000  0.000000  1.000000  0.000000 
 0.000000  1.000000  0.000000  0.000000 
 0.000000  0.500000  0.000000  0.500000 
 1.000000  0.000000  0.000000  0.000000 
 0.000000  0.000000  1.000000  0.000000 
 0.000000  1.000000  0.000000  0.000000 
 0.000000  0.000000  1.000000  0.000000 
 0.000000  1.000000  0.000000  0.000000 
 1.000000  0.000000  0.000000  0.000000 
 1.000000  0.000000  0.000000  0.000000 
 0.000000  1.000000  0.000000  0.000000 
 0.000000  0.000000  1.000000  0.000000 
 0.750000  0.000000  0.000000  0.250000 
--------------------------------------------------------------------------------

--------------------------------------------------------------------------------
	Motif AACTTGCGCYAGCGCAACGA MEME-1 regular expression
--------------------------------------------------------------------------------
A[AT][CG]TTGCGC[CT]AGCGCAACG[AT]
--------------------------------------------------------------------------------




Time  0.01 secs.

********************************************************************************


********************************************************************************
SUMMARY OF MOTIFS
********************************************************************************

--------------------------------------------------------------------------------
	Combined block diagrams: non-overlapping sites with p-value < 0.0001
--------------------------------------------------------------------------------
SEQUENCE NAME            COMBINED P-VALUE  MOTIF DIAGRAM
-------------            ----------------  -------------
Cagg_2669_p-86(Rcas_3898         1.47e-11  [+1(1.47e-11)]
Cagg_2026_p-116(Rcas_389         3.68e-12  [+1(3.68e-12)]
Rcas_3898_p-111(Rcas_389         7.13e-12  [+1(7.13e-12)]
RoseRS_0596_p-105(Rcas_3         7.13e-12  [+1(7.13e-12)]
--------------------------------------------------------------------------------

********************************************************************************


********************************************************************************
Stopped because requested number of motifs (1) found.
********************************************************************************

CPU: optimus

********************************************************************************
