********************************************************************************
MEME - Motif discovery tool
********************************************************************************
MEME version 5.0.5 (Release date: Mon Mar 18 20:12:19 2019 -0700)

For further information on how to interpret please access http://meme-suite.org.
To get a copy of the MEME software please access http://meme-suite.org.

********************************************************************************


********************************************************************************
REFERENCE
********************************************************************************
If you use this program in your research, please cite:

Timothy L. Bailey and Charles Elkan,
"Fitting a mixture model by expectation maximization to discover
motifs in biopolymers", Proceedings of the Second International
Conference on Intelligent Systems for Molecular Biology, pp. 28-36,
AAAI Press, Menlo Park, California, 1994.
********************************************************************************


********************************************************************************
TRAINING SET
********************************************************************************
PRIMARY SEQUENCES= /home/dtravisany/gitrepo/RegPrecise/Motif_PWM/Comamonadaceae/HexR_Comamonadaceae.Xml.fasta
CONTROL SEQUENCES= --none--
ALPHABET= ACGT
Sequence name            Weight Length  Sequence name            Weight Length  
-------------            ------ ------  -------------            ------ ------  
Aave_4581_p-47(pykA)     1.0000     17  Aave_0942_p-105(zwf)     1.0000     17  
Ajs_0695_p-93(zwf)       1.0000     17  Ajs_3956_p-38(pykA)      1.0000     17  
CtesDRAFT_3819_p-157(pgk 1.0000     17  CtesDRAFT_3719_p-39(pykA 1.0000     17  
Daci_0828_p-27(pgk)      1.0000     17  Daci_0930_p-38(pykA)     1.0000     17  
Daci_5599_p-47(zwf)      1.0000     17  Daci_5598_p-24(pgi)      1.0000     17  
Daci_5598_p-109(pgi)     1.0000     17  Pnap_3873_p-30(pykA)     1.0000     17  
Pnap_0653_p13(zwf)       1.0000     17  Pnap_2986_p-54(edd)      1.0000     17  
Bpro_0751_p-74(zwf)      1.0000     17  Bpro_4634_p-26(pykA)     1.0000     17  
Bpro_3551_p-34(edd)      1.0000     17  Bpro_0752_p-95(tal)      1.0000     17  
Rfer_0205_p-29(pykA)     1.0000     17  Rfer_1125_p-123(zwf)     1.0000     17  
Rfer_1126_p-108(tal)     1.0000     17  Rfer_2060_p-32(edd)      1.0000     17  
Veis_1778_p-44(hexR)     1.0000     17  Veis_4223_p-44(zwf)      1.0000     17  
Veis_4222_p-67(pgi)      1.0000     17  Lcho_3387_p-47(zwf)      1.0000     17  
Lcho_2919_p-94(edd)      1.0000     17  Lcho_3386_p-221(tal)     1.0000     17  
********************************************************************************

********************************************************************************
COMMAND LINE SUMMARY
********************************************************************************
This information can also be useful in the event you wish to report a
problem with the MEME software.

command: meme -dna /home/dtravisany/gitrepo/RegPrecise/Motif_PWM/Comamonadaceae/HexR_Comamonadaceae.Xml.fasta -oc /home/dtravisany/gitrepo/RegPrecise/Motif_PWM/Comamonadaceae/HexR_Comamonadaceae 

model:  mod=         zoops    nmotifs=         1    evt=           inf
objective function:           em=       E-value of product of p-values
                              starts=   E-value of product of p-values
strands: +
width:  minw=            8    maxw=           17
nsites: minsites=        2    maxsites=       28    wnsites=       0.8
theta:  spmap=         uni    spfuzz=        0.5
em:     prior=   dirichlet    b=            0.01    maxiter=        50
        distance=    1e-05
trim:   wg=             11    ws=              1    endgaps=       yes
data:   n=             476    N=              28
sample: seed=            0    hsfrac=          0
        searchsize=    476    norand=         no    csites=       1000
Letter frequencies in dataset:
A 0.366 C 0.181 G 0.155 T 0.298 
Background letter frequencies (from file dataset with add-one prior applied):
A 0.365 C 0.181 G 0.156 T 0.298 
Background model order: 0
********************************************************************************


********************************************************************************
MOTIF TGWAACYHRRTTACA MEME-1	width =  15  sites =  28  llr = 343  E-value = 6.2e-104
********************************************************************************
--------------------------------------------------------------------------------
	Motif TGWAACYHRRTTACA MEME-1 Description
--------------------------------------------------------------------------------
Simplified        A  ::5aa:1455:19:8
pos.-specific     C  1::::833:::::a2
probability       G  3a:::::145:::::
matrix            T  6:4::363::a91::

         bits    2.7                
                 2.4  *           * 
                 2.1  *           * 
                 1.9  *        *  * 
Relative         1.6  *   *    *  * 
Entropy          1.3  * ***    ** * 
(17.7 bits)      1.1  * ***   *** * 
                 0.8 ** ***  ****** 
                 0.5 ******* *******
                 0.3 ******* *******
                 0.0 ---------------

Multilevel           TGAAACTAAGTTACA
consensus            G T  TCCGA     
sequence                    T       
                                    
--------------------------------------------------------------------------------

--------------------------------------------------------------------------------
	Motif TGWAACYHRRTTACA MEME-1 sites sorted by position p-value
--------------------------------------------------------------------------------
Sequence name             Start   P-value                 Site    
-------------             ----- ---------            ---------------
Lcho_3387_p-47(zwf)           2  2.02e-08          C TGAAACTCAGTTACA G         
Daci_0930_p-38(pykA)          2  4.79e-08          T TGAAACCCGATTACA A         
CtesDRAFT_3719_p-39(pykA      2  4.79e-08          T TGAAACCCGATTACA T         
Aave_4581_p-47(pykA)          2  4.79e-08          T TGAAACCCGATTACA T         
Rfer_1125_p-123(zwf)          2  6.07e-08          A TGAAACTAAGTTACA T         
Daci_5598_p-109(pgi)          2  1.85e-07          T GGTAACTTGGTTACC A         
Rfer_0205_p-29(pykA)          2  2.15e-07          T GGAAACTTGATTACA A         
Ajs_3956_p-38(pykA)           2  2.15e-07          T CGAAACTCGATTACA T         
Bpro_0751_p-74(zwf)           2  3.19e-07          G TGAAACTAAATTACA A         
CtesDRAFT_3819_p-157(pgk      2  3.92e-07          C TGAAATCCAGTTACA G         
Daci_5599_p-47(zwf)           2  4.39e-07          T GGTAACCAAGTTACC A         
Daci_0828_p-27(pgk)           2  4.39e-07          C TGAAACCGGATTACA G         
Pnap_3873_p-30(pykA)          2  5.00e-07          C GGAAACTAAATTACA A         
Aave_0942_p-105(zwf)          2  5.85e-07          G TGAAACTCGGTAACA T         
Rfer_1126_p-108(tal)          2  7.06e-07          A TGTAACTTAGTTTCA T         
Lcho_3386_p-221(tal)          2  1.40e-06          C TGTAACTGAGTTTCA G         
Rfer_2060_p-32(edd)           2  1.40e-06          A TGTAATTAAGTTACC A         
Ajs_0695_p-93(zwf)            2  1.48e-06          A TGAAACTCGATAACA T         
Veis_4223_p-44(zwf)           2  1.67e-06          A TGTAACGTGATTACA A         
Veis_1778_p-44(hexR)          2  1.67e-06          T GCAAACCCGGTTACA T         
Bpro_4634_p-26(pykA)          2  2.78e-06          C GGGAACTAAATTACA G         
Bpro_0752_p-95(tal)           2  3.01e-06          T TGTAATTTAGTTTCA C         
Veis_4222_p-67(pgi)           2  3.48e-06          T CGTAATCAAGTTACC A         
Lcho_2919_p-94(edd)           2  4.98e-06          A TGTAACTTAGTTTCG G         
Pnap_0653_p13(zwf)            2  6.38e-06          A TGAAACTTTATTACC T         
Bpro_3551_p-34(edd)           2  8.67e-06          C CGTAATAAAGTTACA T         
Pnap_2986_p-54(edd)           2  8.67e-06          C CGTAATAAAGTTACA T         
Daci_5598_p-24(pgi)           2  1.02e-05          T GGTAATCAGATTACT T         
--------------------------------------------------------------------------------

--------------------------------------------------------------------------------
	Motif TGWAACYHRRTTACA MEME-1 block diagrams
--------------------------------------------------------------------------------
SEQUENCE NAME            POSITION P-VALUE  MOTIF DIAGRAM
-------------            ----------------  -------------
Lcho_3387_p-47(zwf)                 2e-08  1_[+1]_1
Daci_0930_p-38(pykA)              4.8e-08  1_[+1]_1
CtesDRAFT_3719_p-39(pykA          4.8e-08  1_[+1]_1
Aave_4581_p-47(pykA)              4.8e-08  1_[+1]_1
Rfer_1125_p-123(zwf)              6.1e-08  1_[+1]_1
Daci_5598_p-109(pgi)              1.9e-07  1_[+1]_1
Rfer_0205_p-29(pykA)              2.2e-07  1_[+1]_1
Ajs_3956_p-38(pykA)               2.2e-07  1_[+1]_1
Bpro_0751_p-74(zwf)               3.2e-07  1_[+1]_1
CtesDRAFT_3819_p-157(pgk          3.9e-07  1_[+1]_1
Daci_5599_p-47(zwf)               4.4e-07  1_[+1]_1
Daci_0828_p-27(pgk)               4.4e-07  1_[+1]_1
Pnap_3873_p-30(pykA)                5e-07  1_[+1]_1
Aave_0942_p-105(zwf)              5.9e-07  1_[+1]_1
Rfer_1126_p-108(tal)              7.1e-07  1_[+1]_1
Lcho_3386_p-221(tal)              1.4e-06  1_[+1]_1
Rfer_2060_p-32(edd)               1.4e-06  1_[+1]_1
Ajs_0695_p-93(zwf)                1.5e-06  1_[+1]_1
Veis_4223_p-44(zwf)               1.7e-06  1_[+1]_1
Veis_1778_p-44(hexR)              1.7e-06  1_[+1]_1
Bpro_4634_p-26(pykA)              2.8e-06  1_[+1]_1
Bpro_0752_p-95(tal)                 3e-06  1_[+1]_1
Veis_4222_p-67(pgi)               3.5e-06  1_[+1]_1
Lcho_2919_p-94(edd)                 5e-06  1_[+1]_1
Pnap_0653_p13(zwf)                6.4e-06  1_[+1]_1
Bpro_3551_p-34(edd)               8.7e-06  1_[+1]_1
Pnap_2986_p-54(edd)               8.7e-06  1_[+1]_1
Daci_5598_p-24(pgi)                 1e-05  1_[+1]_1
--------------------------------------------------------------------------------

--------------------------------------------------------------------------------
	Motif TGWAACYHRRTTACA MEME-1 in BLOCKS format
--------------------------------------------------------------------------------
BL   MOTIF TGWAACYHRRTTACA width=15 seqs=28
Lcho_3387_p-47(zwf)      (    2) TGAAACTCAGTTACA  1 
Daci_0930_p-38(pykA)     (    2) TGAAACCCGATTACA  1 
CtesDRAFT_3719_p-39(pykA (    2) TGAAACCCGATTACA  1 
Aave_4581_p-47(pykA)     (    2) TGAAACCCGATTACA  1 
Rfer_1125_p-123(zwf)     (    2) TGAAACTAAGTTACA  1 
Daci_5598_p-109(pgi)     (    2) GGTAACTTGGTTACC  1 
Rfer_0205_p-29(pykA)     (    2) GGAAACTTGATTACA  1 
Ajs_3956_p-38(pykA)      (    2) CGAAACTCGATTACA  1 
Bpro_0751_p-74(zwf)      (    2) TGAAACTAAATTACA  1 
CtesDRAFT_3819_p-157(pgk (    2) TGAAATCCAGTTACA  1 
Daci_5599_p-47(zwf)      (    2) GGTAACCAAGTTACC  1 
Daci_0828_p-27(pgk)      (    2) TGAAACCGGATTACA  1 
Pnap_3873_p-30(pykA)     (    2) GGAAACTAAATTACA  1 
Aave_0942_p-105(zwf)     (    2) TGAAACTCGGTAACA  1 
Rfer_1126_p-108(tal)     (    2) TGTAACTTAGTTTCA  1 
Lcho_3386_p-221(tal)     (    2) TGTAACTGAGTTTCA  1 
Rfer_2060_p-32(edd)      (    2) TGTAATTAAGTTACC  1 
Ajs_0695_p-93(zwf)       (    2) TGAAACTCGATAACA  1 
Veis_4223_p-44(zwf)      (    2) TGTAACGTGATTACA  1 
Veis_1778_p-44(hexR)     (    2) GCAAACCCGGTTACA  1 
Bpro_4634_p-26(pykA)     (    2) GGGAACTAAATTACA  1 
Bpro_0752_p-95(tal)      (    2) TGTAATTTAGTTTCA  1 
Veis_4222_p-67(pgi)      (    2) CGTAATCAAGTTACC  1 
Lcho_2919_p-94(edd)      (    2) TGTAACTTAGTTTCG  1 
Pnap_0653_p13(zwf)       (    2) TGAAACTTTATTACC  1 
Bpro_3551_p-34(edd)      (    2) CGTAATAAAGTTACA  1 
Pnap_2986_p-54(edd)      (    2) CGTAATAAAGTTACA  1 
Daci_5598_p-24(pgi)      (    2) GGTAATCAGATTACT  1 
//

--------------------------------------------------------------------------------

--------------------------------------------------------------------------------
	Motif TGWAACYHRRTTACA MEME-1 position-specific scoring matrix
--------------------------------------------------------------------------------
log-odds matrix: alength= 4 w= 15 n= 84 bayes= 3.09516 E= 6.2e-104 
 -1145    -34     68    103 
 -1145   -234    263  -1145 
    56  -1145   -213     52 
   146  -1145  -1145  -1145 
   146  -1145  -1145  -1145 
 -1145    205  -1145    -25 
  -235     83   -213     94 
    -3     83   -113    -25 
    56  -1145    146   -306 
    35  -1145    178  -1145 
 -1145  -1145  -1145    175 
  -235  -1145  -1145    164 
   123  -1145  -1145   -106 
 -1145    246  -1145  -1145 
   104     -2   -213   -306 
--------------------------------------------------------------------------------

--------------------------------------------------------------------------------
	Motif TGWAACYHRRTTACA MEME-1 position-specific probability matrix
--------------------------------------------------------------------------------
letter-probability matrix: alength= 4 w= 15 nsites= 28 E= 6.2e-104 
 0.000000  0.142857  0.250000  0.607143 
 0.000000  0.035714  0.964286  0.000000 
 0.535714  0.000000  0.035714  0.428571 
 1.000000  0.000000  0.000000  0.000000 
 1.000000  0.000000  0.000000  0.000000 
 0.000000  0.750000  0.000000  0.250000 
 0.071429  0.321429  0.035714  0.571429 
 0.357143  0.321429  0.071429  0.250000 
 0.535714  0.000000  0.428571  0.035714 
 0.464286  0.000000  0.535714  0.000000 
 0.000000  0.000000  0.000000  1.000000 
 0.071429  0.000000  0.000000  0.928571 
 0.857143  0.000000  0.000000  0.142857 
 0.000000  1.000000  0.000000  0.000000 
 0.750000  0.178571  0.035714  0.035714 
--------------------------------------------------------------------------------

--------------------------------------------------------------------------------
	Motif TGWAACYHRRTTACA MEME-1 regular expression
--------------------------------------------------------------------------------
[TG]G[AT]AA[CT][TC][ACT][AG][GA]TTACA
--------------------------------------------------------------------------------




Time  0.02 secs.

********************************************************************************


********************************************************************************
SUMMARY OF MOTIFS
********************************************************************************

--------------------------------------------------------------------------------
	Combined block diagrams: non-overlapping sites with p-value < 0.0001
--------------------------------------------------------------------------------
SEQUENCE NAME            COMBINED P-VALUE  MOTIF DIAGRAM
-------------            ----------------  -------------
Aave_4581_p-47(pykA)             1.44e-07  1_[+1(4.79e-08)]_1
Aave_0942_p-105(zwf)             1.76e-06  1_[+1(5.85e-07)]_1
Ajs_0695_p-93(zwf)               4.44e-06  1_[+1(1.48e-06)]_1
Ajs_3956_p-38(pykA)              6.45e-07  1_[+1(2.15e-07)]_1
CtesDRAFT_3819_p-157(pgk         1.18e-06  1_[+1(3.92e-07)]_1
CtesDRAFT_3719_p-39(pykA         1.44e-07  1_[+1(4.79e-08)]_1
Daci_0828_p-27(pgk)              1.32e-06  1_[+1(4.39e-07)]_1
Daci_0930_p-38(pykA)             1.44e-07  1_[+1(4.79e-08)]_1
Daci_5599_p-47(zwf)              1.32e-06  1_[+1(4.39e-07)]_1
Daci_5598_p-24(pgi)              3.07e-05  1_[+1(1.02e-05)]_1
Daci_5598_p-109(pgi)             5.56e-07  1_[+1(1.85e-07)]_1
Pnap_3873_p-30(pykA)             1.50e-06  1_[+1(5.00e-07)]_1
Pnap_0653_p13(zwf)               1.92e-05  1_[+1(6.38e-06)]_1
Pnap_2986_p-54(edd)              2.60e-05  1_[+1(8.67e-06)]_1
Bpro_0751_p-74(zwf)              9.56e-07  1_[+1(3.19e-07)]_1
Bpro_4634_p-26(pykA)             8.33e-06  1_[+1(2.78e-06)]_1
Bpro_3551_p-34(edd)              2.60e-05  1_[+1(8.67e-06)]_1
Bpro_0752_p-95(tal)              9.03e-06  1_[+1(3.01e-06)]_1
Rfer_0205_p-29(pykA)             6.45e-07  1_[+1(2.15e-07)]_1
Rfer_1125_p-123(zwf)             1.82e-07  1_[+1(6.07e-08)]_1
Rfer_1126_p-108(tal)             2.12e-06  1_[+1(7.06e-07)]_1
Rfer_2060_p-32(edd)              4.20e-06  1_[+1(1.40e-06)]_1
Veis_1778_p-44(hexR)             5.01e-06  1_[+1(1.67e-06)]_1
Veis_4223_p-44(zwf)              5.01e-06  1_[+1(1.67e-06)]_1
Veis_4222_p-67(pgi)              1.04e-05  1_[+1(3.48e-06)]_1
Lcho_3387_p-47(zwf)              6.06e-08  1_[+1(2.02e-08)]_1
Lcho_2919_p-94(edd)              1.49e-05  1_[+1(4.98e-06)]_1
Lcho_3386_p-221(tal)             4.20e-06  1_[+1(1.40e-06)]_1
--------------------------------------------------------------------------------

********************************************************************************


********************************************************************************
Stopped because requested number of motifs (1) found.
********************************************************************************

CPU: optimus

********************************************************************************
