********************************************************************************
MEME - Motif discovery tool
********************************************************************************
MEME version 5.0.5 (Release date: Mon Mar 18 20:12:19 2019 -0700)

For further information on how to interpret please access http://meme-suite.org.
To get a copy of the MEME software please access http://meme-suite.org.

********************************************************************************


********************************************************************************
REFERENCE
********************************************************************************
If you use this program in your research, please cite:

Timothy L. Bailey and Charles Elkan,
"Fitting a mixture model by expectation maximization to discover
motifs in biopolymers", Proceedings of the Second International
Conference on Intelligent Systems for Molecular Biology, pp. 28-36,
AAAI Press, Menlo Park, California, 1994.
********************************************************************************


********************************************************************************
TRAINING SET
********************************************************************************
PRIMARY SEQUENCES= /home/dtravisany/gitrepo/RegPrecise/Motif_PWM/Comamonadaceae/HrcA_Comamonadaceae.Xml.fasta
CONTROL SEQUENCES= --none--
ALPHABET= ACGT
Sequence name            Weight Length  Sequence name            Weight Length  
-------------            ------ ------  -------------            ------ ------  
Aave_3894_p-57(rpoH)     1.0000     27  Aave_0946_p-123(groS)    1.0000     27  
Ajs_0700_p-112(groS)     1.0000     27  Ajs_3522_p-28(rpoH)      1.0000     27  
CtesDRAFT_4575_p-111(gro 1.0000     27  CtesDRAFT_2864_p-28(rpoH 1.0000     27  
Daci_5660_p-114(groS)    1.0000     27  Daci_1694_p-57(rpoH)     1.0000     27  
Pnap_0658_p-134(groS)    1.0000     27  Pnap_0889_p-57(rpoH)     1.0000     27  
Bpro_0760_p-121(groS)    1.0000     27  Bpro_1256_p-57(rpoH)     1.0000     27  
Rfer_1132_p-130(groS)    1.0000     27  Rfer_1692_p-58(rpoH)     1.0000     27  
Vapar_1119_p-110(groS)   1.0000     27  Vapar_4379_p-55(rpoH)    1.0000     27  
Veis_4476_p-72(rpoH)     1.0000     27  Veis_2566_p-110(groS)    1.0000     27  
Mpe_A3171_p-54(rpoH)     1.0000     27  Mpe_A0427_p-129(groS)    1.0000     27  
Lcho_3542_p-59(rpoH)     1.0000     27  Lcho_0482_p-96(groS)     1.0000     27  
********************************************************************************

********************************************************************************
COMMAND LINE SUMMARY
********************************************************************************
This information can also be useful in the event you wish to report a
problem with the MEME software.

command: meme -dna /home/dtravisany/gitrepo/RegPrecise/Motif_PWM/Comamonadaceae/HrcA_Comamonadaceae.Xml.fasta -oc /home/dtravisany/gitrepo/RegPrecise/Motif_PWM/Comamonadaceae/HrcA_Comamonadaceae 

model:  mod=         zoops    nmotifs=         1    evt=           inf
objective function:           em=       E-value of product of p-values
                              starts=   E-value of product of p-values
strands: +
width:  minw=            8    maxw=           27
nsites: minsites=        2    maxsites=       22    wnsites=       0.8
theta:  spmap=         uni    spfuzz=        0.5
em:     prior=   dirichlet    b=            0.01    maxiter=        50
        distance=    1e-05
trim:   wg=             11    ws=              1    endgaps=       yes
data:   n=             594    N=              22
sample: seed=            0    hsfrac=          0
        searchsize=    594    norand=         no    csites=       1000
Letter frequencies in dataset:
A 0.253 C 0.229 G 0.247 T 0.271 
Background letter frequencies (from file dataset with add-one prior applied):
A 0.253 C 0.229 G 0.247 T 0.271 
Background model order: 0
********************************************************************************


********************************************************************************
MOTIF TTAGCACTCKMTSBDRDBGAGTGCTAA MEME-1	width =  27  sites =  22  llr = 573  E-value = 3.5e-197
********************************************************************************
--------------------------------------------------------------------------------
	Motif TTAGCACTCKMTSBDRDBGAGTGCTAA MEME-1 Description
--------------------------------------------------------------------------------
Simplified        A  ::9::a::::31114521:a:::::aa
pos.-specific     C  1:::a:a:a151541112:::::a:::
probability       G  ::1a:::::5:1433423a:a:a::::
matrix            T  9a:::::a:317:22:54:::a::a::

         bits    2.1     * * *              *   
                 1.9  * ******         ** ***** 
                 1.7  * ******         *********
                 1.5 *********         *********
Relative         1.3 *********         *********
Entropy          1.1 *********         *********
(37.6 bits)      0.9 *********         *********
                 0.6 *********  *   *  *********
                 0.4 *************  *  *********
                 0.2 ***************** *********
                 0.0 ---------------------------

Multilevel           TTAGCACTCGCTCCAATTGAGTGCTAA
consensus                     TA GGGGAG         
sequence                           T GC         
                                                
--------------------------------------------------------------------------------

--------------------------------------------------------------------------------
	Motif TTAGCACTCKMTSBDRDBGAGTGCTAA MEME-1 sites sorted by position p-value
--------------------------------------------------------------------------------
Sequence name             Start   P-value                       Site          
-------------             ----- ---------            ---------------------------
Bpro_1256_p-57(rpoH)          1  3.97e-15          . TTAGCACTCTCTCCAATGGAGTGCTAA           
Ajs_3522_p-28(rpoH)           1  3.97e-15          . TTAGCACTCTCTCCAATGGAGTGCTAA           
Bpro_0760_p-121(groS)         1  3.51e-14          . TTAGCACTCGATGGTATTGAGTGCTAA           
Vapar_1119_p-110(groS)        1  4.94e-14          . TTAGCACTCGCTGCTGACGAGTGCTAA           
Vapar_4379_p-55(rpoH)         1  5.78e-14          . TTAGCACTCCCTCCAATCGAGTGCTAA           
Pnap_0658_p-134(groS)         1  1.34e-13          . TTAGCACTCGATGAGGTGGAGTGCTAA           
CtesDRAFT_2864_p-28(rpoH      1  2.82e-13          . TTAGCACTCTCTCTAACGGAGTGCTAA           
Rfer_1692_p-58(rpoH)          1  5.51e-13          . TTAGCACTCTCTCTCATAGAGTGCTAA           
Aave_0946_p-123(groS)         1  6.10e-13          . TTAGCACTCGAAGCGGACGAGTGCTAA           
CtesDRAFT_4575_p-111(gro      1  8.23e-13          . TTAGCACTCAATGGGGTTGAGTGCTAA           
Veis_2566_p-110(groS)         1  1.09e-12          . TTAGCACTCTCCGCTGGGGAGTGCTAA           
Daci_5660_p-114(groS)         1  1.09e-12          . TTAGCACTCGTTGGGCATGAGTGCTAA           
Ajs_0700_p-112(groS)          1  1.20e-12          . TTAGCACTCGAAACAGATGAGTGCTAA           
Lcho_3542_p-59(rpoH)          1  1.43e-12          . TTAGCACTCTCGAGGGTCGAGTGCTAA           
Rfer_1132_p-130(groS)         1  1.69e-12          . TTAGCACTCGTAAGAGTTGAGTGCTAA           
Daci_1694_p-57(rpoH)          1  2.35e-12          . TTAGCACTCGGTCATAACGAGTGCTAA           
Veis_4476_p-72(rpoH)          1  4.84e-12          . TTGGCACTCGATCGCAGAGAGTGCTAA           
Pnap_0889_p-57(rpoH)          1  5.17e-12          . CTGGCACTCTCTCTGATGGAGTGCTAA           
Aave_3894_p-57(rpoH)          1  5.89e-12          . TTAGCACTCCCTCCAAGAGACTGCTAA           
Lcho_0482_p-96(groS)          1  7.55e-12          . TTAGCACTCGCCGGTGGTGAGTGCTAG           
Mpe_A0427_p-129(groS)         1  7.55e-12          . CTAGCACTCGCGCAGACTGAGTGCTAA           
Mpe_A3171_p-54(rpoH)          1  9.52e-12          . TTAGCACTCGTTTTACGTGAGTGCTAA           
--------------------------------------------------------------------------------

--------------------------------------------------------------------------------
	Motif TTAGCACTCKMTSBDRDBGAGTGCTAA MEME-1 block diagrams
--------------------------------------------------------------------------------
SEQUENCE NAME            POSITION P-VALUE  MOTIF DIAGRAM
-------------            ----------------  -------------
Bpro_1256_p-57(rpoH)                4e-15  [+1]
Ajs_3522_p-28(rpoH)                 4e-15  [+1]
Bpro_0760_p-121(groS)             3.5e-14  [+1]
Vapar_1119_p-110(groS)            4.9e-14  [+1]
Vapar_4379_p-55(rpoH)             5.8e-14  [+1]
Pnap_0658_p-134(groS)             1.3e-13  [+1]
CtesDRAFT_2864_p-28(rpoH          2.8e-13  [+1]
Rfer_1692_p-58(rpoH)              5.5e-13  [+1]
Aave_0946_p-123(groS)             6.1e-13  [+1]
CtesDRAFT_4575_p-111(gro          8.2e-13  [+1]
Veis_2566_p-110(groS)             1.1e-12  [+1]
Daci_5660_p-114(groS)             1.1e-12  [+1]
Ajs_0700_p-112(groS)              1.2e-12  [+1]
Lcho_3542_p-59(rpoH)              1.4e-12  [+1]
Rfer_1132_p-130(groS)             1.7e-12  [+1]
Daci_1694_p-57(rpoH)              2.3e-12  [+1]
Veis_4476_p-72(rpoH)              4.8e-12  [+1]
Pnap_0889_p-57(rpoH)              5.2e-12  [+1]
Aave_3894_p-57(rpoH)              5.9e-12  [+1]
Lcho_0482_p-96(groS)              7.5e-12  [+1]
Mpe_A0427_p-129(groS)             7.5e-12  [+1]
Mpe_A3171_p-54(rpoH)              9.5e-12  [+1]
--------------------------------------------------------------------------------

--------------------------------------------------------------------------------
	Motif TTAGCACTCKMTSBDRDBGAGTGCTAA MEME-1 in BLOCKS format
--------------------------------------------------------------------------------
BL   MOTIF TTAGCACTCKMTSBDRDBGAGTGCTAA width=27 seqs=22
Bpro_1256_p-57(rpoH)     (    1) TTAGCACTCTCTCCAATGGAGTGCTAA  1 
Ajs_3522_p-28(rpoH)      (    1) TTAGCACTCTCTCCAATGGAGTGCTAA  1 
Bpro_0760_p-121(groS)    (    1) TTAGCACTCGATGGTATTGAGTGCTAA  1 
Vapar_1119_p-110(groS)   (    1) TTAGCACTCGCTGCTGACGAGTGCTAA  1 
Vapar_4379_p-55(rpoH)    (    1) TTAGCACTCCCTCCAATCGAGTGCTAA  1 
Pnap_0658_p-134(groS)    (    1) TTAGCACTCGATGAGGTGGAGTGCTAA  1 
CtesDRAFT_2864_p-28(rpoH (    1) TTAGCACTCTCTCTAACGGAGTGCTAA  1 
Rfer_1692_p-58(rpoH)     (    1) TTAGCACTCTCTCTCATAGAGTGCTAA  1 
Aave_0946_p-123(groS)    (    1) TTAGCACTCGAAGCGGACGAGTGCTAA  1 
CtesDRAFT_4575_p-111(gro (    1) TTAGCACTCAATGGGGTTGAGTGCTAA  1 
Veis_2566_p-110(groS)    (    1) TTAGCACTCTCCGCTGGGGAGTGCTAA  1 
Daci_5660_p-114(groS)    (    1) TTAGCACTCGTTGGGCATGAGTGCTAA  1 
Ajs_0700_p-112(groS)     (    1) TTAGCACTCGAAACAGATGAGTGCTAA  1 
Lcho_3542_p-59(rpoH)     (    1) TTAGCACTCTCGAGGGTCGAGTGCTAA  1 
Rfer_1132_p-130(groS)    (    1) TTAGCACTCGTAAGAGTTGAGTGCTAA  1 
Daci_1694_p-57(rpoH)     (    1) TTAGCACTCGGTCATAACGAGTGCTAA  1 
Veis_4476_p-72(rpoH)     (    1) TTGGCACTCGATCGCAGAGAGTGCTAA  1 
Pnap_0889_p-57(rpoH)     (    1) CTGGCACTCTCTCTGATGGAGTGCTAA  1 
Aave_3894_p-57(rpoH)     (    1) TTAGCACTCCCTCCAAGAGACTGCTAA  1 
Lcho_0482_p-96(groS)     (    1) TTAGCACTCGCCGGTGGTGAGTGCTAG  1 
Mpe_A0427_p-129(groS)    (    1) CTAGCACTCGCGCAGACTGAGTGCTAA  1 
Mpe_A3171_p-54(rpoH)     (    1) TTAGCACTCGTTTTACGTGAGTGCTAA  1 
//

--------------------------------------------------------------------------------

--------------------------------------------------------------------------------
	Motif TTAGCACTCKMTSBDRDBGAGTGCTAA MEME-1 position-specific scoring matrix
--------------------------------------------------------------------------------
log-odds matrix: alength= 4 w= 27 n= 22 bayes= 1.41504 E= 3.5e-197 
 -1110   -133  -1110    175 
 -1110  -1110  -1110    188 
   185  -1110   -144  -1110 
 -1110  -1110    201  -1110 
 -1110    213  -1110  -1110 
   199  -1110  -1110  -1110 
 -1110    213  -1110  -1110 
 -1110  -1110  -1110    188 
 -1110    213  -1110  -1110 
  -247   -133    114     23 
    11    125   -244    -99 
   -89   -133   -144    133 
   -89     99     55   -257 
   -89     67     36    -57 
    53   -133     36    -25 
    99   -133     72  -1110 
   -15   -133    -12     75 
   -89     -1     14     42 
 -1110  -1110    201  -1110 
   199  -1110  -1110  -1110 
 -1110   -233    195  -1110 
 -1110  -1110  -1110    188 
 -1110  -1110    201  -1110 
 -1110    213  -1110  -1110 
 -1110  -1110  -1110    188 
   199  -1110  -1110  -1110 
   192  -1110   -244  -1110 
--------------------------------------------------------------------------------

--------------------------------------------------------------------------------
	Motif TTAGCACTCKMTSBDRDBGAGTGCTAA MEME-1 position-specific probability matrix
--------------------------------------------------------------------------------
letter-probability matrix: alength= 4 w= 27 nsites= 22 E= 3.5e-197 
 0.000000  0.090909  0.000000  0.909091 
 0.000000  0.000000  0.000000  1.000000 
 0.909091  0.000000  0.090909  0.000000 
 0.000000  0.000000  1.000000  0.000000 
 0.000000  1.000000  0.000000  0.000000 
 1.000000  0.000000  0.000000  0.000000 
 0.000000  1.000000  0.000000  0.000000 
 0.000000  0.000000  0.000000  1.000000 
 0.000000  1.000000  0.000000  0.000000 
 0.045455  0.090909  0.545455  0.318182 
 0.272727  0.545455  0.045455  0.136364 
 0.136364  0.090909  0.090909  0.681818 
 0.136364  0.454545  0.363636  0.045455 
 0.136364  0.363636  0.318182  0.181818 
 0.363636  0.090909  0.318182  0.227273 
 0.500000  0.090909  0.409091  0.000000 
 0.227273  0.090909  0.227273  0.454545 
 0.136364  0.227273  0.272727  0.363636 
 0.000000  0.000000  1.000000  0.000000 
 1.000000  0.000000  0.000000  0.000000 
 0.000000  0.045455  0.954545  0.000000 
 0.000000  0.000000  0.000000  1.000000 
 0.000000  0.000000  1.000000  0.000000 
 0.000000  1.000000  0.000000  0.000000 
 0.000000  0.000000  0.000000  1.000000 
 1.000000  0.000000  0.000000  0.000000 
 0.954545  0.000000  0.045455  0.000000 
--------------------------------------------------------------------------------

--------------------------------------------------------------------------------
	Motif TTAGCACTCKMTSBDRDBGAGTGCTAA MEME-1 regular expression
--------------------------------------------------------------------------------
TTAGCACTC[GT][CA]T[CG][CG][AGT][AG][TAG][TGC]GAGTGCTAA
--------------------------------------------------------------------------------




Time  0.07 secs.

********************************************************************************


********************************************************************************
SUMMARY OF MOTIFS
********************************************************************************

--------------------------------------------------------------------------------
	Combined block diagrams: non-overlapping sites with p-value < 0.0001
--------------------------------------------------------------------------------
SEQUENCE NAME            COMBINED P-VALUE  MOTIF DIAGRAM
-------------            ----------------  -------------
Aave_3894_p-57(rpoH)             5.89e-12  [+1(5.89e-12)]
Aave_0946_p-123(groS)            6.10e-13  [+1(6.10e-13)]
Ajs_0700_p-112(groS)             1.20e-12  [+1(1.20e-12)]
Ajs_3522_p-28(rpoH)              3.97e-15  [+1(3.97e-15)]
CtesDRAFT_4575_p-111(gro         8.23e-13  [+1(8.23e-13)]
CtesDRAFT_2864_p-28(rpoH         2.82e-13  [+1(2.82e-13)]
Daci_5660_p-114(groS)            1.09e-12  [+1(1.09e-12)]
Daci_1694_p-57(rpoH)             2.35e-12  [+1(2.35e-12)]
Pnap_0658_p-134(groS)            1.34e-13  [+1(1.34e-13)]
Pnap_0889_p-57(rpoH)             5.17e-12  [+1(5.17e-12)]
Bpro_0760_p-121(groS)            3.51e-14  [+1(3.51e-14)]
Bpro_1256_p-57(rpoH)             3.97e-15  [+1(3.97e-15)]
Rfer_1132_p-130(groS)            1.69e-12  [+1(1.69e-12)]
Rfer_1692_p-58(rpoH)             5.51e-13  [+1(5.51e-13)]
Vapar_1119_p-110(groS)           4.94e-14  [+1(4.94e-14)]
Vapar_4379_p-55(rpoH)            5.78e-14  [+1(5.78e-14)]
Veis_4476_p-72(rpoH)             4.84e-12  [+1(4.84e-12)]
Veis_2566_p-110(groS)            1.09e-12  [+1(1.09e-12)]
Mpe_A3171_p-54(rpoH)             9.52e-12  [+1(9.52e-12)]
Mpe_A0427_p-129(groS)            7.55e-12  [+1(7.55e-12)]
Lcho_3542_p-59(rpoH)             1.43e-12  [+1(1.43e-12)]
Lcho_0482_p-96(groS)             7.55e-12  [+1(7.55e-12)]
--------------------------------------------------------------------------------

********************************************************************************


********************************************************************************
Stopped because requested number of motifs (1) found.
********************************************************************************

CPU: optimus

********************************************************************************
