********************************************************************************
MEME - Motif discovery tool
********************************************************************************
MEME version 5.0.5 (Release date: Mon Mar 18 20:12:19 2019 -0700)

For further information on how to interpret please access http://meme-suite.org.
To get a copy of the MEME software please access http://meme-suite.org.

********************************************************************************


********************************************************************************
REFERENCE
********************************************************************************
If you use this program in your research, please cite:

Timothy L. Bailey and Charles Elkan,
"Fitting a mixture model by expectation maximization to discover
motifs in biopolymers", Proceedings of the Second International
Conference on Intelligent Systems for Molecular Biology, pp. 28-36,
AAAI Press, Menlo Park, California, 1994.
********************************************************************************


********************************************************************************
TRAINING SET
********************************************************************************
PRIMARY SEQUENCES= /home/dtravisany/gitrepo/RegPrecise/Motif_PWM/Comamonadaceae/LldR_Comamonadaceae.Xml.fasta
CONTROL SEQUENCES= --none--
ALPHABET= ACGT
Sequence name            Weight Length  Sequence name            Weight Length  
-------------            ------ ------  -------------            ------ ------  
CtesDRAFT_4930_p-259(lld 1.0000     17  CtesDRAFT_4930_p-162(lld 1.0000     17  
Daci_3344_p-309(lldP)    1.0000     17  Daci_3344_p-183(lldP)    1.0000     17  
Rfer_0201_p-53(lldE)     1.0000     17  Rfer_0202_p-26(lldR)     1.0000     17  
********************************************************************************

********************************************************************************
COMMAND LINE SUMMARY
********************************************************************************
This information can also be useful in the event you wish to report a
problem with the MEME software.

command: meme -dna /home/dtravisany/gitrepo/RegPrecise/Motif_PWM/Comamonadaceae/LldR_Comamonadaceae.Xml.fasta -oc /home/dtravisany/gitrepo/RegPrecise/Motif_PWM/Comamonadaceae/LldR_Comamonadaceae 

model:  mod=         zoops    nmotifs=         1    evt=           inf
objective function:           em=       E-value of product of p-values
                              starts=   E-value of product of p-values
strands: +
width:  minw=            8    maxw=           17
nsites: minsites=        2    maxsites=        6    wnsites=       0.8
theta:  spmap=         uni    spfuzz=        0.5
em:     prior=   dirichlet    b=            0.01    maxiter=        50
        distance=    1e-05
trim:   wg=             11    ws=              1    endgaps=       yes
data:   n=             102    N=               6
sample: seed=            0    hsfrac=          0
        searchsize=    102    norand=         no    csites=       1000
Letter frequencies in dataset:
A 0.324 C 0.137 G 0.147 T 0.392 
Background letter frequencies (from file dataset with add-one prior applied):
A 0.321 C 0.142 G 0.151 T 0.387 
Background model order: 0
********************************************************************************


********************************************************************************
MOTIF ATTGGTMTTACCAAT MEME-1	width =  15  sites =   6  llr = 104  E-value = 1.7e-021
********************************************************************************
--------------------------------------------------------------------------------
	Motif ATTGGTMTTACCAAT MEME-1 Description
--------------------------------------------------------------------------------
Simplified        A  a:::::52:a::aa:
pos.-specific     C  ::::::3:::aa:::
probability       G  :::aa::23::::::
matrix            T  :aa::a277:::::a

         bits    2.8    **     **   
                 2.5    **     **   
                 2.3    **     **   
                 2.0    **     **   
Relative         1.7 *  **    ***** 
Entropy          1.4 ******   ******
(25.0 bits)      1.1 ******   ******
                 0.8 ******  *******
                 0.6 ******* *******
                 0.3 ***************
                 0.0 ---------------

Multilevel           ATTGGTATTACCAAT
consensus                  C G      
sequence                            
                                    
--------------------------------------------------------------------------------

--------------------------------------------------------------------------------
	Motif ATTGGTMTTACCAAT MEME-1 sites sorted by position p-value
--------------------------------------------------------------------------------
Sequence name             Start   P-value                 Site    
-------------             ----- ---------            ---------------
Daci_3344_p-309(lldP)         2  9.09e-10          A ATTGGTCTGACCAAT A         
Rfer_0202_p-26(lldR)          2  3.24e-09          A ATTGGTCTTACCAAT T         
Rfer_0201_p-53(lldE)          2  1.18e-08          T ATTGGTATTACCAAT T         
CtesDRAFT_4930_p-259(lld      2  1.18e-08          A ATTGGTATTACCAAT T         
CtesDRAFT_4930_p-162(lld      2  2.59e-08          T ATTGGTAATACCAAT T         
Daci_3344_p-183(lldP)         2  3.32e-08          A ATTGGTTGGACCAAT T         
--------------------------------------------------------------------------------

--------------------------------------------------------------------------------
	Motif ATTGGTMTTACCAAT MEME-1 block diagrams
--------------------------------------------------------------------------------
SEQUENCE NAME            POSITION P-VALUE  MOTIF DIAGRAM
-------------            ----------------  -------------
Daci_3344_p-309(lldP)             9.1e-10  1_[+1]_1
Rfer_0202_p-26(lldR)              3.2e-09  1_[+1]_1
Rfer_0201_p-53(lldE)              1.2e-08  1_[+1]_1
CtesDRAFT_4930_p-259(lld          1.2e-08  1_[+1]_1
CtesDRAFT_4930_p-162(lld          2.6e-08  1_[+1]_1
Daci_3344_p-183(lldP)             3.3e-08  1_[+1]_1
--------------------------------------------------------------------------------

--------------------------------------------------------------------------------
	Motif ATTGGTMTTACCAAT MEME-1 in BLOCKS format
--------------------------------------------------------------------------------
BL   MOTIF ATTGGTMTTACCAAT width=15 seqs=6
Daci_3344_p-309(lldP)    (    2) ATTGGTCTGACCAAT  1 
Rfer_0202_p-26(lldR)     (    2) ATTGGTCTTACCAAT  1 
Rfer_0201_p-53(lldE)     (    2) ATTGGTATTACCAAT  1 
CtesDRAFT_4930_p-259(lld (    2) ATTGGTATTACCAAT  1 
CtesDRAFT_4930_p-162(lld (    2) ATTGGTAATACCAAT  1 
Daci_3344_p-183(lldP)    (    2) ATTGGTTGGACCAAT  1 
//

--------------------------------------------------------------------------------

--------------------------------------------------------------------------------
	Motif ATTGGTMTTACCAAT MEME-1 position-specific scoring matrix
--------------------------------------------------------------------------------
log-odds matrix: alength= 4 w= 15 n= 18 bayes= 1.62803 E= 1.7e-021 
   164   -923   -923   -923 
  -923   -923   -923    137 
  -923   -923   -923    137 
  -923   -923    273   -923 
  -923   -923    273   -923 
  -923   -923   -923    137 
    64    123   -923   -121 
   -94   -923     14     78 
  -923   -923    114     78 
   164   -923   -923   -923 
  -923    282   -923   -923 
  -923    282   -923   -923 
   164   -923   -923   -923 
   164   -923   -923   -923 
  -923   -923   -923    137 
--------------------------------------------------------------------------------

--------------------------------------------------------------------------------
	Motif ATTGGTMTTACCAAT MEME-1 position-specific probability matrix
--------------------------------------------------------------------------------
letter-probability matrix: alength= 4 w= 15 nsites= 6 E= 1.7e-021 
 1.000000  0.000000  0.000000  0.000000 
 0.000000  0.000000  0.000000  1.000000 
 0.000000  0.000000  0.000000  1.000000 
 0.000000  0.000000  1.000000  0.000000 
 0.000000  0.000000  1.000000  0.000000 
 0.000000  0.000000  0.000000  1.000000 
 0.500000  0.333333  0.000000  0.166667 
 0.166667  0.000000  0.166667  0.666667 
 0.000000  0.000000  0.333333  0.666667 
 1.000000  0.000000  0.000000  0.000000 
 0.000000  1.000000  0.000000  0.000000 
 0.000000  1.000000  0.000000  0.000000 
 1.000000  0.000000  0.000000  0.000000 
 1.000000  0.000000  0.000000  0.000000 
 0.000000  0.000000  0.000000  1.000000 
--------------------------------------------------------------------------------

--------------------------------------------------------------------------------
	Motif ATTGGTMTTACCAAT MEME-1 regular expression
--------------------------------------------------------------------------------
ATTGGT[AC]T[TG]ACCAAT
--------------------------------------------------------------------------------




Time  0.01 secs.

********************************************************************************


********************************************************************************
SUMMARY OF MOTIFS
********************************************************************************

--------------------------------------------------------------------------------
	Combined block diagrams: non-overlapping sites with p-value < 0.0001
--------------------------------------------------------------------------------
SEQUENCE NAME            COMBINED P-VALUE  MOTIF DIAGRAM
-------------            ----------------  -------------
CtesDRAFT_4930_p-259(lld         3.55e-08  1_[+1(1.18e-08)]_1
CtesDRAFT_4930_p-162(lld         7.77e-08  1_[+1(2.59e-08)]_1
Daci_3344_p-309(lldP)            2.73e-09  1_[+1(9.09e-10)]_1
Daci_3344_p-183(lldP)            9.97e-08  1_[+1(3.32e-08)]_1
Rfer_0201_p-53(lldE)             3.55e-08  1_[+1(1.18e-08)]_1
Rfer_0202_p-26(lldR)             9.71e-09  1_[+1(3.24e-09)]_1
--------------------------------------------------------------------------------

********************************************************************************


********************************************************************************
Stopped because requested number of motifs (1) found.
********************************************************************************

CPU: optimus

********************************************************************************
