********************************************************************************
MEME - Motif discovery tool
********************************************************************************
MEME version 4.11.2 (Release date: Thu May 05 14:58:55 2016 -0700)

For further information on how to interpret these results or to get
a copy of the MEME software please access http://meme-suite.org .

This file may be used as input to the MAST algorithm for searching
sequence databases for matches to groups of motifs.  MAST is available
for interactive use and downloading at http://meme-suite.org .
********************************************************************************


********************************************************************************
REFERENCE
********************************************************************************
If you use this program in your research, please cite:

Timothy L. Bailey and Charles Elkan,
"Fitting a mixture model by expectation maximization to discover
motifs in biopolymers", Proceedings of the Second International
Conference on Intelligent Systems for Molecular Biology, pp. 28-36,
AAAI Press, Menlo Park, California, 1994.
********************************************************************************


********************************************************************************
TRAINING SET
********************************************************************************
DATAFILE= MetR_Various_betaproteobacteria.fasta
ALPHABET= ACGT
Sequence name            Weight Length  Sequence name            Weight Length  
-------------            ------ ------  -------------            ------ ------  
NE1435(metR)Score=5.4,Po 1.0000     15  NE1436(metE)Score=5.4,Po 1.0000     15  
Nmul_A2635(metR)Score=5. 1.0000     15  Nmul_A2634(metE)Score=5. 1.0000     15  
Tbd_2285(metR)Score=5.2, 1.0000     15  Tbd_2286(metE)Score=5.2, 1.0000     15  
CV3603(metR)Score=4.8,Po 1.0000     15  CV3604(metE)Score=4.8,Po 1.0000     15  
NMB2055(metR)Score=4.9,P 1.0000     15  NMB0943(metF)Score=4.1,P 1.0000     15  
NMB0943(metF)Score=4.1,P 1.0000     15  LHK_00468(metR)Score=4.3 1.0000     15  
LHK_00468(metR)Score=5.8 1.0000     15  LHK_00469(metE)Score=5.8 1.0000     15  
LHK_00469(metE)Score=4.3 1.0000     15  Mfla_2570(metR)Score=5.8 1.0000     15  
Mfla_2571(metE)Score=5.8 1.0000     15  Mmol_0966(metE)Score=5.4 1.0000     15  
Mmol_0965(metR)Score=5.4 1.0000     15  
********************************************************************************

********************************************************************************
COMMAND LINE SUMMARY
********************************************************************************
This information can also be useful in the event you wish to report a
problem with the MEME software.

command: meme -dna MetR_Various_betaproteobacteria.fasta -oc MetR_Various_betaproteobacteria 

model:  mod=         zoops    nmotifs=         1    evt=           inf
object function=  E-value of product of p-values
width:  minw=            8    maxw=           15
width:  wg=             11    ws=              1    endgaps=       yes
nsites: minsites=        2    maxsites=       19    wnsites=       0.8
theta:  spmap=         uni    spfuzz=        0.5
global: substring=     yes    branching=      no    wbranch=        no
em:     prior=   dirichlet    b=            0.01    maxiter=        50
        distance=    1e-05
data:   n=             285    N=              19    shuffle=        -1
strands: +
sample: seed=            0    ctfrac=         -1    maxwords=       -1
Letter frequencies in dataset:
A 0.411 C 0.081 G 0.084 T 0.425 
Background letter frequencies (from dataset with add-one prior applied):
A 0.408 C 0.083 G 0.087 T 0.422 
********************************************************************************


********************************************************************************
MOTIF  1 MEME	width =  15  sites =  19  llr = 199  E-value = 6.7e-060
********************************************************************************
--------------------------------------------------------------------------------
	Motif 1 Description
--------------------------------------------------------------------------------
Simplified        A  9::97245481:1a:
pos.-specific     C  ::::::1:1:219::
probability       G  ::912:1:1::::::
matrix            T  1a1:18554279::a

         bits    3.6                
                 3.2                
                 2.9   *         *  
                 2.5   *         *  
Relative         2.2   *         *  
Entropy          1.8   *         *  
(15.1 bits)      1.4   *         ** 
                 1.1 ****       ****
                 0.7 *****    * ****
                 0.4 ****** * ******
                 0.0 ---------------

Multilevel           ATGAATTAAATTCAT
consensus                 AATTT     
sequence                            
                                    
--------------------------------------------------------------------------------

--------------------------------------------------------------------------------
	Motif 1 sites sorted by position p-value
--------------------------------------------------------------------------------
Sequence name             Start   P-value                 Site    
-------------             ----- ---------            ---------------
Mfla_2570(metR)Score=5.8      1  2.77e-07          . ATGAATTAAATTCAT           
Mfla_2571(metE)Score=5.8      1  5.68e-07          . ATGAATTTAATTCAT           
LHK_00468(metR)Score=5.8      1  5.68e-07          . ATGAATTTTATTCAT           
Nmul_A2634(metE)Score=5.      1  5.68e-07          . ATGAATTTTATTCAT           
LHK_00469(metE)Score=5.8      1  7.70e-07          . ATGAATAAAATTCAT           
Nmul_A2635(metR)Score=5.      1  7.70e-07          . ATGAATAAAATTCAT           
Tbd_2285(metR)Score=5.2,      1  1.15e-06          . ATGAATAACACTCAT           
Tbd_2286(metE)Score=5.2,      1  1.27e-06          . ATGAGTGTTATTCAT           
NE1435(metR)Score=5.4,Po      1  3.22e-06          . ATGAATAATTTTCAT           
NE1436(metE)Score=5.4,Po      1  3.60e-06          . ATGAAAATTATTCAT           
CV3604(metE)Score=4.8,Po      1  4.43e-06          . ATGAGTTTGAATCAT           
CV3603(metR)Score=4.8,Po      1  6.37e-06          . ATGATTCAAACTCAT           
Mmol_0965(metR)Score=5.4      1  2.07e-05          . ATTAATTTTATTCAT           
Mmol_0966(metE)Score=5.4      1  2.31e-05          . ATGAATAAAATTAAT           
NMB0943(metF)Score=4.1,P      1  2.31e-05          . TTGAAATTGACTCAT           
LHK_00469(metE)Score=4.3      1  3.07e-05          . ATGAAATAAAACCAT           
LHK_00468(metR)Score=4.3      1  3.52e-05          . ATGGTTTTATTTCAT           
NMB2055(metR)Score=4.9,P      1  4.50e-05          . ATGAATTATTTTAAT           
NMB0943(metF)Score=4.1,P      1  1.19e-04          . ATTAGAAATTTTCAT           
--------------------------------------------------------------------------------

--------------------------------------------------------------------------------
	Motif 1 block diagrams
--------------------------------------------------------------------------------
SEQUENCE NAME            POSITION P-VALUE  MOTIF DIAGRAM
-------------            ----------------  -------------
Mfla_2570(metR)Score=5.8          2.8e-07  [+1]
Mfla_2571(metE)Score=5.8          5.7e-07  [+1]
LHK_00468(metR)Score=5.8          5.7e-07  [+1]
Nmul_A2634(metE)Score=5.          5.7e-07  [+1]
LHK_00469(metE)Score=5.8          7.7e-07  [+1]
Nmul_A2635(metR)Score=5.          7.7e-07  [+1]
Tbd_2285(metR)Score=5.2,          1.2e-06  [+1]
Tbd_2286(metE)Score=5.2,          1.3e-06  [+1]
NE1435(metR)Score=5.4,Po          3.2e-06  [+1]
NE1436(metE)Score=5.4,Po          3.6e-06  [+1]
CV3604(metE)Score=4.8,Po          4.4e-06  [+1]
CV3603(metR)Score=4.8,Po          6.4e-06  [+1]
Mmol_0965(metR)Score=5.4          2.1e-05  [+1]
Mmol_0966(metE)Score=5.4          2.3e-05  [+1]
NMB0943(metF)Score=4.1,P          2.3e-05  [+1]
LHK_00469(metE)Score=4.3          3.1e-05  [+1]
LHK_00468(metR)Score=4.3          3.5e-05  [+1]
NMB2055(metR)Score=4.9,P          4.5e-05  [+1]
NMB0943(metF)Score=4.1,P          0.00012  [+1]
--------------------------------------------------------------------------------

--------------------------------------------------------------------------------
	Motif 1 in BLOCKS format
--------------------------------------------------------------------------------
BL   MOTIF 1 width=15 seqs=19
Mfla_2570(metR)Score=5.8 (    1) ATGAATTAAATTCAT  1 
Mfla_2571(metE)Score=5.8 (    1) ATGAATTTAATTCAT  1 
LHK_00468(metR)Score=5.8 (    1) ATGAATTTTATTCAT  1 
Nmul_A2634(metE)Score=5. (    1) ATGAATTTTATTCAT  1 
LHK_00469(metE)Score=5.8 (    1) ATGAATAAAATTCAT  1 
Nmul_A2635(metR)Score=5. (    1) ATGAATAAAATTCAT  1 
Tbd_2285(metR)Score=5.2, (    1) ATGAATAACACTCAT  1 
Tbd_2286(metE)Score=5.2, (    1) ATGAGTGTTATTCAT  1 
NE1435(metR)Score=5.4,Po (    1) ATGAATAATTTTCAT  1 
NE1436(metE)Score=5.4,Po (    1) ATGAAAATTATTCAT  1 
CV3604(metE)Score=4.8,Po (    1) ATGAGTTTGAATCAT  1 
CV3603(metR)Score=4.8,Po (    1) ATGATTCAAACTCAT  1 
Mmol_0965(metR)Score=5.4 (    1) ATTAATTTTATTCAT  1 
Mmol_0966(metE)Score=5.4 (    1) ATGAATAAAATTAAT  1 
NMB0943(metF)Score=4.1,P (    1) TTGAAATTGACTCAT  1 
LHK_00469(metE)Score=4.3 (    1) ATGAAATAAAACCAT  1 
LHK_00468(metR)Score=4.3 (    1) ATGGTTTTATTTCAT  1 
NMB2055(metR)Score=4.9,P (    1) ATGAATTATTTTAAT  1 
NMB0943(metF)Score=4.1,P (    1) ATTAGAAATTTTCAT  1 
//

--------------------------------------------------------------------------------

--------------------------------------------------------------------------------
	Motif 1 position-specific scoring matrix
--------------------------------------------------------------------------------
log-odds matrix: alength= 4 w= 15 n= 19 bayes= 1.33258 E= 6.7e-060 
   121  -1089  -1089   -300 
 -1089  -1089  -1089    124 
 -1089  -1089    337   -200 
   121  -1089    -72  -1089 
    85  -1089     87   -200 
   -95  -1089  -1089     90 
   -15    -66    -72     32 
    37  -1089  -1089     17 
     4    -66     28      0 
    95  -1089  -1089   -100 
  -195     93  -1089     80 
 -1089    -66  -1089    117 
  -195    343  -1089  -1089 
   129  -1089  -1089  -1089 
 -1089  -1089  -1089    124 
--------------------------------------------------------------------------------

--------------------------------------------------------------------------------
	Motif 1 position-specific probability matrix
--------------------------------------------------------------------------------
letter-probability matrix: alength= 4 w= 15 nsites= 19 E= 6.7e-060 
 0.947368  0.000000  0.000000  0.052632 
 0.000000  0.000000  0.000000  1.000000 
 0.000000  0.000000  0.894737  0.105263 
 0.947368  0.000000  0.052632  0.000000 
 0.736842  0.000000  0.157895  0.105263 
 0.210526  0.000000  0.000000  0.789474 
 0.368421  0.052632  0.052632  0.526316 
 0.526316  0.000000  0.000000  0.473684 
 0.421053  0.052632  0.105263  0.421053 
 0.789474  0.000000  0.000000  0.210526 
 0.105263  0.157895  0.000000  0.736842 
 0.000000  0.052632  0.000000  0.947368 
 0.105263  0.894737  0.000000  0.000000 
 1.000000  0.000000  0.000000  0.000000 
 0.000000  0.000000  0.000000  1.000000 
--------------------------------------------------------------------------------

--------------------------------------------------------------------------------
	Motif 1 regular expression
--------------------------------------------------------------------------------
ATGAA[TA][TA][AT][AT][AT]TTCAT
--------------------------------------------------------------------------------




Time  0.03 secs.

********************************************************************************


********************************************************************************
SUMMARY OF MOTIFS
********************************************************************************

--------------------------------------------------------------------------------
	Combined block diagrams: non-overlapping sites with p-value < 0.0001
--------------------------------------------------------------------------------
SEQUENCE NAME            COMBINED P-VALUE  MOTIF DIAGRAM
-------------            ----------------  -------------
NE1435(metR)Score=5.4,Po         3.22e-06  [+1(3.22e-06)]
NE1436(metE)Score=5.4,Po         3.60e-06  [+1(3.60e-06)]
Nmul_A2635(metR)Score=5.         7.70e-07  [+1(7.70e-07)]
Nmul_A2634(metE)Score=5.         5.68e-07  [+1(5.68e-07)]
Tbd_2285(metR)Score=5.2,         1.15e-06  [+1(1.15e-06)]
Tbd_2286(metE)Score=5.2,         1.27e-06  [+1(1.27e-06)]
CV3603(metR)Score=4.8,Po         6.37e-06  [+1(6.37e-06)]
CV3604(metE)Score=4.8,Po         4.43e-06  [+1(4.43e-06)]
NMB2055(metR)Score=4.9,P         4.50e-05  [+1(4.50e-05)]
NMB0943(metF)Score=4.1,P         1.19e-04  15
NMB0943(metF)Score=4.1,P         2.31e-05  [+1(2.31e-05)]
LHK_00468(metR)Score=4.3         3.52e-05  [+1(3.52e-05)]
LHK_00468(metR)Score=5.8         5.68e-07  [+1(5.68e-07)]
LHK_00469(metE)Score=5.8         7.70e-07  [+1(7.70e-07)]
LHK_00469(metE)Score=4.3         3.07e-05  [+1(3.07e-05)]
Mfla_2570(metR)Score=5.8         2.77e-07  [+1(2.77e-07)]
Mfla_2571(metE)Score=5.8         5.68e-07  [+1(5.68e-07)]
Mmol_0966(metE)Score=5.4         2.31e-05  [+1(2.31e-05)]
Mmol_0965(metR)Score=5.4         2.07e-05  [+1(2.07e-05)]
--------------------------------------------------------------------------------

********************************************************************************


********************************************************************************
Stopped because requested number of motifs (1) found.
********************************************************************************

CPU: leftraru1

********************************************************************************
