********************************************************************************
MEME - Motif discovery tool
********************************************************************************
MEME version 4.11.2 (Release date: Thu May 05 14:58:55 2016 -0700)

For further information on how to interpret these results or to get
a copy of the MEME software please access http://meme-suite.org .

This file may be used as input to the MAST algorithm for searching
sequence databases for matches to groups of motifs.  MAST is available
for interactive use and downloading at http://meme-suite.org .
********************************************************************************


********************************************************************************
REFERENCE
********************************************************************************
If you use this program in your research, please cite:

Timothy L. Bailey and Charles Elkan,
"Fitting a mixture model by expectation maximization to discover
motifs in biopolymers", Proceedings of the Second International
Conference on Intelligent Systems for Molecular Biology, pp. 28-36,
AAAI Press, Menlo Park, California, 1994.
********************************************************************************


********************************************************************************
TRAINING SET
********************************************************************************
DATAFILE= ModE_a-Rhizobiales.fasta
ALPHABET= ACGT
Sequence name            Weight Length  Sequence name            Weight Length  
-------------            ------ ------  -------------            ------ ------  
SMc03196(modA)Score=5.4, 1.0000     22  NGR_c29840(modA)Score=5. 1.0000     22  
RL4685(modA)Score=6,Pos= 1.0000     22  RL4685(modA)Score=5.5,Po 1.0000     22  
RHE_CH04071(modA)Score=5 1.0000     22  RHE_CH04071(modA)Score=5 1.0000     22  
Atu2561(modA)Score=5.1,P 1.0000     22  Atu2561(modA)Score=5.6,P 1.0000     22  
mll1465(modA)Score=5.9,P 1.0000     22  BBta_2080(modA)Score=5.7 1.0000     22  
AZC_2368(modA)Score=5.4, 1.0000     22  Xaut_3202(modA)Score=4.2 1.0000     22  
********************************************************************************

********************************************************************************
COMMAND LINE SUMMARY
********************************************************************************
This information can also be useful in the event you wish to report a
problem with the MEME software.

command: meme -dna ModE_a-Rhizobiales.fasta -oc ModE_a-Rhizobiales 

model:  mod=         zoops    nmotifs=         1    evt=           inf
object function=  E-value of product of p-values
width:  minw=            8    maxw=           22
width:  wg=             11    ws=              1    endgaps=       yes
nsites: minsites=        2    maxsites=       12    wnsites=       0.8
theta:  spmap=         uni    spfuzz=        0.5
global: substring=     yes    branching=      no    wbranch=        no
em:     prior=   dirichlet    b=            0.01    maxiter=        50
        distance=    1e-05
data:   n=             264    N=              12    shuffle=        -1
strands: +
sample: seed=            0    ctfrac=         -1    maxwords=       -1
Letter frequencies in dataset:
A 0.307 C 0.140 G 0.159 T 0.394 
Background letter frequencies (from dataset with add-one prior applied):
A 0.306 C 0.142 G 0.160 T 0.392 
********************************************************************************


********************************************************************************
MOTIF  1 MEME	width =  22  sites =  12  llr = 187  E-value = 2.5e-045
********************************************************************************
--------------------------------------------------------------------------------
	Motif 1 Description
--------------------------------------------------------------------------------
Simplified        A  22:8:a:3:2331359:a:82:
pos.-specific     C  :2:::::1532232::1:2:19
probability       G  8::3:::::3:33651::::3:
matrix            T  :7a:a:a753633:::9:8251

         bits    2.8                       
                 2.5                       
                 2.3                      *
                 2.0 *                    *
Relative         1.7 *    *           *   *
Entropy          1.4 * * ***        * *   *
(22.5 bits)      1.1 * ***** *    ***** * *
                 0.8 * ***** *    ******* *
                 0.6 * ***** *   ******** *
                 0.3 ******************** *
                 0.0 ----------------------

Multilevel           GTTATATTCGTGCGAATATATC
consensus               G   ATCAAGAG     G 
sequence                      T TT         
                                           
--------------------------------------------------------------------------------

--------------------------------------------------------------------------------
	Motif 1 sites sorted by position p-value
--------------------------------------------------------------------------------
Sequence name             Start   P-value                     Site       
-------------             ----- ---------            ----------------------
mll1465(modA)Score=5.9,P      1  3.56e-11          . GTTATATTCATGCGGATATATC           
Atu2561(modA)Score=5.6,P      1  1.91e-09          . GTTATATTCATCGGAATACATC           
NGR_c29840(modA)Score=5.      1  3.31e-09          . ATTGTATTTCTGCGGATATAGC           
RL4685(modA)Score=5.5,Po      1  7.89e-09          . GTTATATTCGTCGCAATATTTC           
BBta_2080(modA)Score=5.7      1  1.11e-08          . GATATATACGAATGGATATAGC           
RL4685(modA)Score=6,Pos=      1  1.70e-08          . GTTATATTTTCTTGGATATATC           
SMc03196(modA)Score=5.4,      1  2.30e-08          . ATTGTATTTCTACGAATATAGC           
AZC_2368(modA)Score=5.4,      1  2.54e-08          . GCTATATATGAGGAGATATAAC           
RHE_CH04071(modA)Score=5      1  2.79e-08          . GTTATATTCCTTGAAATATTTC           
RHE_CH04071(modA)Score=5      1  9.99e-08          . GTTATATTTTCTTCGATACATC           
Xaut_3202(modA)Score=4.2      1  3.92e-07          . GCTGTATATGAACGAGCATACC           
Atu2561(modA)Score=5.1,P      1  2.09e-06          . GATATATCCTTGAAAATATAAT           
--------------------------------------------------------------------------------

--------------------------------------------------------------------------------
	Motif 1 block diagrams
--------------------------------------------------------------------------------
SEQUENCE NAME            POSITION P-VALUE  MOTIF DIAGRAM
-------------            ----------------  -------------
mll1465(modA)Score=5.9,P          3.6e-11  [+1]
Atu2561(modA)Score=5.6,P          1.9e-09  [+1]
NGR_c29840(modA)Score=5.          3.3e-09  [+1]
RL4685(modA)Score=5.5,Po          7.9e-09  [+1]
BBta_2080(modA)Score=5.7          1.1e-08  [+1]
RL4685(modA)Score=6,Pos=          1.7e-08  [+1]
SMc03196(modA)Score=5.4,          2.3e-08  [+1]
AZC_2368(modA)Score=5.4,          2.5e-08  [+1]
RHE_CH04071(modA)Score=5          2.8e-08  [+1]
RHE_CH04071(modA)Score=5            1e-07  [+1]
Xaut_3202(modA)Score=4.2          3.9e-07  [+1]
Atu2561(modA)Score=5.1,P          2.1e-06  [+1]
--------------------------------------------------------------------------------

--------------------------------------------------------------------------------
	Motif 1 in BLOCKS format
--------------------------------------------------------------------------------
BL   MOTIF 1 width=22 seqs=12
mll1465(modA)Score=5.9,P (    1) GTTATATTCATGCGGATATATC  1 
Atu2561(modA)Score=5.6,P (    1) GTTATATTCATCGGAATACATC  1 
NGR_c29840(modA)Score=5. (    1) ATTGTATTTCTGCGGATATAGC  1 
RL4685(modA)Score=5.5,Po (    1) GTTATATTCGTCGCAATATTTC  1 
BBta_2080(modA)Score=5.7 (    1) GATATATACGAATGGATATAGC  1 
RL4685(modA)Score=6,Pos= (    1) GTTATATTTTCTTGGATATATC  1 
SMc03196(modA)Score=5.4, (    1) ATTGTATTTCTACGAATATAGC  1 
AZC_2368(modA)Score=5.4, (    1) GCTATATATGAGGAGATATAAC  1 
RHE_CH04071(modA)Score=5 (    1) GTTATATTCCTTGAAATATTTC  1 
RHE_CH04071(modA)Score=5 (    1) GTTATATTTTCTTCGATACATC  1 
Xaut_3202(modA)Score=4.2 (    1) GCTGTATATGAACGAGCATACC  1 
Atu2561(modA)Score=5.1,P (    1) GATATATCCTTGAAAATATAAT  1 
//

--------------------------------------------------------------------------------

--------------------------------------------------------------------------------
	Motif 1 position-specific scoring matrix
--------------------------------------------------------------------------------
log-odds matrix: alength= 4 w= 22 n= 12 bayes= 1 E= 2.5e-045 
   -88  -1023    238  -1023 
   -88     23  -1023     77 
 -1023  -1023  -1023    135 
   129  -1023     64  -1023 
 -1023  -1023  -1023    135 
   171  -1023  -1023  -1023 
 -1023  -1023  -1023    135 
   -29    -77  -1023     77 
 -1023    182  -1023     35 
   -88     82    105    -65 
   -29     23  -1023     57 
   -29     23    105    -65 
  -187    123    105    -65 
   -29     23    186  -1023 
    71  -1023    164  -1023 
   158  -1023    -94  -1023 
 -1023    -77  -1023    123 
   171  -1023  -1023  -1023 
 -1023     23  -1023    109 
   144  -1023  -1023   -123 
   -88    -77     64     35 
 -1023    269  -1023   -223 
--------------------------------------------------------------------------------

--------------------------------------------------------------------------------
	Motif 1 position-specific probability matrix
--------------------------------------------------------------------------------
letter-probability matrix: alength= 4 w= 22 nsites= 12 E= 2.5e-045 
 0.166667  0.000000  0.833333  0.000000 
 0.166667  0.166667  0.000000  0.666667 
 0.000000  0.000000  0.000000  1.000000 
 0.750000  0.000000  0.250000  0.000000 
 0.000000  0.000000  0.000000  1.000000 
 1.000000  0.000000  0.000000  0.000000 
 0.000000  0.000000  0.000000  1.000000 
 0.250000  0.083333  0.000000  0.666667 
 0.000000  0.500000  0.000000  0.500000 
 0.166667  0.250000  0.333333  0.250000 
 0.250000  0.166667  0.000000  0.583333 
 0.250000  0.166667  0.333333  0.250000 
 0.083333  0.333333  0.333333  0.250000 
 0.250000  0.166667  0.583333  0.000000 
 0.500000  0.000000  0.500000  0.000000 
 0.916667  0.000000  0.083333  0.000000 
 0.000000  0.083333  0.000000  0.916667 
 1.000000  0.000000  0.000000  0.000000 
 0.000000  0.166667  0.000000  0.833333 
 0.833333  0.000000  0.000000  0.166667 
 0.166667  0.083333  0.250000  0.500000 
 0.000000  0.916667  0.000000  0.083333 
--------------------------------------------------------------------------------

--------------------------------------------------------------------------------
	Motif 1 regular expression
--------------------------------------------------------------------------------
GTT[AG]TAT[TA][CT][GCT][TA][GAT][CGT][GA][AG]ATATA[TG]C
--------------------------------------------------------------------------------




Time  0.03 secs.

********************************************************************************


********************************************************************************
SUMMARY OF MOTIFS
********************************************************************************

--------------------------------------------------------------------------------
	Combined block diagrams: non-overlapping sites with p-value < 0.0001
--------------------------------------------------------------------------------
SEQUENCE NAME            COMBINED P-VALUE  MOTIF DIAGRAM
-------------            ----------------  -------------
SMc03196(modA)Score=5.4,         2.30e-08  [+1(2.30e-08)]
NGR_c29840(modA)Score=5.         3.31e-09  [+1(3.31e-09)]
RL4685(modA)Score=6,Pos=         1.70e-08  [+1(1.70e-08)]
RL4685(modA)Score=5.5,Po         7.89e-09  [+1(7.89e-09)]
RHE_CH04071(modA)Score=5         2.79e-08  [+1(2.79e-08)]
RHE_CH04071(modA)Score=5         9.99e-08  [+1(9.99e-08)]
Atu2561(modA)Score=5.1,P         2.09e-06  [+1(2.09e-06)]
Atu2561(modA)Score=5.6,P         1.91e-09  [+1(1.91e-09)]
mll1465(modA)Score=5.9,P         3.56e-11  [+1(3.56e-11)]
BBta_2080(modA)Score=5.7         1.11e-08  [+1(1.11e-08)]
AZC_2368(modA)Score=5.4,         2.54e-08  [+1(2.54e-08)]
Xaut_3202(modA)Score=4.2         3.92e-07  [+1(3.92e-07)]
--------------------------------------------------------------------------------

********************************************************************************


********************************************************************************
Stopped because requested number of motifs (1) found.
********************************************************************************

CPU: leftraru1

********************************************************************************
