********************************************************************************
MEME - Motif discovery tool
********************************************************************************
MEME version 4.11.2 (Release date: Thu May 05 14:58:55 2016 -0700)

For further information on how to interpret these results or to get
a copy of the MEME software please access http://meme-suite.org .

This file may be used as input to the MAST algorithm for searching
sequence databases for matches to groups of motifs.  MAST is available
for interactive use and downloading at http://meme-suite.org .
********************************************************************************


********************************************************************************
REFERENCE
********************************************************************************
If you use this program in your research, please cite:

Timothy L. Bailey and Charles Elkan,
"Fitting a mixture model by expectation maximization to discover
motifs in biopolymers", Proceedings of the Second International
Conference on Intelligent Systems for Molecular Biology, pp. 28-36,
AAAI Press, Menlo Park, California, 1994.
********************************************************************************


********************************************************************************
TRAINING SET
********************************************************************************
DATAFILE= NikR_Desulfovibrionales.fasta
ALPHABET= ACGT
Sequence name            Weight Length  Sequence name            Weight Length  
-------------            ------ ------  -------------            ------ ------  
DVU1058(nikM)Score=7.3,P 1.0000     27  DVU2769(nikK)Score=6.8,P 1.0000     27  
DvMF_2859(nikK)Score=6.8 1.0000     27  DvMF_2398(nikD)Score=5.4 1.0000     27  
DvMF_0274(hysB)Score=6.8 1.0000     27  Dde_1189(nikK)Score=7.3P 1.0000     27  
Dde_2134(hysB)Score=5.7, 1.0000     27  Dde_2281(hydA2)Score=5.2 1.0000     27  
Dde_2281(hydA2)Score=7.4 1.0000     27  Ddes_1470(nikK)Score=5.4 1.0000     27  
Ddes_1032(nikA)Score=7,P 1.0000     27  DESPIG_00816(nikK)Score= 1.0000     27  
Desal_1884(nikL)Score=6. 1.0000     27  LI0864,Score=6.5,Pos=-98 1.0000     27  
LI0864Score=5.5,Pos=-68[ 1.0000     27  Dbac_1970(hysB)Score=6.3 1.0000     27  
********************************************************************************

********************************************************************************
COMMAND LINE SUMMARY
********************************************************************************
This information can also be useful in the event you wish to report a
problem with the MEME software.

command: meme -dna NikR_Desulfovibrionales.fasta -oc NikR_Desulfovibrionales 

model:  mod=         zoops    nmotifs=         1    evt=           inf
object function=  E-value of product of p-values
width:  minw=            8    maxw=           27
width:  wg=             11    ws=              1    endgaps=       yes
nsites: minsites=        2    maxsites=       16    wnsites=       0.8
theta:  spmap=         uni    spfuzz=        0.5
global: substring=     yes    branching=      no    wbranch=        no
em:     prior=   dirichlet    b=            0.01    maxiter=        50
        distance=    1e-05
data:   n=             432    N=              16    shuffle=        -1
strands: +
sample: seed=            0    ctfrac=         -1    maxwords=       -1
Letter frequencies in dataset:
A 0.280 C 0.231 G 0.229 T 0.259 
Background letter frequencies (from dataset with add-one prior applied):
A 0.280 C 0.232 G 0.229 T 0.259 
********************************************************************************


********************************************************************************
MOTIF  1 MEME	width =  27  sites =  16  llr = 170  E-value = 4.0e-037
********************************************************************************
--------------------------------------------------------------------------------
	Motif 1 Description
--------------------------------------------------------------------------------
Simplified        A  1:331a133333333333331:6739:
pos.-specific     C  :1115:522222222222221:::719
probability       G  9:61::122222222222228:41:1:
matrix            T  19:54:333333333333331a131:1

         bits    2.1                            
                 1.9      *               *     
                 1.7  *   *               *    *
                 1.5 **   *               *    *
Relative         1.3 **   *               *   **
Entropy          1.1 **   *               *   **
(15.3 bits)      0.8 *** **              ** ****
                 0.6 *** **              *******
                 0.4 *** ***             *******
                 0.2 *******             *******
                 0.0 ---------------------------

Multilevel           GTGTCACAAAAAAAAAAAAAGTAACAC
consensus              AAT TTTTTTTTTTTTTT  GTA  
sequence                    CCCCCCCCCCCCC       
                            GGGGGGGGGGGGG       
--------------------------------------------------------------------------------

--------------------------------------------------------------------------------
	Motif 1 sites sorted by position p-value
--------------------------------------------------------------------------------
Sequence name             Start   P-value                       Site          
-------------             ----- ---------            ---------------------------
Dde_1189(nikK)Score=7.3P      1  4.62e-08          . GTGTTATNNNNNNNNNNNNNGTAACAC           
DVU1058(nikM)Score=7.3,P      1  4.62e-08          . GTGTTATNNNNNNNNNNNNNGTAACAC           
Dde_2281(hydA2)Score=7.4      1  7.36e-08          . GTATTACNNNNNNNNNNNNNGTAACAC           
Desal_1884(nikL)Score=6.      1  4.26e-07          . GTACCACNNNNNNNNNNNNNGTGACAC           
Ddes_1032(nikA)Score=7,P      1  7.47e-07          . GTGTCACNNNNNNNNNNNNNTTGACAC           
DvMF_2859(nikK)Score=6.8      1  7.47e-07          . GTGACACNNNNNNNNNNNNNGTGTAAC           
DVU2769(nikK)Score=6.8,P      1  7.47e-07          . GTGACACNNNNNNNNNNNNNGTGTAAC           
DvMF_0274(hysB)Score=6.8      1  1.78e-06          . GTAACACNNNNNNNNNNNNNATAACAC           
Dbac_1970(hysB)Score=6.3      1  2.19e-06          . GTGTTATNNNNNNNNNNNNNGTAACAT           
LI0864,Score=6.5,Pos=-98      1  6.83e-06          . GTATCATNNNNNNNNNNNNNGTATTAC           
Dde_2134(hysB)Score=5.7,      1  6.83e-06          . GTCTCAGNNNNNNNNNNNNNGTAAAAC           
LI0864Score=5.5,Pos=-68[      1  2.63e-05          . ATGATATNNNNNNNNNNNNNGTTACAC           
Ddes_1470(nikK)Score=5.4      1  2.82e-05          . TTGCTACNNNNNNNNNNNNNGTGTAAC           
DvMF_2398(nikD)Score=5.4      1  3.42e-05          . GCAACACNNNNNNNNNNNNNGTGACCC           
Dde_2281(hydA2)Score=5.2      1  7.42e-05          . GTGGTAGNNNNNNNNNNNNNATAGCAC           
DESPIG_00816(nikK)Score=      1  1.93e-04          . GTGTAAANNNNNNNNNNNNNCTAACGC           
--------------------------------------------------------------------------------

--------------------------------------------------------------------------------
	Motif 1 block diagrams
--------------------------------------------------------------------------------
SEQUENCE NAME            POSITION P-VALUE  MOTIF DIAGRAM
-------------            ----------------  -------------
Dde_1189(nikK)Score=7.3P          4.6e-08  [+1]
DVU1058(nikM)Score=7.3,P          4.6e-08  [+1]
Dde_2281(hydA2)Score=7.4          7.4e-08  [+1]
Desal_1884(nikL)Score=6.          4.3e-07  [+1]
Ddes_1032(nikA)Score=7,P          7.5e-07  [+1]
DvMF_2859(nikK)Score=6.8          7.5e-07  [+1]
DVU2769(nikK)Score=6.8,P          7.5e-07  [+1]
DvMF_0274(hysB)Score=6.8          1.8e-06  [+1]
Dbac_1970(hysB)Score=6.3          2.2e-06  [+1]
LI0864,Score=6.5,Pos=-98          6.8e-06  [+1]
Dde_2134(hysB)Score=5.7,          6.8e-06  [+1]
LI0864Score=5.5,Pos=-68[          2.6e-05  [+1]
Ddes_1470(nikK)Score=5.4          2.8e-05  [+1]
DvMF_2398(nikD)Score=5.4          3.4e-05  [+1]
Dde_2281(hydA2)Score=5.2          7.4e-05  [+1]
DESPIG_00816(nikK)Score=          0.00019  [+1]
--------------------------------------------------------------------------------

--------------------------------------------------------------------------------
	Motif 1 in BLOCKS format
--------------------------------------------------------------------------------
BL   MOTIF 1 width=27 seqs=16
Dde_1189(nikK)Score=7.3P (    1) GTGTTATNNNNNNNNNNNNNGTAACAC  1 
DVU1058(nikM)Score=7.3,P (    1) GTGTTATNNNNNNNNNNNNNGTAACAC  1 
Dde_2281(hydA2)Score=7.4 (    1) GTATTACNNNNNNNNNNNNNGTAACAC  1 
Desal_1884(nikL)Score=6. (    1) GTACCACNNNNNNNNNNNNNGTGACAC  1 
Ddes_1032(nikA)Score=7,P (    1) GTGTCACNNNNNNNNNNNNNTTGACAC  1 
DvMF_2859(nikK)Score=6.8 (    1) GTGACACNNNNNNNNNNNNNGTGTAAC  1 
DVU2769(nikK)Score=6.8,P (    1) GTGACACNNNNNNNNNNNNNGTGTAAC  1 
DvMF_0274(hysB)Score=6.8 (    1) GTAACACNNNNNNNNNNNNNATAACAC  1 
Dbac_1970(hysB)Score=6.3 (    1) GTGTTATNNNNNNNNNNNNNGTAACAT  1 
LI0864,Score=6.5,Pos=-98 (    1) GTATCATNNNNNNNNNNNNNGTATTAC  1 
Dde_2134(hysB)Score=5.7, (    1) GTCTCAGNNNNNNNNNNNNNGTAAAAC  1 
LI0864Score=5.5,Pos=-68[ (    1) ATGATATNNNNNNNNNNNNNGTTACAC  1 
Ddes_1470(nikK)Score=5.4 (    1) TTGCTACNNNNNNNNNNNNNGTGTAAC  1 
DvMF_2398(nikD)Score=5.4 (    1) GCAACACNNNNNNNNNNNNNGTGACCC  1 
Dde_2281(hydA2)Score=5.2 (    1) GTGGTAGNNNNNNNNNNNNNATAGCAC  1 
DESPIG_00816(nikK)Score= (    1) GTGTAAANNNNNNNNNNNNNCTAACGC  1 
//

--------------------------------------------------------------------------------

--------------------------------------------------------------------------------
	Motif 1 position-specific scoring matrix
--------------------------------------------------------------------------------
log-odds matrix: alength= 4 w= 27 n= 16 bayes= 1.22239 E= 4.0e-037 
  -216  -1064    193   -205 
 -1064   -189  -1064    185 
    16   -189    145  -1064 
    16    -89   -187     95 
  -216    111  -1064     75 
   184  -1064  -1064  -1064 
  -216    111    -87     27 
     0      0      0      0 
     0      0      0      0 
     0      0      0      0 
     0      0      0      0 
     0      0      0      0 
     0      0      0      0 
     0      0      0      0 
     0      0      0      0 
     0      0      0      0 
     0      0      0      0 
     0      0      0      0 
     0      0      0      0 
     0      0      0      0 
  -116   -189    171   -205 
 -1064  -1064  -1064    195 
   101  -1064     71   -205 
   130  -1064   -187     -5 
   -16    157  -1064   -205 
   164   -189   -187  -1064 
 -1064    202  -1064   -205 
--------------------------------------------------------------------------------

--------------------------------------------------------------------------------
	Motif 1 position-specific probability matrix
--------------------------------------------------------------------------------
letter-probability matrix: alength= 4 w= 27 nsites= 16 E= 4.0e-037 
 0.062500  0.000000  0.875000  0.062500 
 0.000000  0.062500  0.000000  0.937500 
 0.312500  0.062500  0.625000  0.000000 
 0.312500  0.125000  0.062500  0.500000 
 0.062500  0.500000  0.000000  0.437500 
 1.000000  0.000000  0.000000  0.000000 
 0.062500  0.500000  0.125000  0.312500 
 0.279817  0.231651  0.229358  0.259174 
 0.279817  0.231651  0.229358  0.259174 
 0.279817  0.231651  0.229358  0.259174 
 0.279817  0.231651  0.229358  0.259174 
 0.279817  0.231651  0.229358  0.259174 
 0.279817  0.231651  0.229358  0.259174 
 0.279817  0.231651  0.229358  0.259174 
 0.279817  0.231651  0.229358  0.259174 
 0.279817  0.231651  0.229358  0.259174 
 0.279817  0.231651  0.229358  0.259174 
 0.279817  0.231651  0.229358  0.259174 
 0.279817  0.231651  0.229358  0.259174 
 0.279817  0.231651  0.229358  0.259174 
 0.125000  0.062500  0.750000  0.062500 
 0.000000  0.000000  0.000000  1.000000 
 0.562500  0.000000  0.375000  0.062500 
 0.687500  0.000000  0.062500  0.250000 
 0.250000  0.687500  0.000000  0.062500 
 0.875000  0.062500  0.062500  0.000000 
 0.000000  0.937500  0.000000  0.062500 
--------------------------------------------------------------------------------

--------------------------------------------------------------------------------
	Motif 1 regular expression
--------------------------------------------------------------------------------
GT[GA][TA][CT]A[CT][ATCG][ATCG][ATCG][ATCG][ATCG][ATCG][ATCG][ATCG][ATCG][ATCG][ATCG][ATCG][ATCG]GT[AG][AT][CA]AC
--------------------------------------------------------------------------------




Time  0.05 secs.

********************************************************************************


********************************************************************************
SUMMARY OF MOTIFS
********************************************************************************

--------------------------------------------------------------------------------
	Combined block diagrams: non-overlapping sites with p-value < 0.0001
--------------------------------------------------------------------------------
SEQUENCE NAME            COMBINED P-VALUE  MOTIF DIAGRAM
-------------            ----------------  -------------
DVU1058(nikM)Score=7.3,P         4.62e-08  [+1(4.62e-08)]
DVU2769(nikK)Score=6.8,P         7.47e-07  [+1(7.47e-07)]
DvMF_2859(nikK)Score=6.8         7.47e-07  [+1(7.47e-07)]
DvMF_2398(nikD)Score=5.4         3.42e-05  [+1(3.42e-05)]
DvMF_0274(hysB)Score=6.8         1.78e-06  [+1(1.78e-06)]
Dde_1189(nikK)Score=7.3P         4.62e-08  [+1(4.62e-08)]
Dde_2134(hysB)Score=5.7,         6.83e-06  [+1(6.83e-06)]
Dde_2281(hydA2)Score=5.2         7.42e-05  [+1(7.42e-05)]
Dde_2281(hydA2)Score=7.4         7.36e-08  [+1(7.36e-08)]
Ddes_1470(nikK)Score=5.4         2.82e-05  [+1(2.82e-05)]
Ddes_1032(nikA)Score=7,P         7.47e-07  [+1(7.47e-07)]
DESPIG_00816(nikK)Score=         1.93e-04  27
Desal_1884(nikL)Score=6.         4.26e-07  [+1(4.26e-07)]
LI0864,Score=6.5,Pos=-98         6.83e-06  [+1(6.83e-06)]
LI0864Score=5.5,Pos=-68[         2.63e-05  [+1(2.63e-05)]
Dbac_1970(hysB)Score=6.3         2.19e-06  [+1(2.19e-06)]
--------------------------------------------------------------------------------

********************************************************************************


********************************************************************************
Stopped because requested number of motifs (1) found.
********************************************************************************

CPU: leftraru1

********************************************************************************
