********************************************************************************
MEME - Motif discovery tool
********************************************************************************
MEME version 5.0.5 (Release date: Mon Mar 18 20:12:19 2019 -0700)

For further information on how to interpret please access http://meme-suite.org.
To get a copy of the MEME software please access http://meme-suite.org.

********************************************************************************


********************************************************************************
REFERENCE
********************************************************************************
If you use this program in your research, please cite:

Timothy L. Bailey and Charles Elkan,
"Fitting a mixture model by expectation maximization to discover
motifs in biopolymers", Proceedings of the Second International
Conference on Intelligent Systems for Molecular Biology, pp. 28-36,
AAAI Press, Menlo Park, California, 1994.
********************************************************************************


********************************************************************************
TRAINING SET
********************************************************************************
PRIMARY SEQUENCES= /home/dtravisany/gitrepo/RegPrecise/Motif_PWM/Vibrionales/NorR2_Vibrionales.Xml.fasta
CONTROL SEQUENCES= --none--
ALPHABET= ACGT
Sequence name            Weight Length  Sequence name            Weight Length  
-------------            ------ ------  -------------            ------ ------  
VAS14_14739_p-148(hcp)   1.0000     19  VAS14_14739_p-172(hcp)   1.0000     19  
VAS14_14734_p-51(norR2)  1.0000     19  VF_A0863_p-225(hcp)      1.0000     19  
VF_A0862_p-39(norR2)     1.0000     19  VF_A0863_p-201(hcp)      1.0000     19  
VIBHAR_02686_p-61(norR2) 1.0000     19  VIBHAR_02687_p-159(hcp)  1.0000     19  
VIBHAR_02687_p-136(hcp)  1.0000     19  VP1190_p-61(norR2)       1.0000     19  
VP1189_p-136(hcp)        1.0000     19  VP1189_p-159(hcp)        1.0000     19  
VV1_2863_p-94(norR2)     1.0000     19  VV1_2863_p-60(norR2)     1.0000     19  
VV1_2864_p-187(hcp)      1.0000     19  VV1_2864_p-165(hcp)      1.0000     19  
PBPRB1897_p-41(norR2)    1.0000     19  PBPRB1896_p-146(hcp)     1.0000     19  
PBPRB1896_p-169(hcp)     1.0000     19  
********************************************************************************

********************************************************************************
COMMAND LINE SUMMARY
********************************************************************************
This information can also be useful in the event you wish to report a
problem with the MEME software.

command: meme -dna /home/dtravisany/gitrepo/RegPrecise/Motif_PWM/Vibrionales/NorR2_Vibrionales.Xml.fasta -oc /home/dtravisany/gitrepo/RegPrecise/Motif_PWM/Vibrionales/NorR2_Vibrionales 

model:  mod=         zoops    nmotifs=         1    evt=           inf
objective function:           em=       E-value of product of p-values
                              starts=   E-value of product of p-values
strands: +
width:  minw=            8    maxw=           19
nsites: minsites=        2    maxsites=       19    wnsites=       0.8
theta:  spmap=         uni    spfuzz=        0.5
em:     prior=   dirichlet    b=            0.01    maxiter=        50
        distance=    1e-05
trim:   wg=             11    ws=              1    endgaps=       yes
data:   n=             361    N=              19
sample: seed=            0    hsfrac=          0
        searchsize=    361    norand=         no    csites=       1000
Letter frequencies in dataset:
A 0.368 C 0.186 G 0.136 T 0.31 
Background letter frequencies (from file dataset with add-one prior applied):
A 0.367 C 0.186 G 0.137 T 0.31 
Background model order: 0
********************************************************************************


********************************************************************************
MOTIF YGWTGTMAWWATNACATCA MEME-1	width =  19  sites =  19  llr = 293  E-value = 1.1e-091
********************************************************************************
--------------------------------------------------------------------------------
	Motif YGWTGTMAWWATNACATCA MEME-1 Description
--------------------------------------------------------------------------------
Simplified        A  ::61::5645822a:a2:9
pos.-specific     C  61:1::321::12:a:19:
probability       G  191:a::::::13::::11
matrix            T  3:39:a2265263:::8::

         bits    2.9     *              
                 2.6  *  *              
                 2.3  *  *         *    
                 2.0  *  *         *  * 
Relative         1.7  *  **        *  * 
Entropy          1.4  *  **       *** * 
(22.2 bits)      1.1 ** ***       *** **
                 0.9 ** ***    *  ******
                 0.6 ******   **  ******
                 0.3 *******************
                 0.0 -------------------

Multilevel           CGATGTAATAATGACATCA
consensus            T T   CTAT AT      
sequence                   T     C      
                                        
--------------------------------------------------------------------------------

--------------------------------------------------------------------------------
	Motif YGWTGTMAWWATNACATCA MEME-1 sites sorted by position p-value
--------------------------------------------------------------------------------
Sequence name             Start   P-value                   Site      
-------------             ----- ---------            -------------------
VP1189_p-159(hcp)             1  7.70e-10          . CGATGTAATTAAGACATCA           
PBPRB1897_p-41(norR2)         1  1.21e-09          . CGATGTAAAAATCACATCA           
PBPRB1896_p-169(hcp)          1  2.60e-09          . TGATGTAATTATCACATCA           
VP1189_p-136(hcp)             1  3.61e-09          . CGTTGTCTTAATTACATCA           
VP1190_p-61(norR2)            1  3.61e-09          . CGATGTTCAAATGACATCA           
VIBHAR_02686_p-61(norR2)      1  3.61e-09          . CGATGTTCAAATGACATCA           
VAS14_14739_p-148(hcp)        1  5.43e-09          . CGATGTTTTTATTACATCA           
VIBHAR_02687_p-136(hcp)       1  1.18e-08          . CGTTGTCACAATCACATCA           
PBPRB1896_p-146(hcp)          1  1.85e-08          . CGTTGTAATAACCACATCA           
VIBHAR_02687_p-159(hcp)       1  2.59e-08          . CGTTGTCATTTGTACATCA           
VF_A0863_p-225(hcp)           1  3.15e-08          . TGATGTATTTATAACATCA           
VV1_2863_p-60(norR2)          1  3.48e-08          . CGATGTTCAAATGACAACA           
VF_A0862_p-39(norR2)          1  4.64e-08          . TGATGTAAATTTTACATCA           
VAS14_14739_p-172(hcp)        1  7.90e-08          . TGATGTAATAATAACAACA           
VAS14_14734_p-51(norR2)       1  9.37e-08          . TGTTGTAATAAAGACAACA           
VV1_2863_p-94(norR2)          1  1.28e-07          . CGACGTCAATAGAACATCA           
VF_A0863_p-201(hcp)           1  1.28e-07          . CGTAGTCATTAATACATCA           
VV1_2864_p-165(hcp)           1  1.63e-06          . GCGTGTCTTTTTTACATCA           
VV1_2864_p-187(hcp)           1  1.69e-06          . TGATGTAAAAAAGACACGG           
--------------------------------------------------------------------------------

--------------------------------------------------------------------------------
	Motif YGWTGTMAWWATNACATCA MEME-1 block diagrams
--------------------------------------------------------------------------------
SEQUENCE NAME            POSITION P-VALUE  MOTIF DIAGRAM
-------------            ----------------  -------------
VP1189_p-159(hcp)                 7.7e-10  [+1]
PBPRB1897_p-41(norR2)             1.2e-09  [+1]
PBPRB1896_p-169(hcp)              2.6e-09  [+1]
VP1189_p-136(hcp)                 3.6e-09  [+1]
VP1190_p-61(norR2)                3.6e-09  [+1]
VIBHAR_02686_p-61(norR2)          3.6e-09  [+1]
VAS14_14739_p-148(hcp)            5.4e-09  [+1]
VIBHAR_02687_p-136(hcp)           1.2e-08  [+1]
PBPRB1896_p-146(hcp)              1.9e-08  [+1]
VIBHAR_02687_p-159(hcp)           2.6e-08  [+1]
VF_A0863_p-225(hcp)               3.1e-08  [+1]
VV1_2863_p-60(norR2)              3.5e-08  [+1]
VF_A0862_p-39(norR2)              4.6e-08  [+1]
VAS14_14739_p-172(hcp)            7.9e-08  [+1]
VAS14_14734_p-51(norR2)           9.4e-08  [+1]
VV1_2863_p-94(norR2)              1.3e-07  [+1]
VF_A0863_p-201(hcp)               1.3e-07  [+1]
VV1_2864_p-165(hcp)               1.6e-06  [+1]
VV1_2864_p-187(hcp)               1.7e-06  [+1]
--------------------------------------------------------------------------------

--------------------------------------------------------------------------------
	Motif YGWTGTMAWWATNACATCA MEME-1 in BLOCKS format
--------------------------------------------------------------------------------
BL   MOTIF YGWTGTMAWWATNACATCA width=19 seqs=19
VP1189_p-159(hcp)        (    1) CGATGTAATTAAGACATCA  1 
PBPRB1897_p-41(norR2)    (    1) CGATGTAAAAATCACATCA  1 
PBPRB1896_p-169(hcp)     (    1) TGATGTAATTATCACATCA  1 
VP1189_p-136(hcp)        (    1) CGTTGTCTTAATTACATCA  1 
VP1190_p-61(norR2)       (    1) CGATGTTCAAATGACATCA  1 
VIBHAR_02686_p-61(norR2) (    1) CGATGTTCAAATGACATCA  1 
VAS14_14739_p-148(hcp)   (    1) CGATGTTTTTATTACATCA  1 
VIBHAR_02687_p-136(hcp)  (    1) CGTTGTCACAATCACATCA  1 
PBPRB1896_p-146(hcp)     (    1) CGTTGTAATAACCACATCA  1 
VIBHAR_02687_p-159(hcp)  (    1) CGTTGTCATTTGTACATCA  1 
VF_A0863_p-225(hcp)      (    1) TGATGTATTTATAACATCA  1 
VV1_2863_p-60(norR2)     (    1) CGATGTTCAAATGACAACA  1 
VF_A0862_p-39(norR2)     (    1) TGATGTAAATTTTACATCA  1 
VAS14_14739_p-172(hcp)   (    1) TGATGTAATAATAACAACA  1 
VAS14_14734_p-51(norR2)  (    1) TGTTGTAATAAAGACAACA  1 
VV1_2863_p-94(norR2)     (    1) CGACGTCAATAGAACATCA  1 
VF_A0863_p-201(hcp)      (    1) CGTAGTCATTAATACATCA  1 
VV1_2864_p-165(hcp)      (    1) GCGTGTCTTTTTTACATCA  1 
VV1_2864_p-187(hcp)      (    1) TGATGTAAAAAAGACACGG  1 
//

--------------------------------------------------------------------------------

--------------------------------------------------------------------------------
	Motif YGWTGTMAWWATNACATCA MEME-1 position-specific scoring matrix
--------------------------------------------------------------------------------
log-odds matrix: alength= 4 w= 19 n= 19 bayes= 1.33258 E= 1.1e-091 
 -1089    176   -138      3 
 -1089   -182    279  -1089 
    78  -1089   -138      3 
  -280   -182  -1089    153 
 -1089  -1089    287  -1089 
 -1089  -1089  -1089    169 
    37     76  -1089    -56 
    78    -24  -1089    -56 
     1   -182  -1089     90 
    52  -1089  -1089     61 
   120  -1089  -1089    -97 
   -80   -182    -38    103 
  -122     18    120      3 
   145  -1089  -1089  -1089 
 -1089    242  -1089  -1089 
   145  -1089  -1089  -1089 
  -122   -182  -1089    135 
 -1089    235   -138  -1089 
   137  -1089   -138  -1089 
--------------------------------------------------------------------------------

--------------------------------------------------------------------------------
	Motif YGWTGTMAWWATNACATCA MEME-1 position-specific probability matrix
--------------------------------------------------------------------------------
letter-probability matrix: alength= 4 w= 19 nsites= 19 E= 1.1e-091 
 0.000000  0.631579  0.052632  0.315789 
 0.000000  0.052632  0.947368  0.000000 
 0.631579  0.000000  0.052632  0.315789 
 0.052632  0.052632  0.000000  0.894737 
 0.000000  0.000000  1.000000  0.000000 
 0.000000  0.000000  0.000000  1.000000 
 0.473684  0.315789  0.000000  0.210526 
 0.631579  0.157895  0.000000  0.210526 
 0.368421  0.052632  0.000000  0.578947 
 0.526316  0.000000  0.000000  0.473684 
 0.842105  0.000000  0.000000  0.157895 
 0.210526  0.052632  0.105263  0.631579 
 0.157895  0.210526  0.315789  0.315789 
 1.000000  0.000000  0.000000  0.000000 
 0.000000  1.000000  0.000000  0.000000 
 1.000000  0.000000  0.000000  0.000000 
 0.157895  0.052632  0.000000  0.789474 
 0.000000  0.947368  0.052632  0.000000 
 0.947368  0.000000  0.052632  0.000000 
--------------------------------------------------------------------------------

--------------------------------------------------------------------------------
	Motif YGWTGTMAWWATNACATCA MEME-1 regular expression
--------------------------------------------------------------------------------
[CT]G[AT]TGT[ACT][AT][TA][AT]A[TA][GTC]ACATCA
--------------------------------------------------------------------------------




Time  0.03 secs.

********************************************************************************


********************************************************************************
SUMMARY OF MOTIFS
********************************************************************************

--------------------------------------------------------------------------------
	Combined block diagrams: non-overlapping sites with p-value < 0.0001
--------------------------------------------------------------------------------
SEQUENCE NAME            COMBINED P-VALUE  MOTIF DIAGRAM
-------------            ----------------  -------------
VAS14_14739_p-148(hcp)           5.43e-09  [+1(5.43e-09)]
VAS14_14739_p-172(hcp)           7.90e-08  [+1(7.90e-08)]
VAS14_14734_p-51(norR2)          9.37e-08  [+1(9.37e-08)]
VF_A0863_p-225(hcp)              3.15e-08  [+1(3.15e-08)]
VF_A0862_p-39(norR2)             4.64e-08  [+1(4.64e-08)]
VF_A0863_p-201(hcp)              1.28e-07  [+1(1.28e-07)]
VIBHAR_02686_p-61(norR2)         3.61e-09  [+1(3.61e-09)]
VIBHAR_02687_p-159(hcp)          2.59e-08  [+1(2.59e-08)]
VIBHAR_02687_p-136(hcp)          1.18e-08  [+1(1.18e-08)]
VP1190_p-61(norR2)               3.61e-09  [+1(3.61e-09)]
VP1189_p-136(hcp)                3.61e-09  [+1(3.61e-09)]
VP1189_p-159(hcp)                7.70e-10  [+1(7.70e-10)]
VV1_2863_p-94(norR2)             1.28e-07  [+1(1.28e-07)]
VV1_2863_p-60(norR2)             3.48e-08  [+1(3.48e-08)]
VV1_2864_p-187(hcp)              1.69e-06  [+1(1.69e-06)]
VV1_2864_p-165(hcp)              1.63e-06  [+1(1.63e-06)]
PBPRB1897_p-41(norR2)            1.21e-09  [+1(1.21e-09)]
PBPRB1896_p-146(hcp)             1.85e-08  [+1(1.85e-08)]
PBPRB1896_p-169(hcp)             2.60e-09  [+1(2.60e-09)]
--------------------------------------------------------------------------------

********************************************************************************


********************************************************************************
Stopped because requested number of motifs (1) found.
********************************************************************************

CPU: optimus

********************************************************************************
