********************************************************************************
MEME - Motif discovery tool
********************************************************************************
MEME version 4.11.2 (Release date: Thu May 05 14:58:55 2016 -0700)

For further information on how to interpret these results or to get
a copy of the MEME software please access http://meme-suite.org .

This file may be used as input to the MAST algorithm for searching
sequence databases for matches to groups of motifs.  MAST is available
for interactive use and downloading at http://meme-suite.org .
********************************************************************************


********************************************************************************
REFERENCE
********************************************************************************
If you use this program in your research, please cite:

Timothy L. Bailey and Charles Elkan,
"Fitting a mixture model by expectation maximization to discover
motifs in biopolymers", Proceedings of the Second International
Conference on Intelligent Systems for Molecular Biology, pp. 28-36,
AAAI Press, Menlo Park, California, 1994.
********************************************************************************


********************************************************************************
TRAINING SET
********************************************************************************
DATAFILE= NrdR_Various_betaproteobacteria.fasta
ALPHABET= ACGT
Sequence name            Weight Length  Sequence name            Weight Length  
-------------            ------ ------  -------------            ------ ------  
ebA4850(nrdJa)Score=4.8, 1.0000     16  Tmz1t_1360(nrdJa)Score=4 1.0000     16  
Daro_0964(nrdJa)Score=4. 1.0000     16  NE2423(nrdA)Score=5.7,Po 1.0000     16  
Nmul_A2468(nrdA)Score=4. 1.0000     16  Tbd_1976(nrdA)Score=4.6, 1.0000     16  
CV2287(nrdA)Score=5.2,Po 1.0000     16  CV2287(nrdA)Score=4.5,Po 1.0000     16  
CV1446(nrdJa)Score=4.6,P 1.0000     16  CV1446(nrdJa)Score=5.3,P 1.0000     16  
CV2412(nrdD)Score=4.5,Po 1.0000     16  NMB1291(nrdA)Score=4.1,P 1.0000     16  
LHK_01803(nrdA)Score=5.5 1.0000     16  LHK_01596(nrdJa)Score=5. 1.0000     16  
LHK_02258(nrdD)Score=5.6 1.0000     16  Mfla_2541(nrdJa)Score=5. 1.0000     16  
Mfla_1223,Score=5.3,Pos= 1.0000     16  Mmol_1920(nrdA)Score=4.9 1.0000     16  
Mmol_0049(nrdJa)Score=5. 1.0000     16  MB2181_01310(nrdJa)Score 1.0000     16  
********************************************************************************

********************************************************************************
COMMAND LINE SUMMARY
********************************************************************************
This information can also be useful in the event you wish to report a
problem with the MEME software.

command: meme -dna NrdR_Various_betaproteobacteria.fasta -oc NrdR_Various_betaproteobacteria 

model:  mod=         zoops    nmotifs=         1    evt=           inf
object function=  E-value of product of p-values
width:  minw=            8    maxw=           16
width:  wg=             11    ws=              1    endgaps=       yes
nsites: minsites=        2    maxsites=       20    wnsites=       0.8
theta:  spmap=         uni    spfuzz=        0.5
global: substring=     yes    branching=      no    wbranch=        no
em:     prior=   dirichlet    b=            0.01    maxiter=        50
        distance=    1e-05
data:   n=             320    N=              20    shuffle=        -1
strands: +
sample: seed=            0    ctfrac=         -1    maxwords=       -1
Letter frequencies in dataset:
A 0.338 C 0.184 G 0.153 T 0.325 
Background letter frequencies (from dataset with add-one prior applied):
A 0.336 C 0.185 G 0.154 T 0.324 
********************************************************************************


********************************************************************************
MOTIF  1 MEME	width =  15  sites =  20  llr = 245  E-value = 6.3e-071
********************************************************************************
--------------------------------------------------------------------------------
	Motif 1 Description
--------------------------------------------------------------------------------
Simplified        A  29:7a:a16:5:121
pos.-specific     C  61a:15::3:::113
probability       G  :11::1::2::a:83
matrix            T  31:3:5:a:a6:915

         bits    2.7            *   
                 2.4            *   
                 2.2   *        *   
                 1.9   *        *   
Relative         1.6   *   *  * *   
Entropy          1.3   * * ** * * * 
(17.6 bits)      1.1   * * ** * *** 
                 0.8  ******* * *** 
                 0.5 ************** 
                 0.3 ***************
                 0.0 ---------------

Multilevel           CACAATATATTGTGT
consensus            T  T C  C A   C
sequence             A             G
                                    
--------------------------------------------------------------------------------

--------------------------------------------------------------------------------
	Motif 1 sites sorted by position p-value
--------------------------------------------------------------------------------
Sequence name             Start   P-value                 Site    
-------------             ----- ---------            ---------------
MB2181_01310(nrdJa)Score      2  1.69e-09          T CACAACATATTGTGG           
LHK_02258(nrdD)Score=5.6      2  5.25e-09          A CACAACATCTTGTGT           
LHK_01803(nrdA)Score=5.5      2  7.29e-09          A CACAACATCTTGTGC           
NE2423(nrdA)Score=5.7,Po      2  2.56e-08          A CACAATATATTGTGT           
Mmol_0049(nrdJa)Score=5.      2  3.33e-08          A CACAATATATAGTGG           
Mfla_2541(nrdJa)Score=5.      2  1.43e-07          T CACTATATGTTGTGG           
CV2287(nrdA)Score=5.2,Po      2  1.43e-07          C TACAACATCTAGTGC           
LHK_01596(nrdJa)Score=5.      2  1.75e-07          A AACAACATCTAGTGT           
CV1446(nrdJa)Score=5.3,P      2  1.75e-07          T AACAACATATAGTGT           
Mfla_1223,Score=5.3,Pos=      2  3.24e-07          G AACAATATATAGTGT           
Tmz1t_1360(nrdJa)Score=4      2  6.68e-07          C TACTACATGTAGTGC           
Daro_0964(nrdJa)Score=4.      2  1.44e-06          G CACTATATCTAGTAG           
Mmol_1920(nrdA)Score=4.9      2  3.41e-06          T ATCAATATATTGTGT           
Tbd_1976(nrdA)Score=4.6,      2  3.41e-06          C CACAAGATGTTGTGA           
ebA4850(nrdJa)Score=4.8,      2  3.69e-06          C TACTACATATAGTAC           
Nmul_A2468(nrdA)Score=4.      2  4.69e-06          C TACTATATATAGTAG           
CV1446(nrdJa)Score=4.6,P      2  5.39e-06          A CACAACAACTTGCGT           
CV2287(nrdA)Score=4.5,Po      2  9.25e-06          A CGGTATATATTGTGT           
CV2412(nrdD)Score=4.5,Po      2  1.38e-05          G CACAATATATTGATC           
NMB1291(nrdA)Score=4.1,P      2  4.79e-05          A TCCACTATATTGTCT           
--------------------------------------------------------------------------------

--------------------------------------------------------------------------------
	Motif 1 block diagrams
--------------------------------------------------------------------------------
SEQUENCE NAME            POSITION P-VALUE  MOTIF DIAGRAM
-------------            ----------------  -------------
MB2181_01310(nrdJa)Score          1.7e-09  1_[+1]
LHK_02258(nrdD)Score=5.6          5.3e-09  1_[+1]
LHK_01803(nrdA)Score=5.5          7.3e-09  1_[+1]
NE2423(nrdA)Score=5.7,Po          2.6e-08  1_[+1]
Mmol_0049(nrdJa)Score=5.          3.3e-08  1_[+1]
Mfla_2541(nrdJa)Score=5.          1.4e-07  1_[+1]
CV2287(nrdA)Score=5.2,Po          1.4e-07  1_[+1]
LHK_01596(nrdJa)Score=5.          1.8e-07  1_[+1]
CV1446(nrdJa)Score=5.3,P          1.8e-07  1_[+1]
Mfla_1223,Score=5.3,Pos=          3.2e-07  1_[+1]
Tmz1t_1360(nrdJa)Score=4          6.7e-07  1_[+1]
Daro_0964(nrdJa)Score=4.          1.4e-06  1_[+1]
Mmol_1920(nrdA)Score=4.9          3.4e-06  1_[+1]
Tbd_1976(nrdA)Score=4.6,          3.4e-06  1_[+1]
ebA4850(nrdJa)Score=4.8,          3.7e-06  1_[+1]
Nmul_A2468(nrdA)Score=4.          4.7e-06  1_[+1]
CV1446(nrdJa)Score=4.6,P          5.4e-06  1_[+1]
CV2287(nrdA)Score=4.5,Po          9.3e-06  1_[+1]
CV2412(nrdD)Score=4.5,Po          1.4e-05  1_[+1]
NMB1291(nrdA)Score=4.1,P          4.8e-05  1_[+1]
--------------------------------------------------------------------------------

--------------------------------------------------------------------------------
	Motif 1 in BLOCKS format
--------------------------------------------------------------------------------
BL   MOTIF 1 width=15 seqs=20
MB2181_01310(nrdJa)Score (    2) CACAACATATTGTGG  1 
LHK_02258(nrdD)Score=5.6 (    2) CACAACATCTTGTGT  1 
LHK_01803(nrdA)Score=5.5 (    2) CACAACATCTTGTGC  1 
NE2423(nrdA)Score=5.7,Po (    2) CACAATATATTGTGT  1 
Mmol_0049(nrdJa)Score=5. (    2) CACAATATATAGTGG  1 
Mfla_2541(nrdJa)Score=5. (    2) CACTATATGTTGTGG  1 
CV2287(nrdA)Score=5.2,Po (    2) TACAACATCTAGTGC  1 
LHK_01596(nrdJa)Score=5. (    2) AACAACATCTAGTGT  1 
CV1446(nrdJa)Score=5.3,P (    2) AACAACATATAGTGT  1 
Mfla_1223,Score=5.3,Pos= (    2) AACAATATATAGTGT  1 
Tmz1t_1360(nrdJa)Score=4 (    2) TACTACATGTAGTGC  1 
Daro_0964(nrdJa)Score=4. (    2) CACTATATCTAGTAG  1 
Mmol_1920(nrdA)Score=4.9 (    2) ATCAATATATTGTGT  1 
Tbd_1976(nrdA)Score=4.6, (    2) CACAAGATGTTGTGA  1 
ebA4850(nrdJa)Score=4.8, (    2) TACTACATATAGTAC  1 
Nmul_A2468(nrdA)Score=4. (    2) TACTATATATAGTAG  1 
CV1446(nrdJa)Score=4.6,P (    2) CACAACAACTTGCGT  1 
CV2287(nrdA)Score=4.5,Po (    2) CGGTATATATTGTGT  1 
CV2412(nrdD)Score=4.5,Po (    2) CACAATATATTGATC  1 
NMB1291(nrdA)Score=4.1,P (    2) TCCACTATATTGTCT  1 
//

--------------------------------------------------------------------------------

--------------------------------------------------------------------------------
	Motif 1 position-specific scoring matrix
--------------------------------------------------------------------------------
log-odds matrix: alength= 4 w= 15 n= 40 bayes= 0.465664 E= 6.3e-071 
   -75    157  -1097    -37 
   134   -189   -162   -269 
 -1097    236   -162  -1097 
   106  -1097  -1097    -11 
   150   -189  -1097  -1097 
 -1097    128   -162     63 
   157  -1097  -1097  -1097 
  -275  -1097  -1097    155 
    71     70     -4  -1097 
 -1097  -1097  -1097    163 
    42  -1097  -1097     76 
 -1097  -1097    270  -1097 
  -275   -189  -1097    147 
  -116   -189    228   -269 
  -275     43     70     47 
--------------------------------------------------------------------------------

--------------------------------------------------------------------------------
	Motif 1 position-specific probability matrix
--------------------------------------------------------------------------------
letter-probability matrix: alength= 4 w= 15 nsites= 20 E= 6.3e-071 
 0.200000  0.550000  0.000000  0.250000 
 0.850000  0.050000  0.050000  0.050000 
 0.000000  0.950000  0.050000  0.000000 
 0.700000  0.000000  0.000000  0.300000 
 0.950000  0.050000  0.000000  0.000000 
 0.000000  0.450000  0.050000  0.500000 
 1.000000  0.000000  0.000000  0.000000 
 0.050000  0.000000  0.000000  0.950000 
 0.550000  0.300000  0.150000  0.000000 
 0.000000  0.000000  0.000000  1.000000 
 0.450000  0.000000  0.000000  0.550000 
 0.000000  0.000000  1.000000  0.000000 
 0.050000  0.050000  0.000000  0.900000 
 0.150000  0.050000  0.750000  0.050000 
 0.050000  0.250000  0.250000  0.450000 
--------------------------------------------------------------------------------

--------------------------------------------------------------------------------
	Motif 1 regular expression
--------------------------------------------------------------------------------
[CTA]AC[AT]A[TC]AT[AC]T[TA]GTG[TCG]
--------------------------------------------------------------------------------




Time  0.03 secs.

********************************************************************************


********************************************************************************
SUMMARY OF MOTIFS
********************************************************************************

--------------------------------------------------------------------------------
	Combined block diagrams: non-overlapping sites with p-value < 0.0001
--------------------------------------------------------------------------------
SEQUENCE NAME            COMBINED P-VALUE  MOTIF DIAGRAM
-------------            ----------------  -------------
ebA4850(nrdJa)Score=4.8,         7.38e-06  1_[+1(3.69e-06)]
Tmz1t_1360(nrdJa)Score=4         1.34e-06  1_[+1(6.68e-07)]
Daro_0964(nrdJa)Score=4.         2.87e-06  1_[+1(1.44e-06)]
NE2423(nrdA)Score=5.7,Po         5.12e-08  1_[+1(2.56e-08)]
Nmul_A2468(nrdA)Score=4.         9.38e-06  1_[+1(4.69e-06)]
Tbd_1976(nrdA)Score=4.6,         6.83e-06  1_[+1(3.41e-06)]
CV2287(nrdA)Score=5.2,Po         2.85e-07  1_[+1(1.43e-07)]
CV2287(nrdA)Score=4.5,Po         1.85e-05  1_[+1(9.25e-06)]
CV1446(nrdJa)Score=4.6,P         1.08e-05  1_[+1(5.39e-06)]
CV1446(nrdJa)Score=5.3,P         3.51e-07  1_[+1(1.75e-07)]
CV2412(nrdD)Score=4.5,Po         2.75e-05  1_[+1(1.38e-05)]
NMB1291(nrdA)Score=4.1,P         9.58e-05  1_[+1(4.79e-05)]
LHK_01803(nrdA)Score=5.5         1.46e-08  1_[+1(7.29e-09)]
LHK_01596(nrdJa)Score=5.         3.51e-07  1_[+1(1.75e-07)]
LHK_02258(nrdD)Score=5.6         1.05e-08  1_[+1(5.25e-09)]
Mfla_2541(nrdJa)Score=5.         2.85e-07  1_[+1(1.43e-07)]
Mfla_1223,Score=5.3,Pos=         6.47e-07  1_[+1(3.24e-07)]
Mmol_1920(nrdA)Score=4.9         6.83e-06  1_[+1(3.41e-06)]
Mmol_0049(nrdJa)Score=5.         6.67e-08  1_[+1(3.33e-08)]
MB2181_01310(nrdJa)Score         3.38e-09  1_[+1(1.69e-09)]
--------------------------------------------------------------------------------

********************************************************************************


********************************************************************************
Stopped because requested number of motifs (1) found.
********************************************************************************

CPU: leftraru1

********************************************************************************
