********************************************************************************
MEME - Motif discovery tool
********************************************************************************
MEME version 4.11.2 (Release date: Thu May 05 14:58:55 2016 -0700)

For further information on how to interpret these results or to get
a copy of the MEME software please access http://meme-suite.org .

This file may be used as input to the MAST algorithm for searching
sequence databases for matches to groups of motifs.  MAST is available
for interactive use and downloading at http://meme-suite.org .
********************************************************************************


********************************************************************************
REFERENCE
********************************************************************************
If you use this program in your research, please cite:

Timothy L. Bailey and Charles Elkan,
"Fitting a mixture model by expectation maximization to discover
motifs in biopolymers", Proceedings of the Second International
Conference on Intelligent Systems for Molecular Biology, pp. 28-36,
AAAI Press, Menlo Park, California, 1994.
********************************************************************************


********************************************************************************
TRAINING SET
********************************************************************************
DATAFILE= NtrC_Various_betaproteobacteria.fasta
ALPHABET= ACGT
Sequence name            Weight Length  Sequence name            Weight Length  
-------------            ------ ------  -------------            ------ ------  
ebA4116(ntrC)Score=5.3,P 1.0000     17  ebA3154(CHP02001)Score=5 1.0000     17  
ebA4121(glnA)Score=5.5,P 1.0000     17  ebA4609(amtB2)Score=5.2, 1.0000     17  
ebA2252(gltB)Score=5.2,P 1.0000     17  Tmz1t_0595(CHP02001)Scor 1.0000     17  
Tmz1t_3651(ntrC)Score=5. 1.0000     17  Tmz1t_3648(glnA)Score=5. 1.0000     17  
Tmz1t_3648(glnA)Score=5. 1.0000     17  Tmz1t_0457(amtB2)Score=4 1.0000     17  
Tmz1t_0457(amtB2)Score=4 1.0000     17  Tmz1t_0842(gltB)Score=5. 1.0000     17  
Tmz1t_1142(nasD)Score=4. 1.0000     17  Tmz1t_1142(nasD)Score=4. 1.0000     17  
Daro_3763(glnA)Score=5.7 1.0000     17  Daro_0052(CHP02001)Score 1.0000     17  
Daro_3763(glnA)Score=5Po 1.0000     17  Daro_3703(amtB2)Score=4. 1.0000     17  
Daro_3703(amtB2)Score=4. 1.0000     17  Daro_0816(nasD)Score=5.3 1.0000     17  
Daro_3759(ntrB)Score=5.6 1.0000     17  Tbd_2503(glnA)Score=4.3, 1.0000     17  
Tbd_2503(glnA)Score=5,Po 1.0000     17  Tbd_1701(amtB2)Score=4.3 1.0000     17  
Tbd_2310(nasA)Score=4.4P 1.0000     17  CV3591(ntrB)Score=6,Pos= 1.0000     17  
CV4002(glnK)Score=5.2,Po 1.0000     17  CV3589(glnA)Score=5.2,Po 1.0000     17  
CV3589(glnA)Score=4.7,Po 1.0000     17  LHK_01876(glnA)Score=5.4 1.0000     17  
LHK_01876(glnA)Score=5.1 1.0000     17  Mfla_0433(glnK)Score=5.3 1.0000     17  
Mfla_2447(glnA)Score=5.6 1.0000     17  Mfla_2447(glnA)Score=4.9 1.0000     17  
Mfla_0433(glnK)Score=5.1 1.0000     17  Mmol_2138(glnA)Score=5,P 1.0000     17  
Mmol_2140(ntrB)Score=5.7 1.0000     17  Mmol_2140(ntrB)Score=4.9 1.0000     17  
Mmol_2138(glnA)Score=5.3 1.0000     17  Mmol_2289(CHP02001)Score 1.0000     17  
Mmol_1494(amtB2)Score=5. 1.0000     17  Mmol_1494(amtB2)Score=5. 1.0000     17  
Mmol_1652(nasD)Score=4.3 1.0000     17  MB2181_01245(CHP02001)Sc 1.0000     17  
MB2181_03520(amtB2)Score 1.0000     17  MB2181_01610(glnA)Score= 1.0000     17  
MB2181_01610(glnA)Score= 1.0000     17  
********************************************************************************

********************************************************************************
COMMAND LINE SUMMARY
********************************************************************************
This information can also be useful in the event you wish to report a
problem with the MEME software.

command: meme -dna NtrC_Various_betaproteobacteria.fasta -oc NtrC_Various_betaproteobacteria 

model:  mod=         zoops    nmotifs=         1    evt=           inf
object function=  E-value of product of p-values
width:  minw=            8    maxw=           17
width:  wg=             11    ws=              1    endgaps=       yes
nsites: minsites=        2    maxsites=       47    wnsites=       0.8
theta:  spmap=         uni    spfuzz=        0.5
global: substring=     yes    branching=      no    wbranch=        no
em:     prior=   dirichlet    b=            0.01    maxiter=        50
        distance=    1e-05
data:   n=             799    N=              47    shuffle=        -1
strands: +
sample: seed=            0    ctfrac=         -1    maxwords=       -1
Letter frequencies in dataset:
A 0.254 C 0.255 G 0.265 T 0.225 
Background letter frequencies (from dataset with add-one prior applied):
A 0.254 C 0.255 G 0.265 T 0.225 
********************************************************************************


********************************************************************************
MOTIF  1 MEME	width =  17  sites =  47  llr = 610  E-value = 1.4e-223
********************************************************************************
--------------------------------------------------------------------------------
	Motif 1 Description
--------------------------------------------------------------------------------
Simplified        A  1::9:1746413::::7
pos.-specific     C  3:a196:1:12::::a:
probability       G  :a::::2112:6a:9:3
matrix            T  6::::3143371:9::1

         bits    2.1                  
                 1.9                  
                 1.7  ***        ** * 
                 1.5  ****       **** 
Relative         1.3  ****       **** 
Entropy          1.1  ****       **** 
(18.7 bits)      0.9  ****     * *****
                 0.6 ***** * * *******
                 0.4 ******* * *******
                 0.2 *****************
                 0.0 -----------------

Multilevel           TGCACCAAAATGGTGCA
consensus            C    T TTT A    G
sequence                      G       
                                      
--------------------------------------------------------------------------------

--------------------------------------------------------------------------------
	Motif 1 sites sorted by position p-value
--------------------------------------------------------------------------------
Sequence name             Start   P-value                  Site     
-------------             ----- ---------            -----------------
CV3591(ntrB)Score=6,Pos=      1  1.70e-10          . TGCACCAAAATGGTGCA           
Tmz1t_0842(gltB)Score=5.      1  2.84e-09          . TGCACCAGATTGGTGCA           
Mmol_2140(ntrB)Score=5.7      1  4.05e-09          . TGCACCTAAATGGTGCA           
Daro_3763(glnA)Score=5.7      1  7.53e-09          . TGCACCAAAATAGTGCG           
Tmz1t_3648(glnA)Score=5.      1  9.39e-09          . CGCACCATAGTAGTGCA           
Tmz1t_3651(ntrC)Score=5.      1  2.15e-08          . CGCACCAGAATAGTGCA           
MB2181_01610(glnA)Score=      1  2.50e-08          . TGCACTAAATTAGTGCG           
ebA4121(glnA)Score=5.5,P      1  2.80e-08          . TGCACCATGATGGTGCG           
Mfla_2447(glnA)Score=5.6      1  3.10e-08          . AGCACCAATATGGTGCA           
Daro_3759(ntrB)Score=5.6      1  4.01e-08          . TGCACCAATACGGTGCG           
Tmz1t_0595(CHP02001)Scor      1  4.01e-08          . CGCACCACATTGGTGCG           
ebA4116(ntrC)Score=5.3,P      1  5.87e-08          . CGCACCAAAAAAGTGCA           
ebA4609(amtB2)Score=5.2,      1  7.28e-08          . CGCACCGTAATTGTGCA           
Mmol_2138(glnA)Score=5.3      1  9.30e-08          . TGCACCAAAAATGTGCA           
CV3589(glnA)Score=5.2,Po      1  1.42e-07          . GGCACCATATCGGTGCA           
Mmol_1494(amtB2)Score=5.      1  1.58e-07          . TGCACAATGTTAGTGCA           
LHK_01876(glnA)Score=5.4      1  1.58e-07          . TTCACCATTTTGGTGCA           
Daro_0816(nasD)Score=5.3      1  1.97e-07          . TGCACGAATTTGGTGCG           
MB2181_03520(amtB2)Score      1  2.18e-07          . TGCACCAAAATAATGCA           
Mfla_0433(glnK)Score=5.1      1  2.18e-07          . TGCACATCATTGGTGCA           
Tmz1t_3648(glnA)Score=5.      1  2.18e-07          . CGCACCATTGAAGTGCA           
Mmol_1494(amtB2)Score=5.      1  2.40e-07          . TGCACATATTTAGTGCA           
ebA2252(gltB)Score=5.2,P      1  2.40e-07          . TGCACAGTTTTGGTGCG           
CV4002(glnK)Score=5.2,Po      1  2.64e-07          . TGCACCAAAACCGTGCA           
Mmol_2138(glnA)Score=5,P      1  3.21e-07          . TGCATTGTATTGGTGCA           
LHK_01876(glnA)Score=5.1      1  3.21e-07          . TGCACCATTGATGTGCA           
Mfla_0433(glnK)Score=5.3      1  3.56e-07          . TGAACTATTTTGGTGCA           
Daro_0052(CHP02001)Score      1  4.30e-07          . CGCACAGTTTTGGTGCG           
Daro_3703(amtB2)Score=4.      1  5.14e-07          . TGCACTGGAATGGTGCT           
ebA3154(CHP02001)Score=5      1  5.64e-07          . CGCACCGTTCCGGTGCA           
Mfla_2447(glnA)Score=4.9      1  6.21e-07          . CGCAATATAGTGGTGCA           
Daro_3703(amtB2)Score=4.      1  8.83e-07          . TGCACCAAACAGGTGCT           
MB2181_01245(CHP02001)Sc      1  9.61e-07          . TGCCCTGAAGTAGTGCA           
Mmol_2289(CHP02001)Score      1  9.61e-07          . CGCCCTTTAATAGTGCA           
Mmol_2140(ntrB)Score=4.9      1  1.15e-06          . AGCACTATTATGGTTCA           
Tbd_2503(glnA)Score=5,Po      1  1.25e-06          . TGCACCAAGACGGGGCA           
Tmz1t_1142(nasD)Score=4.      1  1.35e-06          . TGCACCGCAGCAGTGCG           
Daro_3763(glnA)Score=5Po      1  1.47e-06          . TGCACGATCGTGGTGCA           
CV3589(glnA)Score=4.7,Po      1  1.73e-06          . GGCACCAGAATGGTTCA           
Tmz1t_1142(nasD)Score=4.      1  2.77e-06          . CGCACCAGGGCTGTGCA           
Tmz1t_0457(amtB2)Score=4      1  2.77e-06          . CGCACTGGAACGGTGCT           
MB2181_01610(glnA)Score=      1  2.99e-06          . AGCATTTAATTGGTGCA           
Tbd_1701(amtB2)Score=4.3      1  4.03e-06          . CGCACTTCGGCGGTGCA           
Tbd_2503(glnA)Score=4.3,      1  7.61e-06          . CGCCCTATAATGGAGCG           
Tmz1t_0457(amtB2)Score=4      1  7.61e-06          . CGCACCCCTCTGGTGCG           
Mmol_1652(nasD)Score=4.3      1  8.15e-06          . TGCACCAAAGTAGTAAA           
Tbd_2310(nasA)Score=4.4P      1  1.21e-05          . CGCACCAATTTGCGGCG           
--------------------------------------------------------------------------------

--------------------------------------------------------------------------------
	Motif 1 block diagrams
--------------------------------------------------------------------------------
SEQUENCE NAME            POSITION P-VALUE  MOTIF DIAGRAM
-------------            ----------------  -------------
CV3591(ntrB)Score=6,Pos=          1.7e-10  [+1]
Tmz1t_0842(gltB)Score=5.          2.8e-09  [+1]
Mmol_2140(ntrB)Score=5.7          4.1e-09  [+1]
Daro_3763(glnA)Score=5.7          7.5e-09  [+1]
Tmz1t_3648(glnA)Score=5.          9.4e-09  [+1]
Tmz1t_3651(ntrC)Score=5.          2.1e-08  [+1]
MB2181_01610(glnA)Score=          2.5e-08  [+1]
ebA4121(glnA)Score=5.5,P          2.8e-08  [+1]
Mfla_2447(glnA)Score=5.6          3.1e-08  [+1]
Daro_3759(ntrB)Score=5.6            4e-08  [+1]
Tmz1t_0595(CHP02001)Scor            4e-08  [+1]
ebA4116(ntrC)Score=5.3,P          5.9e-08  [+1]
ebA4609(amtB2)Score=5.2,          7.3e-08  [+1]
Mmol_2138(glnA)Score=5.3          9.3e-08  [+1]
CV3589(glnA)Score=5.2,Po          1.4e-07  [+1]
Mmol_1494(amtB2)Score=5.          1.6e-07  [+1]
LHK_01876(glnA)Score=5.4          1.6e-07  [+1]
Daro_0816(nasD)Score=5.3            2e-07  [+1]
MB2181_03520(amtB2)Score          2.2e-07  [+1]
Mfla_0433(glnK)Score=5.1          2.2e-07  [+1]
Tmz1t_3648(glnA)Score=5.          2.2e-07  [+1]
Mmol_1494(amtB2)Score=5.          2.4e-07  [+1]
ebA2252(gltB)Score=5.2,P          2.4e-07  [+1]
CV4002(glnK)Score=5.2,Po          2.6e-07  [+1]
Mmol_2138(glnA)Score=5,P          3.2e-07  [+1]
LHK_01876(glnA)Score=5.1          3.2e-07  [+1]
Mfla_0433(glnK)Score=5.3          3.6e-07  [+1]
Daro_0052(CHP02001)Score          4.3e-07  [+1]
Daro_3703(amtB2)Score=4.          5.1e-07  [+1]
ebA3154(CHP02001)Score=5          5.6e-07  [+1]
Mfla_2447(glnA)Score=4.9          6.2e-07  [+1]
Daro_3703(amtB2)Score=4.          8.8e-07  [+1]
MB2181_01245(CHP02001)Sc          9.6e-07  [+1]
Mmol_2289(CHP02001)Score          9.6e-07  [+1]
Mmol_2140(ntrB)Score=4.9          1.1e-06  [+1]
Tbd_2503(glnA)Score=5,Po          1.2e-06  [+1]
Tmz1t_1142(nasD)Score=4.          1.4e-06  [+1]
Daro_3763(glnA)Score=5Po          1.5e-06  [+1]
CV3589(glnA)Score=4.7,Po          1.7e-06  [+1]
Tmz1t_1142(nasD)Score=4.          2.8e-06  [+1]
Tmz1t_0457(amtB2)Score=4          2.8e-06  [+1]
MB2181_01610(glnA)Score=            3e-06  [+1]
Tbd_1701(amtB2)Score=4.3            4e-06  [+1]
Tbd_2503(glnA)Score=4.3,          7.6e-06  [+1]
Tmz1t_0457(amtB2)Score=4          7.6e-06  [+1]
Mmol_1652(nasD)Score=4.3          8.2e-06  [+1]
Tbd_2310(nasA)Score=4.4P          1.2e-05  [+1]
--------------------------------------------------------------------------------

--------------------------------------------------------------------------------
	Motif 1 in BLOCKS format
--------------------------------------------------------------------------------
BL   MOTIF 1 width=17 seqs=47
CV3591(ntrB)Score=6,Pos= (    1) TGCACCAAAATGGTGCA  1 
Tmz1t_0842(gltB)Score=5. (    1) TGCACCAGATTGGTGCA  1 
Mmol_2140(ntrB)Score=5.7 (    1) TGCACCTAAATGGTGCA  1 
Daro_3763(glnA)Score=5.7 (    1) TGCACCAAAATAGTGCG  1 
Tmz1t_3648(glnA)Score=5. (    1) CGCACCATAGTAGTGCA  1 
Tmz1t_3651(ntrC)Score=5. (    1) CGCACCAGAATAGTGCA  1 
MB2181_01610(glnA)Score= (    1) TGCACTAAATTAGTGCG  1 
ebA4121(glnA)Score=5.5,P (    1) TGCACCATGATGGTGCG  1 
Mfla_2447(glnA)Score=5.6 (    1) AGCACCAATATGGTGCA  1 
Daro_3759(ntrB)Score=5.6 (    1) TGCACCAATACGGTGCG  1 
Tmz1t_0595(CHP02001)Scor (    1) CGCACCACATTGGTGCG  1 
ebA4116(ntrC)Score=5.3,P (    1) CGCACCAAAAAAGTGCA  1 
ebA4609(amtB2)Score=5.2, (    1) CGCACCGTAATTGTGCA  1 
Mmol_2138(glnA)Score=5.3 (    1) TGCACCAAAAATGTGCA  1 
CV3589(glnA)Score=5.2,Po (    1) GGCACCATATCGGTGCA  1 
Mmol_1494(amtB2)Score=5. (    1) TGCACAATGTTAGTGCA  1 
LHK_01876(glnA)Score=5.4 (    1) TTCACCATTTTGGTGCA  1 
Daro_0816(nasD)Score=5.3 (    1) TGCACGAATTTGGTGCG  1 
MB2181_03520(amtB2)Score (    1) TGCACCAAAATAATGCA  1 
Mfla_0433(glnK)Score=5.1 (    1) TGCACATCATTGGTGCA  1 
Tmz1t_3648(glnA)Score=5. (    1) CGCACCATTGAAGTGCA  1 
Mmol_1494(amtB2)Score=5. (    1) TGCACATATTTAGTGCA  1 
ebA2252(gltB)Score=5.2,P (    1) TGCACAGTTTTGGTGCG  1 
CV4002(glnK)Score=5.2,Po (    1) TGCACCAAAACCGTGCA  1 
Mmol_2138(glnA)Score=5,P (    1) TGCATTGTATTGGTGCA  1 
LHK_01876(glnA)Score=5.1 (    1) TGCACCATTGATGTGCA  1 
Mfla_0433(glnK)Score=5.3 (    1) TGAACTATTTTGGTGCA  1 
Daro_0052(CHP02001)Score (    1) CGCACAGTTTTGGTGCG  1 
Daro_3703(amtB2)Score=4. (    1) TGCACTGGAATGGTGCT  1 
ebA3154(CHP02001)Score=5 (    1) CGCACCGTTCCGGTGCA  1 
Mfla_2447(glnA)Score=4.9 (    1) CGCAATATAGTGGTGCA  1 
Daro_3703(amtB2)Score=4. (    1) TGCACCAAACAGGTGCT  1 
MB2181_01245(CHP02001)Sc (    1) TGCCCTGAAGTAGTGCA  1 
Mmol_2289(CHP02001)Score (    1) CGCCCTTTAATAGTGCA  1 
Mmol_2140(ntrB)Score=4.9 (    1) AGCACTATTATGGTTCA  1 
Tbd_2503(glnA)Score=5,Po (    1) TGCACCAAGACGGGGCA  1 
Tmz1t_1142(nasD)Score=4. (    1) TGCACCGCAGCAGTGCG  1 
Daro_3763(glnA)Score=5Po (    1) TGCACGATCGTGGTGCA  1 
CV3589(glnA)Score=4.7,Po (    1) GGCACCAGAATGGTTCA  1 
Tmz1t_1142(nasD)Score=4. (    1) CGCACCAGGGCTGTGCA  1 
Tmz1t_0457(amtB2)Score=4 (    1) CGCACTGGAACGGTGCT  1 
MB2181_01610(glnA)Score= (    1) AGCATTTAATTGGTGCA  1 
Tbd_1701(amtB2)Score=4.3 (    1) CGCACTTCGGCGGTGCA  1 
Tbd_2503(glnA)Score=4.3, (    1) CGCCCTATAATGGAGCG  1 
Tmz1t_0457(amtB2)Score=4 (    1) CGCACCCCTCTGGTGCG  1 
Mmol_1652(nasD)Score=4.3 (    1) TGCACCAAAGTAGTAAA  1 
Tbd_2310(nasA)Score=4.4P (    1) CGCACCAATTTGCGGCG  1 
//

--------------------------------------------------------------------------------

--------------------------------------------------------------------------------
	Motif 1 position-specific scoring matrix
--------------------------------------------------------------------------------
log-odds matrix: alength= 4 w= 17 n= 47 bayes= 1.71049 E= 1.4e-223 
  -199     42   -264    130 
 -1220  -1220    188   -340 
  -357    194  -1220  -1220 
   188   -200  -1220  -1220 
  -357    187  -1220   -240 
  -126    122   -264     18 
   138   -358    -47    -82 
    59   -126   -105     76 
   118   -358   -132     40 
    67   -200    -32     50 
  -126    -41  -1220    164 
    12   -358    122   -140 
  -357   -358    185  -1220 
  -357  -1220   -264    205 
  -357  -1220    182   -240 
  -357    194  -1220  -1220 
   142  -1220     -6   -182 
--------------------------------------------------------------------------------

--------------------------------------------------------------------------------
	Motif 1 position-specific probability matrix
--------------------------------------------------------------------------------
letter-probability matrix: alength= 4 w= 17 nsites= 47 E= 1.4e-223 
 0.063830  0.340426  0.042553  0.553191 
 0.000000  0.000000  0.978723  0.021277 
 0.021277  0.978723  0.000000  0.000000 
 0.936170  0.063830  0.000000  0.000000 
 0.021277  0.936170  0.000000  0.042553 
 0.106383  0.595745  0.042553  0.255319 
 0.659574  0.021277  0.191489  0.127660 
 0.382979  0.106383  0.127660  0.382979 
 0.574468  0.021277  0.106383  0.297872 
 0.404255  0.063830  0.212766  0.319149 
 0.106383  0.191489  0.000000  0.702128 
 0.276596  0.021277  0.617021  0.085106 
 0.021277  0.021277  0.957447  0.000000 
 0.021277  0.000000  0.042553  0.936170 
 0.021277  0.000000  0.936170  0.042553 
 0.021277  0.978723  0.000000  0.000000 
 0.680851  0.000000  0.255319  0.063830 
--------------------------------------------------------------------------------

--------------------------------------------------------------------------------
	Motif 1 regular expression
--------------------------------------------------------------------------------
[TC]GCAC[CT]A[AT][AT][ATG]T[GA]GTGC[AG]
--------------------------------------------------------------------------------




Time  0.09 secs.

********************************************************************************


********************************************************************************
SUMMARY OF MOTIFS
********************************************************************************

--------------------------------------------------------------------------------
	Combined block diagrams: non-overlapping sites with p-value < 0.0001
--------------------------------------------------------------------------------
SEQUENCE NAME            COMBINED P-VALUE  MOTIF DIAGRAM
-------------            ----------------  -------------
ebA4116(ntrC)Score=5.3,P         5.87e-08  [+1(5.87e-08)]
ebA3154(CHP02001)Score=5         5.64e-07  [+1(5.64e-07)]
ebA4121(glnA)Score=5.5,P         2.80e-08  [+1(2.80e-08)]
ebA4609(amtB2)Score=5.2,         7.28e-08  [+1(7.28e-08)]
ebA2252(gltB)Score=5.2,P         2.40e-07  [+1(2.40e-07)]
Tmz1t_0595(CHP02001)Scor         4.01e-08  [+1(4.01e-08)]
Tmz1t_3651(ntrC)Score=5.         2.15e-08  [+1(2.15e-08)]
Tmz1t_3648(glnA)Score=5.         2.18e-07  [+1(2.18e-07)]
Tmz1t_3648(glnA)Score=5.         9.39e-09  [+1(9.39e-09)]
Tmz1t_0457(amtB2)Score=4         7.61e-06  [+1(7.61e-06)]
Tmz1t_0457(amtB2)Score=4         2.77e-06  [+1(2.77e-06)]
Tmz1t_0842(gltB)Score=5.         2.84e-09  [+1(2.84e-09)]
Tmz1t_1142(nasD)Score=4.         2.77e-06  [+1(2.77e-06)]
Tmz1t_1142(nasD)Score=4.         1.35e-06  [+1(1.35e-06)]
Daro_3763(glnA)Score=5.7         7.53e-09  [+1(7.53e-09)]
Daro_0052(CHP02001)Score         4.30e-07  [+1(4.30e-07)]
Daro_3763(glnA)Score=5Po         1.47e-06  [+1(1.47e-06)]
Daro_3703(amtB2)Score=4.         8.83e-07  [+1(8.83e-07)]
Daro_3703(amtB2)Score=4.         5.14e-07  [+1(5.14e-07)]
Daro_0816(nasD)Score=5.3         1.97e-07  [+1(1.97e-07)]
Daro_3759(ntrB)Score=5.6         4.01e-08  [+1(4.01e-08)]
Tbd_2503(glnA)Score=4.3,         7.61e-06  [+1(7.61e-06)]
Tbd_2503(glnA)Score=5,Po         1.25e-06  [+1(1.25e-06)]
Tbd_1701(amtB2)Score=4.3         4.03e-06  [+1(4.03e-06)]
Tbd_2310(nasA)Score=4.4P         1.21e-05  [+1(1.21e-05)]
CV3591(ntrB)Score=6,Pos=         1.70e-10  [+1(1.70e-10)]
CV4002(glnK)Score=5.2,Po         2.64e-07  [+1(2.64e-07)]
CV3589(glnA)Score=5.2,Po         1.42e-07  [+1(1.42e-07)]
CV3589(glnA)Score=4.7,Po         1.73e-06  [+1(1.73e-06)]
LHK_01876(glnA)Score=5.4         1.58e-07  [+1(1.58e-07)]
LHK_01876(glnA)Score=5.1         3.21e-07  [+1(3.21e-07)]
Mfla_0433(glnK)Score=5.3         3.56e-07  [+1(3.56e-07)]
Mfla_2447(glnA)Score=5.6         3.10e-08  [+1(3.10e-08)]
Mfla_2447(glnA)Score=4.9         6.21e-07  [+1(6.21e-07)]
Mfla_0433(glnK)Score=5.1         2.18e-07  [+1(2.18e-07)]
Mmol_2138(glnA)Score=5,P         3.21e-07  [+1(3.21e-07)]
Mmol_2140(ntrB)Score=5.7         4.05e-09  [+1(4.05e-09)]
Mmol_2140(ntrB)Score=4.9         1.15e-06  [+1(1.15e-06)]
Mmol_2138(glnA)Score=5.3         9.30e-08  [+1(9.30e-08)]
Mmol_2289(CHP02001)Score         9.61e-07  [+1(9.61e-07)]
Mmol_1494(amtB2)Score=5.         2.40e-07  [+1(2.40e-07)]
Mmol_1494(amtB2)Score=5.         1.58e-07  [+1(1.58e-07)]
Mmol_1652(nasD)Score=4.3         8.15e-06  [+1(8.15e-06)]
MB2181_01245(CHP02001)Sc         9.61e-07  [+1(9.61e-07)]
MB2181_03520(amtB2)Score         2.18e-07  [+1(2.18e-07)]
MB2181_01610(glnA)Score=         2.50e-08  [+1(2.50e-08)]
MB2181_01610(glnA)Score=         2.99e-06  [+1(2.99e-06)]
--------------------------------------------------------------------------------

********************************************************************************


********************************************************************************
Stopped because requested number of motifs (1) found.
********************************************************************************

CPU: leftraru1

********************************************************************************
