********************************************************************************
MEME - Motif discovery tool
********************************************************************************
MEME version 4.11.2 (Release date: Thu May 05 14:58:55 2016 -0700)

For further information on how to interpret these results or to get
a copy of the MEME software please access http://meme-suite.org .

This file may be used as input to the MAST algorithm for searching
sequence databases for matches to groups of motifs.  MAST is available
for interactive use and downloading at http://meme-suite.org .
********************************************************************************


********************************************************************************
REFERENCE
********************************************************************************
If you use this program in your research, please cite:

Timothy L. Bailey and Charles Elkan,
"Fitting a mixture model by expectation maximization to discover
motifs in biopolymers", Proceedings of the Second International
Conference on Intelligent Systems for Molecular Biology, pp. 28-36,
AAAI Press, Menlo Park, California, 1994.
********************************************************************************


********************************************************************************
TRAINING SET
********************************************************************************
DATAFILE= PdxR_Clostridia-3.fasta
ALPHABET= ACGT
Sequence name            Weight Length  Sequence name            Weight Length  
-------------            ------ ------  -------------            ------ ------  
BACPEC_01644(pdxU)Score= 1.0000     54  BLAHAN_01809(pdxU)Score= 1.0000     54  
BRYFOR_03586(pdxU)Score= 1.0000     54  Cbac1_010100020035(pdxU) 1.0000     54  
Cbac1_010100001365(pdxU) 1.0000     54  CLOBOL_05306(pdxU)Score= 1.0000     54  
CLOBOL_04694(pdxU)Score= 1.0000     54  CLONEX_02290(pdxU)Score= 1.0000     54  
CLOSCI_00017(pdxK)Score= 1.0000     54  CLOSCI_02639(pdxU)Score= 1.0000     54  
DORFOR_02364(pdxS)Score= 1.0000     54  DORLON_00259(pdxS)Score= 1.0000     54  
DORLON_00405(pdxU)Score= 1.0000     54  DORLON_01651(pdxU)Score= 1.0000     54  
EUBELI_20439(pdxS)Score= 1.0000     54  EUBREC_0262(pdxU)Score=1 1.0000     54  
ROSINTL182_03667,Score=1 1.0000     54  RUMGNA_01775(pdxS)Score= 1.0000     54  
RUMGNA_02238(pdxU)Score= 1.0000     54  RUMLAC_01874(pdxS)Score= 1.0000     54  
RUMLAC_01106(pdxU)Score= 1.0000     54  
********************************************************************************

********************************************************************************
COMMAND LINE SUMMARY
********************************************************************************
This information can also be useful in the event you wish to report a
problem with the MEME software.

command: meme -dna PdxR_Clostridia-3.fasta -oc PdxR_Clostridia-3 

model:  mod=         zoops    nmotifs=         1    evt=           inf
object function=  E-value of product of p-values
width:  minw=            8    maxw=           50
width:  wg=             11    ws=              1    endgaps=       yes
nsites: minsites=        2    maxsites=       21    wnsites=       0.8
theta:  spmap=         uni    spfuzz=        0.5
global: substring=     yes    branching=      no    wbranch=        no
em:     prior=   dirichlet    b=            0.01    maxiter=        50
        distance=    1e-05
data:   n=            1134    N=              21    shuffle=        -1
strands: +
sample: seed=            0    ctfrac=         -1    maxwords=       -1
Letter frequencies in dataset:
A 0.285 C 0.239 G 0.218 T 0.259 
Background letter frequencies (from dataset with add-one prior applied):
A 0.284 C 0.239 G 0.218 T 0.259 
********************************************************************************


********************************************************************************
MOTIF  1 MEME	width =  50  sites =  21  llr = 441  E-value = 2.1e-103
********************************************************************************
--------------------------------------------------------------------------------
	Motif 1 Description
--------------------------------------------------------------------------------
Simplified        A  8:::153:33333333333333333aa:::17163333333333542::a
pos.-specific     C  :a:::46:22222222222222222::8:::22:22222222221::9a:
probability       G  :::a9:::22222222222222222::::a9::22222222222:23:::
matrix            T  2:a::11a33333333333333333::2a:::7133333333333351::

         bits    2.2    *                         *                    
                 2.0   **                        **                  * 
                 1.8  ****  *                 *  ***                 * 
                 1.5  ****  *                 ** ***                ***
Relative         1.3  ****  *                 ******                ***
Entropy          1.1 *****  *                 ******                ***
(30.3 bits)      0.9 *****  *                 *******               ***
                 0.7 ***** **                 ********              ***
                 0.4 ********                 *********            ****
                 0.2 ********                 *********          ******
                 0.0 --------------------------------------------------

Multilevel           ACTGGACTAAAAAAAAAAAAAAAAAAACTGGATAAAAAAAAAAAAATCCA
consensus            T    CA TTTTTTTTTTTTTTTTT      CC TTTTTTTTTTTTG   
sequence                     CCCCCCCCCCCCCCCCC         CCCCCCCCCC GA   
                             GGGGGGGGGGGGGGGGG         GGGGGGGGGG      
--------------------------------------------------------------------------------

--------------------------------------------------------------------------------
	Motif 1 sites sorted by position p-value
--------------------------------------------------------------------------------
Sequence name             Start   P-value                                   Site                     
-------------             ----- ---------            --------------------------------------------------
CLOBOL_04694(pdxU)Score=      2  6.79e-14          A ACTGGACTNNNNNNNNNNNNNNNNNAACTGGATANNNNNNNNNNATTCCA CTT       
RUMGNA_02238(pdxU)Score=      2  1.46e-12          A ACTGGACTNNNNNNNNNNNNNNNNNAACTGGACANNNNNNNNNNTATCCA CTT       
CLOBOL_05306(pdxU)Score=      2  1.86e-12          A TCTGGACTNNNNNNNNNNNNNNNNNAACTGGATANNNNNNNNNNAGTCCA CCT       
BLAHAN_01809(pdxU)Score=      2  2.49e-12          A ACTGGACTNNNNNNNNNNNNNNNNNAACTGGCTANNNNNNNNNNTAGCCA GTT       
Cbac1_010100001365(pdxU)      2  4.13e-12          A ACTGGACTNNNNNNNNNNNNNNNNNAACTGGATANNNNNNNNNNACTCCA CTC       
RUMGNA_01775(pdxS)Score=      2  9.06e-12          A ACTGGCATNNNNNNNNNNNNNNNNNAACTGGATGNNNNNNNNNNAAGCCA ATC       
CLOSCI_02639(pdxU)Score=      2  9.06e-12          A ACTGGACTNNNNNNNNNNNNNNNNNAACTGGACANNNNNNNNNNTGACCA CTT       
DORLON_01651(pdxU)Score=      2  1.85e-11          A ACTGGCCTNNNNNNNNNNNNNNNNNAACTGGCTGNNNNNNNNNNCATCCA CTT       
DORFOR_02364(pdxS)Score=      2  1.85e-11          A ACTGGCTTNNNNNNNNNNNNNNNNNAACTGGATANNNNNNNNNNATACCA GTT       
ROSINTL182_03667,Score=1      2  2.11e-11          A ACTGGCATNNNNNNNNNNNNNNNNNAACTGGATGNNNNNNNNNNCATCCA GTT       
Cbac1_010100020035(pdxU)      2  2.38e-11          A AGTGGACTNNNNNNNNNNNNNNNNNAACTGGATANNNNNNNNNNAGTCCA CTT       
DORLON_00259(pdxS)Score=      2  6.26e-11          A ACTGGTATNNNNNNNNNNNNNNNNNAACTGGATGNNNNNNNNNNATACCA GAT       
BRYFOR_03586(pdxU)Score=      2  6.96e-11          A ACTGGACTNNNNNNNNNNNNNNNNNAACTGGACANNNNNNNNNNTATCCG GAT       
EUBELI_20439(pdxS)Score=      2  2.08e-10          T TCTGGCATNNNNNNNNNNNNNNNNNAATTGGATANNNNNNNNNNTGACCA GTT       
DORLON_00405(pdxU)Score=      2  3.97e-10          A ACTGGTATNNNNNNNNNNNNNNNNNAACTGGCTCNNNNNNNNNNATGCCA CTA       
CLOSCI_00017(pdxK)Score=      2  6.20e-10          A ACTGGCCTNNNNNNNNNNNNNNNNNATCTGGACTNNNNNNNNNNCATCCA CTT       
CLONEX_02290(pdxU)Score=      2  9.44e-10          A ACTGGACTNNNNNNNNNNNNNNNNNAACTGGTATNNNNNNNNNNATACCA GAA       
EUBREC_0262(pdxU)Score=1      2  1.01e-09          A ACTGGATANNNNNNNNNNNNNNNNNAATTGGATANNNNNNNNNNATGCCA CAT       
BACPEC_01644(pdxU)Score=      2  2.40e-09          A TCTGGTATNNNNNNNNNNNNNNNNNAACTGGCATNNNNNNNNNNTTGCCA CAT       
RUMLAC_01874(pdxS)Score=      2  9.32e-09          T TCTGACCTNNNNNNNNNNNNNNNNNAATTGAATANNNNNNNNNNTAGTCA CAA       
RUMLAC_01106(pdxU)Score=      2  4.51e-08          A TCTGACCTNNNNNNNNNNNNNNNNNAATTGACCANNNNNNNNNNGGTTCA CAT       
--------------------------------------------------------------------------------

--------------------------------------------------------------------------------
	Motif 1 block diagrams
--------------------------------------------------------------------------------
SEQUENCE NAME            POSITION P-VALUE  MOTIF DIAGRAM
-------------            ----------------  -------------
CLOBOL_04694(pdxU)Score=          6.8e-14  1_[+1]_3
RUMGNA_02238(pdxU)Score=          1.5e-12  1_[+1]_3
CLOBOL_05306(pdxU)Score=          1.9e-12  1_[+1]_3
BLAHAN_01809(pdxU)Score=          2.5e-12  1_[+1]_3
Cbac1_010100001365(pdxU)          4.1e-12  1_[+1]_3
RUMGNA_01775(pdxS)Score=          9.1e-12  1_[+1]_3
CLOSCI_02639(pdxU)Score=          9.1e-12  1_[+1]_3
DORLON_01651(pdxU)Score=          1.9e-11  1_[+1]_3
DORFOR_02364(pdxS)Score=          1.9e-11  1_[+1]_3
ROSINTL182_03667,Score=1          2.1e-11  1_[+1]_3
Cbac1_010100020035(pdxU)          2.4e-11  1_[+1]_3
DORLON_00259(pdxS)Score=          6.3e-11  1_[+1]_3
BRYFOR_03586(pdxU)Score=            7e-11  1_[+1]_3
EUBELI_20439(pdxS)Score=          2.1e-10  1_[+1]_3
DORLON_00405(pdxU)Score=            4e-10  1_[+1]_3
CLOSCI_00017(pdxK)Score=          6.2e-10  1_[+1]_3
CLONEX_02290(pdxU)Score=          9.4e-10  1_[+1]_3
EUBREC_0262(pdxU)Score=1            1e-09  1_[+1]_3
BACPEC_01644(pdxU)Score=          2.4e-09  1_[+1]_3
RUMLAC_01874(pdxS)Score=          9.3e-09  1_[+1]_3
RUMLAC_01106(pdxU)Score=          4.5e-08  1_[+1]_3
--------------------------------------------------------------------------------

--------------------------------------------------------------------------------
	Motif 1 in BLOCKS format
--------------------------------------------------------------------------------
BL   MOTIF 1 width=50 seqs=21
CLOBOL_04694(pdxU)Score= (    2) ACTGGACTNNNNNNNNNNNNNNNNNAACTGGATANNNNNNNNNNATTCCA  1 
RUMGNA_02238(pdxU)Score= (    2) ACTGGACTNNNNNNNNNNNNNNNNNAACTGGACANNNNNNNNNNTATCCA  1 
CLOBOL_05306(pdxU)Score= (    2) TCTGGACTNNNNNNNNNNNNNNNNNAACTGGATANNNNNNNNNNAGTCCA  1 
BLAHAN_01809(pdxU)Score= (    2) ACTGGACTNNNNNNNNNNNNNNNNNAACTGGCTANNNNNNNNNNTAGCCA  1 
Cbac1_010100001365(pdxU) (    2) ACTGGACTNNNNNNNNNNNNNNNNNAACTGGATANNNNNNNNNNACTCCA  1 
RUMGNA_01775(pdxS)Score= (    2) ACTGGCATNNNNNNNNNNNNNNNNNAACTGGATGNNNNNNNNNNAAGCCA  1 
CLOSCI_02639(pdxU)Score= (    2) ACTGGACTNNNNNNNNNNNNNNNNNAACTGGACANNNNNNNNNNTGACCA  1 
DORLON_01651(pdxU)Score= (    2) ACTGGCCTNNNNNNNNNNNNNNNNNAACTGGCTGNNNNNNNNNNCATCCA  1 
DORFOR_02364(pdxS)Score= (    2) ACTGGCTTNNNNNNNNNNNNNNNNNAACTGGATANNNNNNNNNNATACCA  1 
ROSINTL182_03667,Score=1 (    2) ACTGGCATNNNNNNNNNNNNNNNNNAACTGGATGNNNNNNNNNNCATCCA  1 
Cbac1_010100020035(pdxU) (    2) AGTGGACTNNNNNNNNNNNNNNNNNAACTGGATANNNNNNNNNNAGTCCA  1 
DORLON_00259(pdxS)Score= (    2) ACTGGTATNNNNNNNNNNNNNNNNNAACTGGATGNNNNNNNNNNATACCA  1 
BRYFOR_03586(pdxU)Score= (    2) ACTGGACTNNNNNNNNNNNNNNNNNAACTGGACANNNNNNNNNNTATCCG  1 
EUBELI_20439(pdxS)Score= (    2) TCTGGCATNNNNNNNNNNNNNNNNNAATTGGATANNNNNNNNNNTGACCA  1 
DORLON_00405(pdxU)Score= (    2) ACTGGTATNNNNNNNNNNNNNNNNNAACTGGCTCNNNNNNNNNNATGCCA  1 
CLOSCI_00017(pdxK)Score= (    2) ACTGGCCTNNNNNNNNNNNNNNNNNATCTGGACTNNNNNNNNNNCATCCA  1 
CLONEX_02290(pdxU)Score= (    2) ACTGGACTNNNNNNNNNNNNNNNNNAACTGGTATNNNNNNNNNNATACCA  1 
EUBREC_0262(pdxU)Score=1 (    2) ACTGGATANNNNNNNNNNNNNNNNNAATTGGATANNNNNNNNNNATGCCA  1 
BACPEC_01644(pdxU)Score= (    2) TCTGGTATNNNNNNNNNNNNNNNNNAACTGGCATNNNNNNNNNNTTGCCA  1 
RUMLAC_01874(pdxS)Score= (    2) TCTGACCTNNNNNNNNNNNNNNNNNAATTGAATANNNNNNNNNNTAGTCA  1 
RUMLAC_01106(pdxU)Score= (    2) TCTGACCTNNNNNNNNNNNNNNNNNAATTGACCANNNNNNNNNNGGTTCA  1 
//

--------------------------------------------------------------------------------

--------------------------------------------------------------------------------
	Motif 1 position-specific scoring matrix
--------------------------------------------------------------------------------
log-odds matrix: alength= 4 w= 50 n= 105 bayes= 2 E= 2.1e-103 
   142  -1104  -1104    -12 
 -1104    200   -219  -1104 
 -1104  -1104  -1104    195 
 -1104  -1104    220  -1104 
  -158  -1104    205  -1104 
    74     67  -1104    -86 
     1    137  -1104   -144 
  -258  -1104  -1104    188 
     0      0      0      0 
     0      0      0      0 
     0      0      0      0 
     0      0      0      0 
     0      0      0      0 
     0      0      0      0 
     0      0      0      0 
     0      0      0      0 
     0      0      0      0 
     0      0      0      0 
     0      0      0      0 
     0      0      0      0 
     0      0      0      0 
     0      0      0      0 
     0      0      0      0 
     0      0      0      0 
     0      0      0      0 
   181  -1104  -1104  -1104 
   174  -1104  -1104   -244 
 -1104    176  -1104    -44 
 -1104  -1104  -1104    195 
 -1104  -1104    220  -1104 
  -158  -1104    205  -1104 
   133      0  -1104   -244 
  -158      0  -1104    136 
   112   -232    -19    -86 
     0      0      0      0 
     0      0      0      0 
     0      0      0      0 
     0      0      0      0 
     0      0      0      0 
     0      0      0      0 
     0      0      0      0 
     0      0      0      0 
     0      0      0      0 
     0      0      0      0 
    74    -74   -219     36 
    42   -232     13     36 
   -26  -1104     39     88 
 -1104    192  -1104   -144 
 -1104    207  -1104  -1104 
   174  -1104   -219  -1104 
--------------------------------------------------------------------------------

--------------------------------------------------------------------------------
	Motif 1 position-specific probability matrix
--------------------------------------------------------------------------------
letter-probability matrix: alength= 4 w= 50 nsites= 21 E= 2.1e-103 
 0.761905  0.000000  0.000000  0.238095 
 0.000000  0.952381  0.047619  0.000000 
 0.000000  0.000000  0.000000  1.000000 
 0.000000  0.000000  1.000000  0.000000 
 0.095238  0.000000  0.904762  0.000000 
 0.476190  0.380952  0.000000  0.142857 
 0.285714  0.619048  0.000000  0.095238 
 0.047619  0.000000  0.000000  0.952381 
 0.284490  0.238796  0.217707  0.259007 
 0.284490  0.238796  0.217707  0.259007 
 0.284490  0.238796  0.217707  0.259007 
 0.284490  0.238796  0.217707  0.259007 
 0.284490  0.238796  0.217707  0.259007 
 0.284490  0.238796  0.217707  0.259007 
 0.284490  0.238796  0.217707  0.259007 
 0.284490  0.238796  0.217707  0.259007 
 0.284490  0.238796  0.217707  0.259007 
 0.284490  0.238796  0.217707  0.259007 
 0.284490  0.238796  0.217707  0.259007 
 0.284490  0.238796  0.217707  0.259007 
 0.284490  0.238796  0.217707  0.259007 
 0.284490  0.238796  0.217707  0.259007 
 0.284490  0.238796  0.217707  0.259007 
 0.284490  0.238796  0.217707  0.259007 
 0.284490  0.238796  0.217707  0.259007 
 1.000000  0.000000  0.000000  0.000000 
 0.952381  0.000000  0.000000  0.047619 
 0.000000  0.809524  0.000000  0.190476 
 0.000000  0.000000  0.000000  1.000000 
 0.000000  0.000000  1.000000  0.000000 
 0.095238  0.000000  0.904762  0.000000 
 0.714286  0.238095  0.000000  0.047619 
 0.095238  0.238095  0.000000  0.666667 
 0.619048  0.047619  0.190476  0.142857 
 0.284490  0.238796  0.217707  0.259007 
 0.284490  0.238796  0.217707  0.259007 
 0.284490  0.238796  0.217707  0.259007 
 0.284490  0.238796  0.217707  0.259007 
 0.284490  0.238796  0.217707  0.259007 
 0.284490  0.238796  0.217707  0.259007 
 0.284490  0.238796  0.217707  0.259007 
 0.284490  0.238796  0.217707  0.259007 
 0.284490  0.238796  0.217707  0.259007 
 0.284490  0.238796  0.217707  0.259007 
 0.476190  0.142857  0.047619  0.333333 
 0.380952  0.047619  0.238095  0.333333 
 0.238095  0.000000  0.285714  0.476190 
 0.000000  0.904762  0.000000  0.095238 
 0.000000  1.000000  0.000000  0.000000 
 0.952381  0.000000  0.047619  0.000000 
--------------------------------------------------------------------------------

--------------------------------------------------------------------------------
	Motif 1 regular expression
--------------------------------------------------------------------------------
[AT]CTGG[AC][CA]T[ATCG][ATCG][ATCG][ATCG][ATCG][ATCG][ATCG][ATCG][ATCG][ATCG][ATCG][ATCG][ATCG][ATCG][ATCG][ATCG][ATCG]AACTGG[AC][TC]A[ATCG][ATCG][ATCG][ATCG][ATCG][ATCG][ATCG][ATCG][ATCG][ATCG][AT][ATG][TGA]CCA
--------------------------------------------------------------------------------




Time  0.29 secs.

********************************************************************************


********************************************************************************
SUMMARY OF MOTIFS
********************************************************************************

--------------------------------------------------------------------------------
	Combined block diagrams: non-overlapping sites with p-value < 0.0001
--------------------------------------------------------------------------------
SEQUENCE NAME            COMBINED P-VALUE  MOTIF DIAGRAM
-------------            ----------------  -------------
BACPEC_01644(pdxU)Score=         1.20e-08  1_[+1(2.40e-09)]_3
BLAHAN_01809(pdxU)Score=         1.24e-11  1_[+1(2.49e-12)]_3
BRYFOR_03586(pdxU)Score=         3.48e-10  1_[+1(6.96e-11)]_3
Cbac1_010100020035(pdxU)         1.19e-10  1_[+1(2.38e-11)]_3
Cbac1_010100001365(pdxU)         2.06e-11  1_[+1(4.13e-12)]_3
CLOBOL_05306(pdxU)Score=         9.28e-12  1_[+1(1.86e-12)]_3
CLOBOL_04694(pdxU)Score=         3.40e-13  1_[+1(6.79e-14)]_3
CLONEX_02290(pdxU)Score=         4.72e-09  1_[+1(9.44e-10)]_3
CLOSCI_00017(pdxK)Score=         3.10e-09  1_[+1(6.20e-10)]_3
CLOSCI_02639(pdxU)Score=         4.53e-11  1_[+1(9.06e-12)]_3
DORFOR_02364(pdxS)Score=         9.27e-11  1_[+1(1.85e-11)]_3
DORLON_00259(pdxS)Score=         3.13e-10  1_[+1(6.26e-11)]_3
DORLON_00405(pdxU)Score=         1.99e-09  1_[+1(3.97e-10)]_3
DORLON_01651(pdxU)Score=         9.27e-11  1_[+1(1.85e-11)]_3
EUBELI_20439(pdxS)Score=         1.04e-09  1_[+1(2.08e-10)]_3
EUBREC_0262(pdxU)Score=1         5.05e-09  1_[+1(1.01e-09)]_3
ROSINTL182_03667,Score=1         1.06e-10  1_[+1(2.11e-11)]_3
RUMGNA_01775(pdxS)Score=         4.53e-11  1_[+1(9.06e-12)]_3
RUMGNA_02238(pdxU)Score=         7.30e-12  1_[+1(1.46e-12)]_3
RUMLAC_01874(pdxS)Score=         4.66e-08  1_[+1(9.32e-09)]_3
RUMLAC_01106(pdxU)Score=         2.26e-07  1_[+1(4.51e-08)]_3
--------------------------------------------------------------------------------

********************************************************************************


********************************************************************************
Stopped because requested number of motifs (1) found.
********************************************************************************

CPU: leftraru1

********************************************************************************
