********************************************************************************
MEME - Motif discovery tool
********************************************************************************
MEME version 5.0.5 (Release date: Mon Mar 18 20:12:19 2019 -0700)

For further information on how to interpret please access http://meme-suite.org.
To get a copy of the MEME software please access http://meme-suite.org.

********************************************************************************


********************************************************************************
REFERENCE
********************************************************************************
If you use this program in your research, please cite:

Timothy L. Bailey and Charles Elkan,
"Fitting a mixture model by expectation maximization to discover
motifs in biopolymers", Proceedings of the Second International
Conference on Intelligent Systems for Molecular Biology, pp. 28-36,
AAAI Press, Menlo Park, California, 1994.
********************************************************************************


********************************************************************************
TRAINING SET
********************************************************************************
PRIMARY SEQUENCES= /home/dtravisany/gitrepo/RegPrecise/Motif_PWM/Ralstonia/PhnR2_Ralstonia.Xml.fasta
CONTROL SEQUENCES= --none--
ALPHABET= ACGT
Sequence name            Weight Length  Sequence name            Weight Length  
-------------            ------ ------  -------------            ------ ------  
RALTA_B1650_p-83(phnR2)  1.0000     12  RALTA_B1651_p-175(phnS)  1.0000     12  
H16_B1949_p-83(phnR2)    1.0000     12  H16_B1950_p-192(phnS)    1.0000     12  
Reut_B5874_p-139(phnS)   1.0000     12  Reut_B3719_p-81(phnR2)   1.0000     12  
Reut_B3718_p-273(phnW)   1.0000     12  Reut_B5875_p-45(n/a)     1.0000     12  
********************************************************************************

********************************************************************************
COMMAND LINE SUMMARY
********************************************************************************
This information can also be useful in the event you wish to report a
problem with the MEME software.

command: meme -dna /home/dtravisany/gitrepo/RegPrecise/Motif_PWM/Ralstonia/PhnR2_Ralstonia.Xml.fasta -oc /home/dtravisany/gitrepo/RegPrecise/Motif_PWM/Ralstonia/PhnR2_Ralstonia 

model:  mod=         zoops    nmotifs=         1    evt=           inf
objective function:           em=       E-value of product of p-values
                              starts=   E-value of product of p-values
strands: +
width:  minw=            8    maxw=           12
nsites: minsites=        2    maxsites=        8    wnsites=       0.8
theta:  spmap=         uni    spfuzz=        0.5
em:     prior=   dirichlet    b=            0.01    maxiter=        50
        distance=    1e-05
trim:   wg=             11    ws=              1    endgaps=       yes
data:   n=              96    N=               8
sample: seed=            0    hsfrac=          0
        searchsize=     96    norand=         no    csites=       1000
Letter frequencies in dataset:
A 0.365 C 0.135 G 0.135 T 0.365 
Background letter frequencies (from file dataset with add-one prior applied):
A 0.36 C 0.14 G 0.14 T 0.36 
Background model order: 0
********************************************************************************


********************************************************************************
MOTIF ATTGTYRACAAT MEME-1	width =  12  sites =   8  llr = 106  E-value = 4.3e-027
********************************************************************************
--------------------------------------------------------------------------------
	Motif ATTGTYRACAAT MEME-1 Description
--------------------------------------------------------------------------------
Simplified        A  a:::::5a:a9:
pos.-specific     C  :1:::5::a:::
probability       G  :::a::5:::1:
matrix            T  :9a:a5:::::a

         bits    2.8    *    *   
                 2.6    *    *   
                 2.3    *    *   
                 2.0    *    *   
Relative         1.7    *    *   
Entropy          1.4 * ***  *** *
(19.0 bits)      1.1 ************
                 0.9 ************
                 0.6 ************
                 0.3 ************
                 0.0 ------------

Multilevel           ATTGTCAACAAT
consensus                 TG     
sequence                         
                                 
--------------------------------------------------------------------------------

--------------------------------------------------------------------------------
	Motif ATTGTYRACAAT MEME-1 sites sorted by position p-value
--------------------------------------------------------------------------------
Sequence name             Start   P-value                Site  
-------------             ----- ---------            ------------
Reut_B3718_p-273(phnW)        1  6.66e-07          . ATTGTCAACAAT           
Reut_B3719_p-81(phnR2)        1  6.66e-07          . ATTGTTGACAAT           
H16_B1950_p-192(phnS)         1  6.66e-07          . ATTGTCAACAAT           
H16_B1949_p-83(phnR2)         1  6.66e-07          . ATTGTTGACAAT           
RALTA_B1651_p-175(phnS)       1  6.66e-07          . ATTGTCAACAAT           
RALTA_B1650_p-83(phnR2)       1  6.66e-07          . ATTGTTGACAAT           
Reut_B5875_p-45(n/a)          1  1.90e-06          . ACTGTTGACAAT           
Reut_B5874_p-139(phnS)        1  1.90e-06          . ATTGTCAACAGT           
--------------------------------------------------------------------------------

--------------------------------------------------------------------------------
	Motif ATTGTYRACAAT MEME-1 block diagrams
--------------------------------------------------------------------------------
SEQUENCE NAME            POSITION P-VALUE  MOTIF DIAGRAM
-------------            ----------------  -------------
Reut_B3718_p-273(phnW)            6.7e-07  [+1]
Reut_B3719_p-81(phnR2)            6.7e-07  [+1]
H16_B1950_p-192(phnS)             6.7e-07  [+1]
H16_B1949_p-83(phnR2)             6.7e-07  [+1]
RALTA_B1651_p-175(phnS)           6.7e-07  [+1]
RALTA_B1650_p-83(phnR2)           6.7e-07  [+1]
Reut_B5875_p-45(n/a)              1.9e-06  [+1]
Reut_B5874_p-139(phnS)            1.9e-06  [+1]
--------------------------------------------------------------------------------

--------------------------------------------------------------------------------
	Motif ATTGTYRACAAT MEME-1 in BLOCKS format
--------------------------------------------------------------------------------
BL   MOTIF ATTGTYRACAAT width=12 seqs=8
Reut_B3718_p-273(phnW)   (    1) ATTGTCAACAAT  1 
Reut_B3719_p-81(phnR2)   (    1) ATTGTTGACAAT  1 
H16_B1950_p-192(phnS)    (    1) ATTGTCAACAAT  1 
H16_B1949_p-83(phnR2)    (    1) ATTGTTGACAAT  1 
RALTA_B1651_p-175(phnS)  (    1) ATTGTCAACAAT  1 
RALTA_B1650_p-83(phnR2)  (    1) ATTGTTGACAAT  1 
Reut_B5875_p-45(n/a)     (    1) ACTGTTGACAAT  1 
Reut_B5874_p-139(phnS)   (    1) ATTGTCAACAGT  1 
//

--------------------------------------------------------------------------------

--------------------------------------------------------------------------------
	Motif ATTGTYRACAAT MEME-1 position-specific scoring matrix
--------------------------------------------------------------------------------
log-odds matrix: alength= 4 w= 12 n= 8 bayes= 0.584963 E= 4.3e-027 
   147   -965   -965   -965 
  -965    -16   -965    128 
  -965   -965   -965    147 
  -965   -965    283   -965 
  -965   -965   -965    147 
  -965    184   -965     47 
    47   -965    184   -965 
   147   -965   -965   -965 
  -965    283   -965   -965 
   147   -965   -965   -965 
   128   -965    -16   -965 
  -965   -965   -965    147 
--------------------------------------------------------------------------------

--------------------------------------------------------------------------------
	Motif ATTGTYRACAAT MEME-1 position-specific probability matrix
--------------------------------------------------------------------------------
letter-probability matrix: alength= 4 w= 12 nsites= 8 E= 4.3e-027 
 1.000000  0.000000  0.000000  0.000000 
 0.000000  0.125000  0.000000  0.875000 
 0.000000  0.000000  0.000000  1.000000 
 0.000000  0.000000  1.000000  0.000000 
 0.000000  0.000000  0.000000  1.000000 
 0.000000  0.500000  0.000000  0.500000 
 0.500000  0.000000  0.500000  0.000000 
 1.000000  0.000000  0.000000  0.000000 
 0.000000  1.000000  0.000000  0.000000 
 1.000000  0.000000  0.000000  0.000000 
 0.875000  0.000000  0.125000  0.000000 
 0.000000  0.000000  0.000000  1.000000 
--------------------------------------------------------------------------------

--------------------------------------------------------------------------------
	Motif ATTGTYRACAAT MEME-1 regular expression
--------------------------------------------------------------------------------
ATTGT[CT][AG]ACAAT
--------------------------------------------------------------------------------




Time  0.01 secs.

********************************************************************************


********************************************************************************
SUMMARY OF MOTIFS
********************************************************************************

--------------------------------------------------------------------------------
	Combined block diagrams: non-overlapping sites with p-value < 0.0001
--------------------------------------------------------------------------------
SEQUENCE NAME            COMBINED P-VALUE  MOTIF DIAGRAM
-------------            ----------------  -------------
RALTA_B1650_p-83(phnR2)          6.66e-07  [+1(6.66e-07)]
RALTA_B1651_p-175(phnS)          6.66e-07  [+1(6.66e-07)]
H16_B1949_p-83(phnR2)            6.66e-07  [+1(6.66e-07)]
H16_B1950_p-192(phnS)            6.66e-07  [+1(6.66e-07)]
Reut_B5874_p-139(phnS)           1.90e-06  [+1(1.90e-06)]
Reut_B3719_p-81(phnR2)           6.66e-07  [+1(6.66e-07)]
Reut_B3718_p-273(phnW)           6.66e-07  [+1(6.66e-07)]
Reut_B5875_p-45(n/a)             1.90e-06  [+1(1.90e-06)]
--------------------------------------------------------------------------------

********************************************************************************


********************************************************************************
Stopped because requested number of motifs (1) found.
********************************************************************************

CPU: optimus

********************************************************************************
