********************************************************************************
MEME - Motif discovery tool
********************************************************************************
MEME version 5.0.5 (Release date: Mon Mar 18 20:12:19 2019 -0700)

For further information on how to interpret please access http://meme-suite.org.
To get a copy of the MEME software please access http://meme-suite.org.

********************************************************************************


********************************************************************************
REFERENCE
********************************************************************************
If you use this program in your research, please cite:

Timothy L. Bailey and Charles Elkan,
"Fitting a mixture model by expectation maximization to discover
motifs in biopolymers", Proceedings of the Second International
Conference on Intelligent Systems for Molecular Biology, pp. 28-36,
AAAI Press, Menlo Park, California, 1994.
********************************************************************************


********************************************************************************
TRAINING SET
********************************************************************************
PRIMARY SEQUENCES= /home/dtravisany/gitrepo/RegPrecise/Motif_PWM/Phr_Archaeoglobales.Xml.fasta
CONTROL SEQUENCES= --none--
ALPHABET= ACGT
Sequence name            Weight Length  Sequence name            Weight Length  
-------------            ------ ------  -------------            ------ ------  
AF1971_p-56(hsp20-2)     1.0000     23  AF1298_p-34(phr)         1.0000     23  
Arcpr_1089_p-48(hsp20-2) 1.0000     23  Arcpr_0812_p-43(phr)     1.0000     23  
Ferp_0363_p-46(hsp20-2)  1.0000     23  Ferp_0217_p-58(phr)      1.0000     23  
********************************************************************************

********************************************************************************
COMMAND LINE SUMMARY
********************************************************************************
This information can also be useful in the event you wish to report a
problem with the MEME software.

command: meme -dna /home/dtravisany/gitrepo/RegPrecise/Motif_PWM/Phr_Archaeoglobales.Xml.fasta -oc /home/dtravisany/gitrepo/RegPrecise/Motif_PWM/Phr_Archaeoglobales 

model:  mod=         zoops    nmotifs=         1    evt=           inf
objective function:           em=       E-value of product of p-values
                              starts=   E-value of product of p-values
strands: +
width:  minw=            8    maxw=           23
nsites: minsites=        2    maxsites=        6    wnsites=       0.8
theta:  spmap=         uni    spfuzz=        0.5
em:     prior=   dirichlet    b=            0.01    maxiter=        50
        distance=    1e-05
trim:   wg=             11    ws=              1    endgaps=       yes
data:   n=             138    N=               6
sample: seed=            0    hsfrac=          0
        searchsize=    138    norand=         no    csites=       1000
Letter frequencies in dataset:
A 0.428 C 0.145 G 0.116 T 0.312 
Background letter frequencies (from file dataset with add-one prior applied):
A 0.423 C 0.148 G 0.12 T 0.31 
Background model order: 0
********************************************************************************


********************************************************************************
MOTIF MCTAACWWAAAGTTAGT MEME-1	width =  17  sites =   6  llr = 110  E-value = 2.9e-019
********************************************************************************
--------------------------------------------------------------------------------
	Motif MCTAACWWAAAGTTAGT MEME-1 Description
--------------------------------------------------------------------------------
Simplified        A  5::aa:53aa8:::a::
pos.-specific     C  5a:::a22:::::::::
probability       G  ::::::::::2a:::a3
matrix            T  ::a:::35::::aa::7

         bits    3.1            *   * 
                 2.8  *   *     *   * 
                 2.4  *   *     *   * 
                 2.1  *   *     *   * 
Relative         1.8  **  *     *** * 
Entropy          1.5  **  *     *** * 
(26.5 bits)      1.2  *****  ** ******
                 0.9 ******  *********
                 0.6 ******  *********
                 0.3 *****************
                 0.0 -----------------

Multilevel           ACTAACATAAAGTTAGT
consensus            C     TA        G
sequence                              
                                      
--------------------------------------------------------------------------------

--------------------------------------------------------------------------------
	Motif MCTAACWWAAAGTTAGT MEME-1 sites sorted by position p-value
--------------------------------------------------------------------------------
Sequence name             Start   P-value                  Site     
-------------             ----- ---------            -----------------
AF1971_p-56(hsp20-2)          4  1.25e-10        CTA CCTAACATAAAGTTAGG TTA       
Ferp_0363_p-46(hsp20-2)       4  2.61e-10        AAT CCTAACTTAAAGTTAGG ATT       
AF1298_p-34(phr)              4  5.85e-10        AAA CCTAACATAAAGTTAGT AAC       
Ferp_0217_p-58(phr)           4  7.64e-09        TTT ACTAACACAAAGTTAGT AAC       
Arcpr_0812_p-43(phr)          4  1.23e-08        TTT ACTAACCAAAAGTTAGT AAA       
Arcpr_1089_p-48(hsp20-2)      4  1.32e-08        TTT ACTAACTAAAGGTTAGT AGT       
--------------------------------------------------------------------------------

--------------------------------------------------------------------------------
	Motif MCTAACWWAAAGTTAGT MEME-1 block diagrams
--------------------------------------------------------------------------------
SEQUENCE NAME            POSITION P-VALUE  MOTIF DIAGRAM
-------------            ----------------  -------------
AF1971_p-56(hsp20-2)              1.3e-10  3_[+1]_3
Ferp_0363_p-46(hsp20-2)           2.6e-10  3_[+1]_3
AF1298_p-34(phr)                  5.8e-10  3_[+1]_3
Ferp_0217_p-58(phr)               7.6e-09  3_[+1]_3
Arcpr_0812_p-43(phr)              1.2e-08  3_[+1]_3
Arcpr_1089_p-48(hsp20-2)          1.3e-08  3_[+1]_3
--------------------------------------------------------------------------------

--------------------------------------------------------------------------------
	Motif MCTAACWWAAAGTTAGT MEME-1 in BLOCKS format
--------------------------------------------------------------------------------
BL   MOTIF MCTAACWWAAAGTTAGT width=17 seqs=6
AF1971_p-56(hsp20-2)     (    4) CCTAACATAAAGTTAGG  1 
Ferp_0363_p-46(hsp20-2)  (    4) CCTAACTTAAAGTTAGG  1 
AF1298_p-34(phr)         (    4) CCTAACATAAAGTTAGT  1 
Ferp_0217_p-58(phr)      (    4) ACTAACACAAAGTTAGT  1 
Arcpr_0812_p-43(phr)     (    4) ACTAACCAAAAGTTAGT  1 
Arcpr_1089_p-48(hsp20-2) (    4) ACTAACTAAAGGTTAGT  1 
//

--------------------------------------------------------------------------------

--------------------------------------------------------------------------------
	Motif MCTAACWWAAAGTTAGT MEME-1 position-specific scoring matrix
--------------------------------------------------------------------------------
log-odds matrix: alength= 4 w= 17 n= 42 bayes= 3.80735 E= 2.9e-019 
    24    176   -923   -923 
  -923    276   -923   -923 
  -923   -923   -923    169 
   124   -923   -923   -923 
   124   -923   -923   -923 
  -923    276   -923   -923 
    24     17   -923     11 
   -34     17   -923     69 
   124   -923   -923   -923 
   124   -923   -923   -923 
    98   -923     48   -923 
  -923   -923    306   -923 
  -923   -923   -923    169 
  -923   -923   -923    169 
   124   -923   -923   -923 
  -923   -923    306   -923 
  -923   -923    148    110 
--------------------------------------------------------------------------------

--------------------------------------------------------------------------------
	Motif MCTAACWWAAAGTTAGT MEME-1 position-specific probability matrix
--------------------------------------------------------------------------------
letter-probability matrix: alength= 4 w= 17 nsites= 6 E= 2.9e-019 
 0.500000  0.500000  0.000000  0.000000 
 0.000000  1.000000  0.000000  0.000000 
 0.000000  0.000000  0.000000  1.000000 
 1.000000  0.000000  0.000000  0.000000 
 1.000000  0.000000  0.000000  0.000000 
 0.000000  1.000000  0.000000  0.000000 
 0.500000  0.166667  0.000000  0.333333 
 0.333333  0.166667  0.000000  0.500000 
 1.000000  0.000000  0.000000  0.000000 
 1.000000  0.000000  0.000000  0.000000 
 0.833333  0.000000  0.166667  0.000000 
 0.000000  0.000000  1.000000  0.000000 
 0.000000  0.000000  0.000000  1.000000 
 0.000000  0.000000  0.000000  1.000000 
 1.000000  0.000000  0.000000  0.000000 
 0.000000  0.000000  1.000000  0.000000 
 0.000000  0.000000  0.333333  0.666667 
--------------------------------------------------------------------------------

--------------------------------------------------------------------------------
	Motif MCTAACWWAAAGTTAGT MEME-1 regular expression
--------------------------------------------------------------------------------
[AC]CTAAC[AT][TA]AAAGTTAG[TG]
--------------------------------------------------------------------------------




Time  0.01 secs.

********************************************************************************


********************************************************************************
SUMMARY OF MOTIFS
********************************************************************************

--------------------------------------------------------------------------------
	Combined block diagrams: non-overlapping sites with p-value < 0.0001
--------------------------------------------------------------------------------
SEQUENCE NAME            COMBINED P-VALUE  MOTIF DIAGRAM
-------------            ----------------  -------------
AF1971_p-56(hsp20-2)             8.78e-10  3_[+1(1.25e-10)]_3
AF1298_p-34(phr)                 4.09e-09  3_[+1(5.85e-10)]_3
Arcpr_1089_p-48(hsp20-2)         9.22e-08  3_[+1(1.32e-08)]_3
Arcpr_0812_p-43(phr)             8.59e-08  3_[+1(1.23e-08)]_3
Ferp_0363_p-46(hsp20-2)          1.83e-09  3_[+1(2.61e-10)]_3
Ferp_0217_p-58(phr)              5.35e-08  3_[+1(7.64e-09)]_3
--------------------------------------------------------------------------------

********************************************************************************


********************************************************************************
Stopped because requested number of motifs (1) found.
********************************************************************************

CPU: optimus

********************************************************************************
