********************************************************************************
MEME - Motif discovery tool
********************************************************************************
MEME version 5.0.5 (Release date: Mon Mar 18 20:12:19 2019 -0700)

For further information on how to interpret please access http://meme-suite.org.
To get a copy of the MEME software please access http://meme-suite.org.

********************************************************************************


********************************************************************************
REFERENCE
********************************************************************************
If you use this program in your research, please cite:

Timothy L. Bailey and Charles Elkan,
"Fitting a mixture model by expectation maximization to discover
motifs in biopolymers", Proceedings of the Second International
Conference on Intelligent Systems for Molecular Biology, pp. 28-36,
AAAI Press, Menlo Park, California, 1994.
********************************************************************************


********************************************************************************
TRAINING SET
********************************************************************************
PRIMARY SEQUENCES= /home/dtravisany/gitrepo/RegPrecise/Motif_PWM/Phr_Methanosarcinales.Xml.fasta
CONTROL SEQUENCES= --none--
ALPHABET= ACGT
Sequence name            Weight Length  Sequence name            Weight Length  
-------------            ------ ------  -------------            ------ ------  
Mthe_0612_p-56(phr)      1.0000     23  Mthe_0612_p-42(phr)      1.0000     23  
MA4576_p-315(phr)        1.0000     23  Mbar_A0909_p-189(phr)    1.0000     23  
MM1257_p-299(phr)        1.0000     23  
********************************************************************************

********************************************************************************
COMMAND LINE SUMMARY
********************************************************************************
This information can also be useful in the event you wish to report a
problem with the MEME software.

command: meme -dna /home/dtravisany/gitrepo/RegPrecise/Motif_PWM/Phr_Methanosarcinales.Xml.fasta -oc /home/dtravisany/gitrepo/RegPrecise/Motif_PWM/Phr_Methanosarcinales 

model:  mod=         zoops    nmotifs=         1    evt=           inf
objective function:           em=       E-value of product of p-values
                              starts=   E-value of product of p-values
strands: +
width:  minw=            8    maxw=           23
nsites: minsites=        2    maxsites=        5    wnsites=       0.8
theta:  spmap=         uni    spfuzz=        0.5
em:     prior=   dirichlet    b=            0.01    maxiter=        50
        distance=    1e-05
trim:   wg=             11    ws=              1    endgaps=       yes
data:   n=             115    N=               5
sample: seed=            0    hsfrac=          0
        searchsize=    115    norand=         no    csites=       1000
Letter frequencies in dataset:
A 0.322 C 0.191 G 0.122 T 0.365 
Background letter frequencies (from file dataset with add-one prior applied):
A 0.319 C 0.193 G 0.126 T 0.361 
Background model order: 0
********************************************************************************


********************************************************************************
MOTIF GCTAACTAWTGGTTACTAWC MEME-1	width =  20  sites =   5  llr = 97  E-value = 5.9e-013
********************************************************************************
--------------------------------------------------------------------------------
	Motif GCTAACTAWTGGTTACTAWC MEME-1 Description
--------------------------------------------------------------------------------
Simplified        A  2::aa::8422:::a::a6:
pos.-specific     C  :a:::a2::2:::::8:::8
probability       G  6:::::::::6a::::2:::
matrix            T  2:a:::82662:aa:28:42

         bits    3.0            *        
                 2.7            *        
                 2.4  *   *     *        
                 2.1  *   *     *        
Relative         1.8  * ***     *  *  *  
Entropy          1.5  *****     ***** * *
(28.1 bits)      1.2  *****     ******* *
                 0.9 ********  ******** *
                 0.6 ********* **********
                 0.3 ********************
                 0.0 --------------------

Multilevel           GCTAACTATTGGTTACTAAC
consensus            A     CTAAA    TG TT
sequence             T        CT         
                                         
--------------------------------------------------------------------------------

--------------------------------------------------------------------------------
	Motif GCTAACTAWTGGTTACTAWC MEME-1 sites sorted by position p-value
--------------------------------------------------------------------------------
Sequence name             Start   P-value                    Site      
-------------             ----- ---------            --------------------
MM1257_p-299(phr)             4  4.40e-12        ACC GCTAACTAATGGTTACTAAC           
MA4576_p-315(phr)             4  4.40e-12        ATT GCTAACTAATGGTTACTAAC           
Mbar_A0909_p-189(phr)         4  3.51e-11        GAT GCTAACTATAGGTTACTATC           
Mthe_0612_p-56(phr)           4  4.20e-09        ATA TCTAACTTTTTGTTACTAAC           
Mthe_0612_p-42(phr)           4  3.87e-08        GTT ACTAACCATCAGTTATGATT           
--------------------------------------------------------------------------------

--------------------------------------------------------------------------------
	Motif GCTAACTAWTGGTTACTAWC MEME-1 block diagrams
--------------------------------------------------------------------------------
SEQUENCE NAME            POSITION P-VALUE  MOTIF DIAGRAM
-------------            ----------------  -------------
MM1257_p-299(phr)                 4.4e-12  3_[+1]
MA4576_p-315(phr)                 4.4e-12  3_[+1]
Mbar_A0909_p-189(phr)             3.5e-11  3_[+1]
Mthe_0612_p-56(phr)               4.2e-09  3_[+1]
Mthe_0612_p-42(phr)               3.9e-08  3_[+1]
--------------------------------------------------------------------------------

--------------------------------------------------------------------------------
	Motif GCTAACTAWTGGTTACTAWC MEME-1 in BLOCKS format
--------------------------------------------------------------------------------
BL   MOTIF GCTAACTAWTGGTTACTAWC width=20 seqs=5
MM1257_p-299(phr)        (    4) GCTAACTAATGGTTACTAAC  1 
MA4576_p-315(phr)        (    4) GCTAACTAATGGTTACTAAC  1 
Mbar_A0909_p-189(phr)    (    4) GCTAACTATAGGTTACTATC  1 
Mthe_0612_p-56(phr)      (    4) TCTAACTTTTTGTTACTAAC  1 
Mthe_0612_p-42(phr)      (    4) ACTAACCATCAGTTATGATT  1 
//

--------------------------------------------------------------------------------

--------------------------------------------------------------------------------
	Motif GCTAACTAWTGGTTACTAWC MEME-1 position-specific scoring matrix
--------------------------------------------------------------------------------
log-odds matrix: alength= 4 w= 20 n= 20 bayes= 2.7425 E= 5.9e-013 
   -67   -897    225    -85 
  -897    237   -897   -897 
  -897   -897   -897    147 
   164   -897   -897   -897 
   164   -897   -897   -897 
  -897    237   -897   -897 
  -897      5   -897    115 
   132   -897   -897    -85 
    32   -897   -897     73 
   -67      5   -897     73 
   -67   -897    225    -85 
  -897   -897    299   -897 
  -897   -897   -897    147 
  -897   -897   -897    147 
   164   -897   -897   -897 
  -897    205   -897    -85 
  -897   -897     66    115 
   164   -897   -897   -897 
    91   -897   -897     15 
  -897    205   -897    -85 
--------------------------------------------------------------------------------

--------------------------------------------------------------------------------
	Motif GCTAACTAWTGGTTACTAWC MEME-1 position-specific probability matrix
--------------------------------------------------------------------------------
letter-probability matrix: alength= 4 w= 20 nsites= 5 E= 5.9e-013 
 0.200000  0.000000  0.600000  0.200000 
 0.000000  1.000000  0.000000  0.000000 
 0.000000  0.000000  0.000000  1.000000 
 1.000000  0.000000  0.000000  0.000000 
 1.000000  0.000000  0.000000  0.000000 
 0.000000  1.000000  0.000000  0.000000 
 0.000000  0.200000  0.000000  0.800000 
 0.800000  0.000000  0.000000  0.200000 
 0.400000  0.000000  0.000000  0.600000 
 0.200000  0.200000  0.000000  0.600000 
 0.200000  0.000000  0.600000  0.200000 
 0.000000  0.000000  1.000000  0.000000 
 0.000000  0.000000  0.000000  1.000000 
 0.000000  0.000000  0.000000  1.000000 
 1.000000  0.000000  0.000000  0.000000 
 0.000000  0.800000  0.000000  0.200000 
 0.000000  0.000000  0.200000  0.800000 
 1.000000  0.000000  0.000000  0.000000 
 0.600000  0.000000  0.000000  0.400000 
 0.000000  0.800000  0.000000  0.200000 
--------------------------------------------------------------------------------

--------------------------------------------------------------------------------
	Motif GCTAACTAWTGGTTACTAWC MEME-1 regular expression
--------------------------------------------------------------------------------
[GAT]CTAAC[TC][AT][TA][TAC][GAT]GTTA[CT][TG]A[AT][CT]
--------------------------------------------------------------------------------




Time  0.02 secs.

********************************************************************************


********************************************************************************
SUMMARY OF MOTIFS
********************************************************************************

--------------------------------------------------------------------------------
	Combined block diagrams: non-overlapping sites with p-value < 0.0001
--------------------------------------------------------------------------------
SEQUENCE NAME            COMBINED P-VALUE  MOTIF DIAGRAM
-------------            ----------------  -------------
Mthe_0612_p-56(phr)              1.68e-08  3_[+1(4.20e-09)]
Mthe_0612_p-42(phr)              1.55e-07  3_[+1(3.87e-08)]
MA4576_p-315(phr)                1.76e-11  3_[+1(4.40e-12)]
Mbar_A0909_p-189(phr)            1.40e-10  3_[+1(3.51e-11)]
MM1257_p-299(phr)                1.76e-11  3_[+1(4.40e-12)]
--------------------------------------------------------------------------------

********************************************************************************


********************************************************************************
Stopped because requested number of motifs (1) found.
********************************************************************************

CPU: optimus

********************************************************************************
