********************************************************************************
MEME - Motif discovery tool
********************************************************************************
MEME version 5.0.5 (Release date: Mon Mar 18 20:12:19 2019 -0700)

For further information on how to interpret please access http://meme-suite.org.
To get a copy of the MEME software please access http://meme-suite.org.

********************************************************************************


********************************************************************************
REFERENCE
********************************************************************************
If you use this program in your research, please cite:

Timothy L. Bailey and Charles Elkan,
"Fitting a mixture model by expectation maximization to discover
motifs in biopolymers", Proceedings of the Second International
Conference on Intelligent Systems for Molecular Biology, pp. 28-36,
AAAI Press, Menlo Park, California, 1994.
********************************************************************************


********************************************************************************
TRAINING SET
********************************************************************************
PRIMARY SEQUENCES= /home/dtravisany/gitrepo/RegPrecise/Motif_PWM/Rhodobacterales/SahR_Rhodobacterales.Xml.fasta
CONTROL SEQUENCES= --none--
ALPHABET= ACGT
Sequence name            Weight Length  Sequence name            Weight Length  
-------------            ------ ------  -------------            ------ ------  
HNE_2104_p-27(sahR)      1.0000     20  OA2633_08279_p-202(hom)  1.0000     20  
OA2633_10239_p-18(metK)  1.0000     20  OA2633_05526_p-18(metF)  1.0000     20  
********************************************************************************

********************************************************************************
COMMAND LINE SUMMARY
********************************************************************************
This information can also be useful in the event you wish to report a
problem with the MEME software.

command: meme -dna /home/dtravisany/gitrepo/RegPrecise/Motif_PWM/Rhodobacterales/SahR_Rhodobacterales.Xml.fasta -oc /home/dtravisany/gitrepo/RegPrecise/Motif_PWM/Rhodobacterales/SahR_Rhodobacterales 

model:  mod=         zoops    nmotifs=         1    evt=           inf
objective function:           em=       E-value of product of p-values
                              starts=   E-value of product of p-values
strands: +
width:  minw=            8    maxw=           20
nsites: minsites=        2    maxsites=        4    wnsites=       0.8
theta:  spmap=         uni    spfuzz=        0.5
em:     prior=   dirichlet    b=            0.01    maxiter=        50
        distance=    1e-05
trim:   wg=             11    ws=              1    endgaps=       yes
data:   n=              80    N=               4
sample: seed=            0    hsfrac=          0
        searchsize=     80    norand=         no    csites=       1000
Letter frequencies in dataset:
A 0.4 C 0.0875 G 0.1 T 0.412 
Background letter frequencies (from file dataset with add-one prior applied):
A 0.393 C 0.0952 G 0.107 T 0.405 
Background model order: 0
********************************************************************************


********************************************************************************
MOTIF ATATAAAGATWTCTTTATAT MEME-1	width =  20  sites =   4  llr = 70  E-value = 9.3e-008
********************************************************************************
--------------------------------------------------------------------------------
	Motif ATATAAAGATWTCTTTATAT MEME-1 Description
--------------------------------------------------------------------------------
Simplified        A  8:a:aaa38:5:::::a:8:
pos.-specific     C  :3::::::::3383::::::
probability       G  3::::::83::33:::::3:
matrix            T  :8:a:::::a35:8aa:a:a

         bits    3.4                     
                 3.1                     
                 2.7                     
                 2.4             *       
Relative         2.0        *    *       
Entropy          1.7        *    *       
(25.3 bits)      1.4   ****** *  * **** *
                 1.0 **********  ********
                 0.7 ********** *********
                 0.3 ********************
                 0.0 --------------------

Multilevel           ATATAAAGATATCTTTATAT
consensus            GC     AG CCGC    G 
sequence                       TG        
                                         
--------------------------------------------------------------------------------

--------------------------------------------------------------------------------
	Motif ATATAAAGATWTCTTTATAT MEME-1 sites sorted by position p-value
--------------------------------------------------------------------------------
Sequence name             Start   P-value                    Site      
-------------             ----- ---------            --------------------
OA2633_10239_p-18(metK)       1  3.69e-10          . ATATAAAGATCGCTTTATAT           
OA2633_05526_p-18(metF)       1  1.53e-09          . GCATAAAGATATCTTTATGT           
OA2633_08279_p-202(hom)       1  3.57e-09          . ATATAAAGATATCCTTATAT           
HNE_2104_p-27(sahR)           1  5.50e-08          . ATATAAAAGTTCGTTTATAT           
--------------------------------------------------------------------------------

--------------------------------------------------------------------------------
	Motif ATATAAAGATWTCTTTATAT MEME-1 block diagrams
--------------------------------------------------------------------------------
SEQUENCE NAME            POSITION P-VALUE  MOTIF DIAGRAM
-------------            ----------------  -------------
OA2633_10239_p-18(metK)           3.7e-10  [+1]
OA2633_05526_p-18(metF)           1.5e-09  [+1]
OA2633_08279_p-202(hom)           3.6e-09  [+1]
HNE_2104_p-27(sahR)               5.5e-08  [+1]
--------------------------------------------------------------------------------

--------------------------------------------------------------------------------
	Motif ATATAAAGATWTCTTTATAT MEME-1 in BLOCKS format
--------------------------------------------------------------------------------
BL   MOTIF ATATAAAGATWTCTTTATAT width=20 seqs=4
OA2633_10239_p-18(metK)  (    1) ATATAAAGATCGCTTTATAT  1 
OA2633_05526_p-18(metF)  (    1) GCATAAAGATATCTTTATGT  1 
OA2633_08279_p-202(hom)  (    1) ATATAAAGATATCCTTATAT  1 
HNE_2104_p-27(sahR)      (    1) ATATAAAAGTTCGTTTATAT  1 
//

--------------------------------------------------------------------------------

--------------------------------------------------------------------------------
	Motif ATATAAAGATWTCTTTATAT MEME-1 position-specific scoring matrix
--------------------------------------------------------------------------------
log-odds matrix: alength= 4 w= 20 n= 4 bayes= -0.584963 E= 9.3e-008 
    93   -865    122   -865 
  -865    139   -865     89 
   135   -865   -865   -865 
  -865   -865   -865    130 
   135   -865   -865   -865 
   135   -865   -865   -865 
   135   -865   -865   -865 
   -65   -865    280   -865 
    93   -865    122   -865 
  -865   -865   -865    130 
    35    139   -865    -69 
  -865    139    122     30 
  -865    297    122   -865 
  -865    139   -865     89 
  -865   -865   -865    130 
  -865   -865   -865    130 
   135   -865   -865   -865 
  -865   -865   -865    130 
    93   -865    122   -865 
  -865   -865   -865    130 
--------------------------------------------------------------------------------

--------------------------------------------------------------------------------
	Motif ATATAAAGATWTCTTTATAT MEME-1 position-specific probability matrix
--------------------------------------------------------------------------------
letter-probability matrix: alength= 4 w= 20 nsites= 4 E= 9.3e-008 
 0.750000  0.000000  0.250000  0.000000 
 0.000000  0.250000  0.000000  0.750000 
 1.000000  0.000000  0.000000  0.000000 
 0.000000  0.000000  0.000000  1.000000 
 1.000000  0.000000  0.000000  0.000000 
 1.000000  0.000000  0.000000  0.000000 
 1.000000  0.000000  0.000000  0.000000 
 0.250000  0.000000  0.750000  0.000000 
 0.750000  0.000000  0.250000  0.000000 
 0.000000  0.000000  0.000000  1.000000 
 0.500000  0.250000  0.000000  0.250000 
 0.000000  0.250000  0.250000  0.500000 
 0.000000  0.750000  0.250000  0.000000 
 0.000000  0.250000  0.000000  0.750000 
 0.000000  0.000000  0.000000  1.000000 
 0.000000  0.000000  0.000000  1.000000 
 1.000000  0.000000  0.000000  0.000000 
 0.000000  0.000000  0.000000  1.000000 
 0.750000  0.000000  0.250000  0.000000 
 0.000000  0.000000  0.000000  1.000000 
--------------------------------------------------------------------------------

--------------------------------------------------------------------------------
	Motif ATATAAAGATWTCTTTATAT MEME-1 regular expression
--------------------------------------------------------------------------------
[AG][TC]ATAAA[GA][AG]T[ACT][TCG][CG][TC]TTAT[AG]T
--------------------------------------------------------------------------------




Time  0.01 secs.

********************************************************************************


********************************************************************************
SUMMARY OF MOTIFS
********************************************************************************

--------------------------------------------------------------------------------
	Combined block diagrams: non-overlapping sites with p-value < 0.0001
--------------------------------------------------------------------------------
SEQUENCE NAME            COMBINED P-VALUE  MOTIF DIAGRAM
-------------            ----------------  -------------
HNE_2104_p-27(sahR)              5.50e-08  [+1(5.50e-08)]
OA2633_08279_p-202(hom)          3.57e-09  [+1(3.57e-09)]
OA2633_10239_p-18(metK)          3.69e-10  [+1(3.69e-10)]
OA2633_05526_p-18(metF)          1.53e-09  [+1(1.53e-09)]
--------------------------------------------------------------------------------

********************************************************************************


********************************************************************************
Stopped because requested number of motifs (1) found.
********************************************************************************

CPU: optimus

********************************************************************************
