********************************************************************************
MEME - Motif discovery tool
********************************************************************************
MEME version 5.0.5 (Release date: Mon Mar 18 20:12:19 2019 -0700)

For further information on how to interpret please access http://meme-suite.org.
To get a copy of the MEME software please access http://meme-suite.org.

********************************************************************************


********************************************************************************
REFERENCE
********************************************************************************
If you use this program in your research, please cite:

Timothy L. Bailey and Charles Elkan,
"Fitting a mixture model by expectation maximization to discover
motifs in biopolymers", Proceedings of the Second International
Conference on Intelligent Systems for Molecular Biology, pp. 28-36,
AAAI Press, Menlo Park, California, 1994.
********************************************************************************


********************************************************************************
TRAINING SET
********************************************************************************
PRIMARY SEQUENCES= /home/dtravisany/gitrepo/RegPrecise/Motif_PWM/Desulfovibrionales/Zur_Desulfovibrionales.Xml.fasta
CONTROL SEQUENCES= --none--
ALPHABET= ACGT
Sequence name            Weight Length  Sequence name            Weight Length  
-------------            ------ ------  -------------            ------ ------  
DVU1343_p-217(znuA)      1.0000     17  DvMF_0119_p-56(znuA)     1.0000     17  
Dde_2208_p-48(znuA)      1.0000     17  Desal_1080_p-220(znuC)   1.0000     17  
DMR_26850_p0(znuA)       1.0000     17  Dbac_0624_p-46(znuA)     1.0000     17  
********************************************************************************

********************************************************************************
COMMAND LINE SUMMARY
********************************************************************************
This information can also be useful in the event you wish to report a
problem with the MEME software.

command: meme -dna /home/dtravisany/gitrepo/RegPrecise/Motif_PWM/Desulfovibrionales/Zur_Desulfovibrionales.Xml.fasta -oc /home/dtravisany/gitrepo/RegPrecise/Motif_PWM/Desulfovibrionales/Zur_Desulfovibrionales 

model:  mod=         zoops    nmotifs=         1    evt=           inf
objective function:           em=       E-value of product of p-values
                              starts=   E-value of product of p-values
strands: +
width:  minw=            8    maxw=           17
nsites: minsites=        2    maxsites=        6    wnsites=       0.8
theta:  spmap=         uni    spfuzz=        0.5
em:     prior=   dirichlet    b=            0.01    maxiter=        50
        distance=    1e-05
trim:   wg=             11    ws=              1    endgaps=       yes
data:   n=             102    N=               6
sample: seed=            0    hsfrac=          0
        searchsize=    102    norand=         no    csites=       1000
Letter frequencies in dataset:
A 0.314 C 0.167 G 0.206 T 0.314 
Background letter frequencies (from file dataset with add-one prior applied):
A 0.311 C 0.17 G 0.208 T 0.311 
Background model order: 0
********************************************************************************


********************************************************************************
MOTIF ATGCAACWGWGTTGCAT MEME-1	width =  17  sites =   6  llr = 110  E-value = 9.0e-024
********************************************************************************
--------------------------------------------------------------------------------
	Motif ATGCAACWGWGTTGCAT MEME-1 Description
--------------------------------------------------------------------------------
Simplified        A  a::2a82525:::::a:
pos.-specific     C  :::8::722:::::a::
probability       G  ::a:::::5:a::a:::
matrix            T  :a:::22325:aa:::a

         bits    2.6               *  
                 2.3   *       *  **  
                 2.0   *       *  **  
                 1.8 *****     *******
Relative         1.5 *****     *******
Entropy          1.3 *****     *******
(26.3 bits)      1.0 *******   *******
                 0.8 *******  ********
                 0.5 *******  ********
                 0.3 *****************
                 0.0 -----------------

Multilevel           ATGCAACAGAGTTGCAT
consensus                   T T       
sequence                              
                                      
--------------------------------------------------------------------------------

--------------------------------------------------------------------------------
	Motif ATGCAACWGWGTTGCAT MEME-1 sites sorted by position p-value
--------------------------------------------------------------------------------
Sequence name             Start   P-value                  Site     
-------------             ----- ---------            -----------------
DvMF_0119_p-56(znuA)          1  1.56e-10          . ATGCAACAGAGTTGCAT           
DVU1343_p-217(znuA)           1  1.56e-10          . ATGCAACAGTGTTGCAT           
Dde_2208_p-48(znuA)           1  3.11e-10          . ATGCAACTGAGTTGCAT           
DMR_26850_p0(znuA)            1  1.81e-09          . ATGCAACTTTGTTGCAT           
Dbac_0624_p-46(znuA)          1  6.69e-09          . ATGCAATCCTGTTGCAT           
Desal_1080_p-220(znuC)        1  4.56e-08          . ATGAATAAAAGTTGCAT           
--------------------------------------------------------------------------------

--------------------------------------------------------------------------------
	Motif ATGCAACWGWGTTGCAT MEME-1 block diagrams
--------------------------------------------------------------------------------
SEQUENCE NAME            POSITION P-VALUE  MOTIF DIAGRAM
-------------            ----------------  -------------
DvMF_0119_p-56(znuA)              1.6e-10  [+1]
DVU1343_p-217(znuA)               1.6e-10  [+1]
Dde_2208_p-48(znuA)               3.1e-10  [+1]
DMR_26850_p0(znuA)                1.8e-09  [+1]
Dbac_0624_p-46(znuA)              6.7e-09  [+1]
Desal_1080_p-220(znuC)            4.6e-08  [+1]
--------------------------------------------------------------------------------

--------------------------------------------------------------------------------
	Motif ATGCAACWGWGTTGCAT MEME-1 in BLOCKS format
--------------------------------------------------------------------------------
BL   MOTIF ATGCAACWGWGTTGCAT width=17 seqs=6
DvMF_0119_p-56(znuA)     (    1) ATGCAACAGAGTTGCAT  1 
DVU1343_p-217(znuA)      (    1) ATGCAACAGTGTTGCAT  1 
Dde_2208_p-48(znuA)      (    1) ATGCAACTGAGTTGCAT  1 
DMR_26850_p0(znuA)       (    1) ATGCAACTTTGTTGCAT  1 
Dbac_0624_p-46(znuA)     (    1) ATGCAATCCTGTTGCAT  1 
Desal_1080_p-220(znuC)   (    1) ATGAATAAAAGTTGCAT  1 
//

--------------------------------------------------------------------------------

--------------------------------------------------------------------------------
	Motif ATGCAACWGWGTTGCAT MEME-1 position-specific scoring matrix
--------------------------------------------------------------------------------
log-odds matrix: alength= 4 w= 17 n= 6 bayes= 0.192645 E= 9.0e-024 
   168   -923   -923   -923 
  -923   -923   -923    168 
  -923   -923    227   -923 
   -90    229   -923   -923 
   168   -923   -923   -923 
   142   -923   -923    -90 
   -90    197   -923    -90 
    68     -3   -923     10 
   -90     -3    127    -90 
    68   -923   -923     68 
  -923   -923    227   -923 
  -923   -923   -923    168 
  -923   -923   -923    168 
  -923   -923    227   -923 
  -923    256   -923   -923 
   168   -923   -923   -923 
  -923   -923   -923    168 
--------------------------------------------------------------------------------

--------------------------------------------------------------------------------
	Motif ATGCAACWGWGTTGCAT MEME-1 position-specific probability matrix
--------------------------------------------------------------------------------
letter-probability matrix: alength= 4 w= 17 nsites= 6 E= 9.0e-024 
 1.000000  0.000000  0.000000  0.000000 
 0.000000  0.000000  0.000000  1.000000 
 0.000000  0.000000  1.000000  0.000000 
 0.166667  0.833333  0.000000  0.000000 
 1.000000  0.000000  0.000000  0.000000 
 0.833333  0.000000  0.000000  0.166667 
 0.166667  0.666667  0.000000  0.166667 
 0.500000  0.166667  0.000000  0.333333 
 0.166667  0.166667  0.500000  0.166667 
 0.500000  0.000000  0.000000  0.500000 
 0.000000  0.000000  1.000000  0.000000 
 0.000000  0.000000  0.000000  1.000000 
 0.000000  0.000000  0.000000  1.000000 
 0.000000  0.000000  1.000000  0.000000 
 0.000000  1.000000  0.000000  0.000000 
 1.000000  0.000000  0.000000  0.000000 
 0.000000  0.000000  0.000000  1.000000 
--------------------------------------------------------------------------------

--------------------------------------------------------------------------------
	Motif ATGCAACWGWGTTGCAT MEME-1 regular expression
--------------------------------------------------------------------------------
ATGCAAC[AT]G[AT]GTTGCAT
--------------------------------------------------------------------------------




Time  0.01 secs.

********************************************************************************


********************************************************************************
SUMMARY OF MOTIFS
********************************************************************************

--------------------------------------------------------------------------------
	Combined block diagrams: non-overlapping sites with p-value < 0.0001
--------------------------------------------------------------------------------
SEQUENCE NAME            COMBINED P-VALUE  MOTIF DIAGRAM
-------------            ----------------  -------------
DVU1343_p-217(znuA)              1.56e-10  [+1(1.56e-10)]
DvMF_0119_p-56(znuA)             1.56e-10  [+1(1.56e-10)]
Dde_2208_p-48(znuA)              3.11e-10  [+1(3.11e-10)]
Desal_1080_p-220(znuC)           4.56e-08  [+1(4.56e-08)]
DMR_26850_p0(znuA)               1.81e-09  [+1(1.81e-09)]
Dbac_0624_p-46(znuA)             6.69e-09  [+1(6.69e-09)]
--------------------------------------------------------------------------------

********************************************************************************


********************************************************************************
Stopped because requested number of motifs (1) found.
********************************************************************************

CPU: optimus

********************************************************************************
